username,to,text,retweets,favorites,replies,id,permalink,author_id,date,formatted_date,mentions,hashtags,geo,urls
yfblanchet,,Premiers sur le terrain! ⁦ @BlocQuebecois⁩ ⁦ @Simon_Marchand⁩ « Des poseurs de pancartes déjà au travail! » | TVA Nouvelleshttps://www.tvanouvelles.ca/2019/09/10/des-poseurs-de-pancartes-deja-au-travail …,15,39,4,1171744775260819457,https://twitter.com/yfblanchet/status/1171744775260819457,38262290,2019-09-11 11:18:19+00:00,Wed Sep 11 11:18:19 +0000 2019,@BlocQuebecois @Simon_Marchand,,,https://www.tvanouvelles.ca/2019/09/10/des-poseurs-de-pancartes-deja-au-travail
AndrewScheer,,"On the 18th anniversary of the 9/11 attack, and on the National Day of Service, we pause to remember those who were lost, mourn with their loved ones, and honour those who defend our freedom. My statement: https://www.facebook.com/AndrewScheerMP/posts/2916382748395458 …pic.twitter.com/CyLDuK3IAR",599,1935,61,1171742390337585152,https://twitter.com/AndrewScheer/status/1171742390337585152,256360738,2019-09-11 11:08:50+00:00,Wed Sep 11 11:08:50 +0000 2019,,,,https://www.facebook.com/AndrewScheerMP/posts/2916382748395458
AndrewScheer,,"À l’occasion du 18e anniversaire des attentats du 11 septembre 2001 et de la Journée nationale du service, nous nous souvenons de ceux qui ont perdu la vie, partageons le deuil de leurs proches et honorons ceux qui défendent notre liberté. Ma déclaration : https://www.facebook.com/AndrewScheerMP/posts/2916380585062341 …pic.twitter.com/J6JPyHop1g",16,46,2,1171742378132234240,https://twitter.com/AndrewScheer/status/1171742378132234240,256360738,2019-09-11 11:08:47+00:00,Wed Sep 11 11:08:47 +0000 2019,,,,https://www.facebook.com/AndrewScheerMP/posts/2916380585062341
yfblanchet,,Merci Geneviève @Lobstineuse et toute l’équipe. Levons les amarres et embrassons le grand vent! Nous naviguons vers un beau pays! pic.twitter.com/YYUgEmOJjG,14,40,3,1171727269846536192,https://twitter.com/yfblanchet/status/1171727269846536192,38262290,2019-09-11 10:08:45+00:00,Wed Sep 11 10:08:45 +0000 2019,@Lobstineuse,,,
yfblanchet,BenoitStH,"Aucune sympathie pour les énergies fossiles, d’un autre temps et qui portent bien leur nom... Il faut toutefois attendre le rapport du BAPE, sinon à quoi sert-il? Et il faut une étude sur l’impact du trafic maritime sur les écosystème de la rivière Saguenay.https://twitter.com/BenoitStH/status/1171103533443276800 …",22,31,5,1171724698280968192,https://twitter.com/yfblanchet/status/1171724698280968192,38262290,2019-09-11 09:58:32+00:00,Wed Sep 11 09:58:32 +0000 2019,,,,https://twitter.com/BenoitStH/status/1171103533443276800
yfblanchet,,"Intégrité? C’est bien la ministre qui a lynché #SNCLavalin, que J.Trudeau n’a eu ni le courage ni l’intelligence de sauver. 3000 travailleurs sans reproches paient le prix... Jeter une expertise québécoise en pâture à des racheteurs qui ne le sont pas...https://www.lapresse.ca/actualites/politique/201909/10/01-5240675-jody-wilson-raybould-justifie-les-depenses-pour-son-mari.php …",12,14,1,1171723633280073729,https://twitter.com/yfblanchet/status/1171723633280073729,38262290,2019-09-11 09:54:18+00:00,Wed Sep 11 09:54:18 +0000 2019,,#SNCLavalin,,https://www.lapresse.ca/actualites/politique/201909/10/01-5240675-jody-wilson-raybould-justifie-les-depenses-pour-son-mari.php
JustinTrudeau,,"Just spoke with @BrianPallister following today’s election in Manitoba. Congratulations again, Brian, on your re-election as Premier.https://pm.gc.ca/en/news/statements/2019/09/10/statement-prime-minister-results-provincial-election-manitoba …",55,499,193,1171620725947555840,https://twitter.com/JustinTrudeau/status/1171620725947555840,14260960,2019-09-11 03:05:23+00:00,Wed Sep 11 03:05:23 +0000 2019,@BrianPallister,,,https://pm.gc.ca/en/news/statements/2019/09/10/statement-prime-minister-results-provincial-election-manitoba
JustinTrudeau,,"Je viens de parler à @BrianPallister à la suite de l'élection d'aujourd'hui au Manitoba. Félicitations encore une fois, Brian, pour votre réélection en tant que premier ministre.https://pm.gc.ca/fr/nouvelles/declarations/2019/09/10/declaration-du-premier-ministre-concernant-les-resultats-des …",16,146,14,1171620515221520385,https://twitter.com/JustinTrudeau/status/1171620515221520385,14260960,2019-09-11 03:04:33+00:00,Wed Sep 11 03:04:33 +0000 2019,@BrianPallister,,,https://pm.gc.ca/fr/nouvelles/declarations/2019/09/10/declaration-du-premier-ministre-concernant-les-resultats-des
yfblanchet,,"Une campagne électorale... Quel bon moment pour traiter les blancs de mémoires. Même A.Scheer est plus crédible. Étonnant courant contre la liberté de choix pour les femmes au Canada, même chez les progressistes... pro-pétrole. Jamais au @BlocQuebecois https://ici.radio-canada.ca/nouvelle/1294084/parti-vert-deux-candidats-contre-avortement-elections-canada-2019 …",42,44,7,1171614128324190208,https://twitter.com/yfblanchet/status/1171614128324190208,38262290,2019-09-11 02:39:10+00:00,Wed Sep 11 02:39:10 +0000 2019,@BlocQuebecois,,,https://ici.radio-canada.ca/nouvelle/1294084/parti-vert-deux-candidats-contre-avortement-elections-canada-2019
AndrewScheer,,Congratulations Premier @BrianPallister! Momentum continues to build for strong conservative governments dedicated to putting more money in the pockets of hardworking families. I look forward to working with you to help all Manitobans get ahead.pic.twitter.com/bUx3TI977b,395,1520,99,1171611057804251136,https://twitter.com/AndrewScheer/status/1171611057804251136,256360738,2019-09-11 02:26:58+00:00,Wed Sep 11 02:26:58 +0000 2019,@BrianPallister,,,
AndrewScheer,,Félicitations au premier ministre @BrianPallister! L’élan continue de s’intensifier en faveur de gouvernements conservateurs qui vont mettre plus d’argent dans les poches des familles. J’ai hâte de travailler avec vous pour aider tous les Manitobains à améliorer leur quotidien.pic.twitter.com/tM8k2T4BfV,21,59,3,1171611046039228416,https://twitter.com/AndrewScheer/status/1171611046039228416,256360738,2019-09-11 02:26:55+00:00,Wed Sep 11 02:26:55 +0000 2019,@BrianPallister,,,
theJagmeetSingh,,"The stories we heard tonight in London made it clear to me that whether it's expanding health care or fixing the housing crisis, people need a government that's actually in it for them. No more catering to big corporations or the ultra-rich – we need to put people first. #elxn43pic.twitter.com/216tatEEhN",51,193,13,1171603526134509568,https://twitter.com/theJagmeetSingh/status/1171603526134509568,253340075,2019-09-11 01:57:02+00:00,Wed Sep 11 01:57:02 +0000 2019,,#elxn43pic,,
theJagmeetSingh,,"Trop de gens souffrent des décisions prises à Ottawa en faveur des ultra riches et puissant∙es. J’ai bien compris à London ce soir que les gens ont besoin d'un gouv. à leur service, tant pour étendre les soins de santé que pour régler la crise du logement. #elxn43pic.twitter.com/GyLLRu7lTW",7,18,0,1171603513530552320,https://twitter.com/theJagmeetSingh/status/1171603513530552320,253340075,2019-09-11 01:56:59+00:00,Wed Sep 11 01:56:59 +0000 2019,,#elxn43pic,,
yfblanchet,,"Notre candidate dans Beauport-Côte-de-Beaupré-Île-d’Orléans-Charlevoix: la merveilleuse Caroline Desbiens. Le retour de la fierté, du talent et du patriotisme, entrepreneure en plus! pic.twitter.com/d1KebH5rD2",19,43,2,1171592997789716481,https://twitter.com/yfblanchet/status/1171592997789716481,38262290,2019-09-11 01:15:12+00:00,Wed Sep 11 01:15:12 +0000 2019,,,,
MaximeBernier,,Party leaders Maxime Bernier and Jagmeet Singh jumpstart their campaigns in Londonhttps://lfpress.com/news/local-news/party-leaders-bernier-and-singh-jumpstart-their-campaigns-in-london/ …,108,332,20,1171589124626812928,https://twitter.com/MaximeBernier/status/1171589124626812928,2791988124,2019-09-11 00:59:49+00:00,Wed Sep 11 00:59:49 +0000 2019,,,,https://lfpress.com/news/local-news/party-leaders-bernier-and-singh-jumpstart-their-campaigns-in-london/
MaximeBernier,,PPC Leader Maxime Bernier defends immigration polices at pre-campaign event in Londonhttps://globalnews.ca/news/5884555/ppc-maxime-bernier-pre-campaign-london/ …,208,603,48,1171581345077891073,https://twitter.com/MaximeBernier/status/1171581345077891073,2791988124,2019-09-11 00:28:54+00:00,Wed Sep 11 00:28:54 +0000 2019,,,,https://globalnews.ca/news/5884555/ppc-maxime-bernier-pre-campaign-london/
AndrewScheer,,Nous sommes prêts. pic.twitter.com/L2URPYRpm4,54,208,36,1171574827192221696,https://twitter.com/AndrewScheer/status/1171574827192221696,256360738,2019-09-11 00:03:00+00:00,Wed Sep 11 00:03:00 +0000 2019,,,,
AndrewScheer,,We're ready. pic.twitter.com/INQyRMeWJZ,764,3141,1337,1171574827011866624,https://twitter.com/AndrewScheer/status/1171574827011866624,256360738,2019-09-11 00:03:00+00:00,Wed Sep 11 00:03:00 +0000 2019,,,,
