username,to,text,retweets,favorites,replies,id,permalink,author_id,date,formatted_date,mentions,hashtags,geo,urls
JustinTrudeau,,"On the last day of Passover, we grieve with Jewish communities in the San Diego area & around the world after today’s attack at a synagogue. These acts of hatred & violence have to end, and we must all come together to stand up against them.",878,4275,165,1122283836228816896,https://twitter.com/JustinTrudeau/status/1122283836228816896,14260960,2019-04-27 23:38:12+00:00,Sat Apr 27 23:38:12 +0000 2019,,,,
JustinTrudeau,,"En ce dernier jour de Pessah, nous pleurons avec les communautés juives de la région de San Diego et du monde après l'attentat perpétré contre une synagogue aujourd'hui. Ces actes de haine et de violence doivent cesser, et nous devons tous nous unir pour les dénoncer.",108,509,21,1122283741240446976,https://twitter.com/JustinTrudeau/status/1122283741240446976,14260960,2019-04-27 23:37:49+00:00,Sat Apr 27 23:37:49 +0000 2019,,,,
theJagmeetSingh,GeorgeNDP,I would say just follow your heart and be brave ;),2,21,1,1122275614449446913,https://twitter.com/theJagmeetSingh/status/1122275614449446913,253340075,2019-04-27 23:05:32+00:00,Sat Apr 27 23:05:32 +0000 2019,,,,
yfblanchet,MichelDuchesne8,"Plusieurs aspirants candidats à la marche aujourd’hui: @SPSTremblay, @MichelDuchesne8, @Simon_Marchand et @seblemire. Les filles? Occupées! 3 investitures féminines en fin de semaine: @m_pauze, @CDeBellefeuille et Lizabel Nitoi! Un nouveau @BlocQuebecois pour un Québec vert.https://twitter.com/MichelDuchesne8/status/1122213554151723008 …",27,55,3,1122266668565135360,https://twitter.com/yfblanchet/status/1122266668565135360,38262290,2019-04-27 22:29:59+00:00,Sat Apr 27 22:29:59 +0000 2019,@SPSTremblay @MichelDuchesne8 @Simon_Marchand @seblemire @m_pauze @CDeBellefeuille @BlocQuebecois,,,https://twitter.com/MichelDuchesne8/status/1122213554151723008
MaximeBernier,CBCPolitics,Hypocritical virtue-signalling. The three words that will best summarize Trudeau’s governing style. Signalement de vertu hypocrite. Les trois mots qui vont le mieux résumer le style de gouvernement de Trudeau.https://twitter.com/CBCPolitics/status/1122196009470312449 …,325,977,103,1122260756421128197,https://twitter.com/MaximeBernier/status/1122260756421128197,2791988124,2019-04-27 22:06:29+00:00,Sat Apr 27 22:06:29 +0000 2019,,,,https://twitter.com/CBCPolitics/status/1122196009470312449
ElizabethMay,MarcLeeCCPA,And other confused narratives mistakenly claim the pipeline expansion is for BC use. But it is 100% bitumen (unusable in our refineries) headed for export. #GPChttps://twitter.com/MarcLeeCCPA/status/1121455213582282752 …,134,245,22,1122234312261349382,https://twitter.com/ElizabethMay/status/1122234312261349382,16220555,2019-04-27 20:21:24+00:00,Sat Apr 27 20:21:24 +0000 2019,,#GPChttps,,https://twitter.com/MarcLeeCCPA/status/1121455213582282752
AndrewScheer,,"Quebecers are gathered in Victoriaville to rally around our strong Conservative team, ready to defeat the federal Liberals and restore a government in Ottawa that respects provincial jurisdiction and helps all Quebecers get ahead. https://www.facebook.com/AndrewScheerMP/videos/2326068970963796?sfns=mo …pic.twitter.com/WuJDl71J9u",76,246,89,1122231033208791040,https://twitter.com/AndrewScheer/status/1122231033208791040,256360738,2019-04-27 20:08:23+00:00,Sat Apr 27 20:08:23 +0000 2019,,,,https://www.facebook.com/AndrewScheerMP/videos/2326068970963796?sfns=mo
AndrewScheer,,"Les Québécois sont réunis à Victoriaville avec notre solide équipe conservatrice, prête à défaire les libéraux fédéraux et à rétablir à Ottawa un gouvernement qui respecte les champs de compétence et aide tous les Québécois à améliorer leur quotidien. https://www.facebook.com/AndrewScheerMP/videos/2326068970963796?sfns=mo …pic.twitter.com/p3mnNm3Ox7",16,35,3,1122230936794357760,https://twitter.com/AndrewScheer/status/1122230936794357760,256360738,2019-04-27 20:08:00+00:00,Sat Apr 27 20:08:00 +0000 2019,,,,https://www.facebook.com/AndrewScheerMP/videos/2326068970963796?sfns=mo
AndrewScheer,,"While Justin Trudeau’s policies make life more expensive, I am working to find ways to make it more affordable. One simple change a Conservative Government would make is to take the GST off your home energy bills. #TaxFreeHomeHeatingpic.twitter.com/KIQ8xKV0Pi",60,285,85,1122223015914131457,https://twitter.com/AndrewScheer/status/1122223015914131457,256360738,2019-04-27 19:36:31+00:00,Sat Apr 27 19:36:31 +0000 2019,,#TaxFreeHomeHeatingpic,,
AndrewScheer,,"Alors que les politiques de Justin Trudeau augmentent le coût de la vie, je cherche à la rendre plus abordable. Un changement simple qu’apportera un gouvernement conservateur sera d’éliminer la TPS sur les factures d’énergie résidentielle. #PasDeTaxeSurLeChauffageRésidentielpic.twitter.com/hAo1zviueG",4,20,4,1122222999065616384,https://twitter.com/AndrewScheer/status/1122222999065616384,256360738,2019-04-27 19:36:27+00:00,Sat Apr 27 19:36:27 +0000 2019,,#PasDeTaxeSurLeChauffageRésidentielpic,,
yfblanchet,,"UN PROGRAMME VERT... OU NOIR? Un plan environmental sans tarif sur le carbone et avec l’oléoduc Énergie Est, ce n’est juste pas un plan environnemental. On se parle en juin... @CathLvesquehttps://www.ledevoir.com/politique/canada/553127/les-conservateurs-veulent-fouetter-les-troupes-a-six-mois-des-elections …",13,13,3,1122205284078956545,https://twitter.com/yfblanchet/status/1122205284078956545,38262290,2019-04-27 18:26:03+00:00,Sat Apr 27 18:26:03 +0000 2019,@CathLvesquehttps,,,https://www.ledevoir.com/politique/canada/553127/les-conservateurs-veulent-fouetter-les-troupes-a-six-mois-des-elections
yfblanchet,,"Le @BlocQuebecois a aussi connu un Michel Gauthier qui ne ressemble en rien à celui qui bosse pour les Conservateurs, plus noirs que noirs. Je ne le blâme pas. Je le comprends, même: le Bloc ne pourrait et ne voudrait pas le nommer sénateur. @CathLvesque https://www.ledevoir.com/politique/canada/553127/les-conservateurs-veulent-fouetter-les-troupes-a-six-mois-des-elections …",42,64,9,1122203697587597313,https://twitter.com/yfblanchet/status/1122203697587597313,38262290,2019-04-27 18:19:45+00:00,Sat Apr 27 18:19:45 +0000 2019,@BlocQuebecois @CathLvesque,,,https://www.ledevoir.com/politique/canada/553127/les-conservateurs-veulent-fouetter-les-troupes-a-six-mois-des-elections
MaximeBernier,EmKraemer,"You don’t get the point. Why the fear-mongering headlines everywhere to get ppl to believe the situation is worse in their country when it’s not? To drum up support for taxes? As McKitrick wrote, “the scary headline only confirms that we are on land.” https://business.financialpost.com/opinion/ross-mckitrick-hold-the-panic-canada-just-warmed-1-7-degrees-and-thrived …https://twitter.com/EmKraemer/status/1121951227015598080 …",126,310,38,1122193634932211712,https://twitter.com/MaximeBernier/status/1122193634932211712,2791988124,2019-04-27 17:39:46+00:00,Sat Apr 27 17:39:46 +0000 2019,,,,"https://business.financialpost.com/opinion/ross-mckitrick-hold-the-panic-canada-just-warmed-1-7-degrees-and-thrived,https://twitter.com/EmKraemer/status/1121951227015598080"
MaximeBernier,PPCBruceGreyOS,"Les sceptiques disaient que ça n’arriverait jamais. Eh bien les voilà! Au cours des prochaines semaines, des candidat(e)s seront acclamés, ou élus s’il y a une course à l’investiture, pour défendre les couleurs du PPC en octobre. Bienvenue dans notre équipe, Bill!https://twitter.com/PPCBruceGreyOS/status/1121918774410563585 …",37,101,6,1122187113322172418,https://twitter.com/MaximeBernier/status/1122187113322172418,2791988124,2019-04-27 17:13:51+00:00,Sat Apr 27 17:13:51 +0000 2019,,,,https://twitter.com/PPCBruceGreyOS/status/1121918774410563585
JustinTrudeau,,"Communities across Ontario, Quebec, and New Brunswick have been hard at work helping those affected by flooding - it’s inspiring to see so many Canadians come together when our neighbours are in need. If you can, take some time today to volunteer!pic.twitter.com/MRtG3xz3aI",323,1492,367,1122186146669387777,https://twitter.com/JustinTrudeau/status/1122186146669387777,14260960,2019-04-27 17:10:01+00:00,Sat Apr 27 17:10:01 +0000 2019,,,,
MaximeBernier,PPCBruceGreyOS,"They said it wouldn’t happen. Well, here they are! Welcome to our team, Bill! In the coming days and weeks, more and more candidates will be acclaimed, or elected where there are nomination races, to defend the @peoplespca colours in October. Give them your support!https://twitter.com/PPCBruceGreyOS/status/1121918774410563585 …",187,483,16,1122186083368935424,https://twitter.com/MaximeBernier/status/1122186083368935424,2791988124,2019-04-27 17:09:46+00:00,Sat Apr 27 17:09:46 +0000 2019,@peoplespca,,,https://twitter.com/PPCBruceGreyOS/status/1121918774410563585
JustinTrudeau,,"Des communautés de l’Ontario, du Québec et du Nouveau-Brunswick travaillent fort pour aider les victimes des inondations – c’est inspirant de voir tellement de Canadiens s’unir quand leurs voisins sont dans le besoin. Si vous le pouvez, prenez du temps pour agir comme bénévole!pic.twitter.com/YKyylm7GaI",64,379,35,1122185975654957057,https://twitter.com/JustinTrudeau/status/1122185975654957057,14260960,2019-04-27 17:09:20+00:00,Sat Apr 27 17:09:20 +0000 2019,,,,
JustinTrudeau,,It’s an exciting day for soccer fans: The Canadian Premier League kicks off today. Good luck to @York9FC & @ForgeFCHamilton in the first-ever @CPLsoccer match. #CanPL,379,1750,62,1122182318540689409,https://twitter.com/JustinTrudeau/status/1122182318540689409,14260960,2019-04-27 16:54:48+00:00,Sat Apr 27 16:54:48 +0000 2019,@York9FC @ForgeFCHamilton @CPLsoccer,#CanPL,,
JustinTrudeau,,C’est un grand jour pour les amateurs de soccer : c’est aujourd'hui le coup d’envoi de la Première ligue canadienne. Bonne chance au @York9FC et au @ForgeFCHamilton pour le tout premier match de la @CPLsoccer. #PLCan,43,262,8,1122182023790174208,https://twitter.com/JustinTrudeau/status/1122182023790174208,14260960,2019-04-27 16:53:38+00:00,Sat Apr 27 16:53:38 +0000 2019,@York9FC @ForgeFCHamilton @CPLsoccer,#PLCan,,
yfblanchet,LafranceRejean,En effet... Désolé.,0,1,0,1122171652643663873,https://twitter.com/yfblanchet/status/1122171652643663873,38262290,2019-04-27 16:12:25+00:00,Sat Apr 27 16:12:25 +0000 2019,,,,
AndrewScheer,,Quebecers deserve better than the current federal Liberal government in Ottawa. Canada’s Conservatives are ready to restore a government in Ottawa that respects provincial jurisdiction and helps all Quebecers get ahead. WATCH LIVE FROM VICTORIAVILLE: https://www.facebook.com/120693171297777/videos/2326068970963796/ …,62,237,75,1122158995911991296,https://twitter.com/AndrewScheer/status/1122158995911991296,256360738,2019-04-27 15:22:07+00:00,Sat Apr 27 15:22:07 +0000 2019,,,,https://www.facebook.com/120693171297777/videos/2326068970963796/
AndrewScheer,,Les Québécois méritent mieux que ce gouvernement libéral à Ottawa. Les conservateurs du Canada sont prêts à rétablir un gouvernement qui respecte les compétences provinciales et aide les Québécois à améliorer leur quotidien. EN DIRECT DE VICTORIAVILLE: https://www.facebook.com/120693171297777/videos/2326068970963796/ …,9,31,6,1122158985489125376,https://twitter.com/AndrewScheer/status/1122158985489125376,256360738,2019-04-27 15:22:05+00:00,Sat Apr 27 15:22:05 +0000 2019,,,,https://www.facebook.com/120693171297777/videos/2326068970963796/
AndrewScheer,MacLeodProducer,The Carbon Tax is going to cost farmers far more than Justin Trudeau will admit. Why is he punishing farmers and farm families but giving massive discounts to the biggest polluters? I’ll scrap his tax and make life more affordable.https://twitter.com/MacLeodProducer/status/1116730210462896129 …,547,1400,264,1122139875577217028,https://twitter.com/AndrewScheer/status/1122139875577217028,256360738,2019-04-27 14:06:09+00:00,Sat Apr 27 14:06:09 +0000 2019,,,,https://twitter.com/MacLeodProducer/status/1116730210462896129
AndrewScheer,MacLeodProducer,La taxe sur le carbone coûtera plus aux agriculteurs que ce que Justin Trudeau veut admettre. Pourquoi punir les agriculteurs et les fermes familiales en donnant des réductions massives aux plus gros pollueurs? J’abolirai sa taxe et rendrai la vie plus abordable.https://twitter.com/MacLeodProducer/status/1116730210462896129 …,11,31,3,1122139821953011712,https://twitter.com/AndrewScheer/status/1122139821953011712,256360738,2019-04-27 14:05:56+00:00,Sat Apr 27 14:05:56 +0000 2019,,,,https://twitter.com/MacLeodProducer/status/1116730210462896129
JustinTrudeau,,"25 years ago, the people of South Africa chose Nelson Mandela as their president in the country’s first election open to all voters. Today, we join South Africans to commemorate the anniversary of the first democratic elections & the end of the apartheid.https://pm.gc.ca/eng/news/2019/04/27/statement-prime-minister-south-africa-freedom-day …",607,2909,294,1122126189840064512,https://twitter.com/JustinTrudeau/status/1122126189840064512,14260960,2019-04-27 13:11:46+00:00,Sat Apr 27 13:11:46 +0000 2019,,,,https://pm.gc.ca/eng/news/2019/04/27/statement-prime-minister-south-africa-freedom-day
JustinTrudeau,,"Il y a 25 ans, les Sud-Africains ont élu Nelson Mandela comme président lors des premières élections ouvertes à tous les électeurs. Nous nous joignons à eux pour souligner l’anniversaire des premières élections démocratiques et de la fin de l’apartheid.https://pm.gc.ca/fra/nouvelles/2019/04/27/declaration-du-premier-ministre-loccasion-du-jour-de-la-liberte-afrique-du-sud …",49,272,25,1122126047946821632,https://twitter.com/JustinTrudeau/status/1122126047946821632,14260960,2019-04-27 13:11:12+00:00,Sat Apr 27 13:11:12 +0000 2019,,,,https://pm.gc.ca/fra/nouvelles/2019/04/27/declaration-du-premier-ministre-loccasion-du-jour-de-la-liberte-afrique-du-sud
yfblanchet,,"Le PM Trudeau a acheté - trop cher selon le Directeur du budget - un oléoduc désuet de 4,5G$, et provisionné 5,2G$. Il envisage de l'abandonner pour des votes dans l'Est mais pourrait aller de l'avant pour des votes dans l'Ouest. 5 milliards trop tard…!https://ici.radio-canada.ca/nouvelle/1166542/trudeau-pression-interne-abandon-expansion-trans-mountain …",28,20,2,1122110312226934784,https://twitter.com/yfblanchet/status/1122110312226934784,38262290,2019-04-27 12:08:40+00:00,Sat Apr 27 12:08:40 +0000 2019,,,,https://ici.radio-canada.ca/nouvelle/1166542/trudeau-pression-interne-abandon-expansion-trans-mountain
yfblanchet,,"À moins que les Conservateurs ne viennent dire aux Québécois « Nous: • renonçons à Énergie Est et au transport pétrolier par train • soutiendrons la laïcité de l’État québécois • imposeront le respect du français en Ontario » c’est du vide, tout ça.https://www.lenouvelliste.ca/actualites/politique/le-parti-conservateur-veut-surfer-sur-la-vague-de-la-caq-30822c798a79fdd34e558485eed310ea …",64,123,15,1122089448806735872,https://twitter.com/yfblanchet/status/1122089448806735872,38262290,2019-04-27 10:45:46+00:00,Sat Apr 27 10:45:46 +0000 2019,,,,https://www.lenouvelliste.ca/actualites/politique/le-parti-conservateur-veut-surfer-sur-la-vague-de-la-caq-30822c798a79fdd34e558485eed310ea
yfblanchet,JF_Gaumond,"Il y aurait une faible minorité de gens qui l’accueilleraient mieux, mais peu. Le Québec est en pénurie de main-d’oeuvre et cherche de meilleurs emplois. Ceux-ci seraient peu durable. Le Québec a rejeté plusieurs projets de ce type également. Maturité et remplacement du pétrole.",0,3,2,1122086470456627203,https://twitter.com/yfblanchet/status/1122086470456627203,38262290,2019-04-27 10:33:56+00:00,Sat Apr 27 10:33:56 +0000 2019,,,,
AndrewScheer,BlueJays,Finally! Can’t wait to see what @vladdyjr27 does in the big leagues!https://twitter.com/BlueJays/status/1121808625427550208 …,9,111,9,1121947093625479168,https://twitter.com/AndrewScheer/status/1121947093625479168,256360738,2019-04-27 01:20:06+00:00,Sat Apr 27 01:20:06 +0000 2019,@vladdyjr27,,,https://twitter.com/BlueJays/status/1121808625427550208
AndrewScheer,BlueJays,Enfin! Impatient de voir ce que @vladdyjr27 fera dans les ligues majeures!https://twitter.com/BlueJays/status/1121808625427550208 …,2,19,1,1121947075099316225,https://twitter.com/AndrewScheer/status/1121947075099316225,256360738,2019-04-27 01:20:02+00:00,Sat Apr 27 01:20:02 +0000 2019,@vladdyjr27,,,https://twitter.com/BlueJays/status/1121808625427550208
yfblanchet,Louis_Fortier,Tout ce que l’ouest veut faire passer au Québec est destiné à l’exportation. Pas du tout à notre (trop importante) consommation domestique.,0,3,1,1121940878963236864,https://twitter.com/yfblanchet/status/1121940878963236864,38262290,2019-04-27 00:55:24+00:00,Sat Apr 27 00:55:24 +0000 2019,,,,
