username,to,text,retweets,favorites,replies,id,permalink,author_id,date,formatted_date,mentions,hashtags,geo,urls
AndrewScheer,,"This affair strikes at heart of the kind of country Canada will be. Do we want Canada to be a country where the Prime Minister is above the law, where he or she can decide who gets prosecuted and who doesn’t? This country only works because the rule of law holds it together.pic.twitter.com/pqrnU3qhzo",332,956,284,1163600569698832388,https://twitter.com/AndrewScheer/status/1163600569698832388,256360738,2019-08-19 23:56:09+00:00,Mon Aug 19 23:56:09 +0000 2019,,,,
AndrewScheer,,"Cette affaire empêche le Canada d’être le pays qu’il doit être. Voulons-nous d’un Canada où le premier ministre est au-dessus des lois, où il/elle pourra décider de qui sera poursuivi et de qui ne le sera pas ? Notre pays est ce qu’il est grâce à la primauté du droit.pic.twitter.com/0M0AlCcHXK",10,24,7,1163600490317406208,https://twitter.com/AndrewScheer/status/1163600490317406208,256360738,2019-08-19 23:55:50+00:00,Mon Aug 19 23:55:50 +0000 2019,,,,
MaximeBernier,,2/ Et voici le plan du @ppopulaireca pour y arriver.https://www.partipopulaireducanada.ca/perequation_l_equite_pour_toutes_les_provinces …,24,56,0,1163599186224439301,https://twitter.com/MaximeBernier/status/1163599186224439301,2791988124,2019-08-19 23:50:39+00:00,Mon Aug 19 23:50:39 +0000 2019,@ppopulaireca,,,https://www.partipopulaireducanada.ca/perequation_l_equite_pour_toutes_les_provinces
MaximeBernier,,1/ @francoislegault est vraiment mal informé s’il croit que «La péréquation est dans la Constitution depuis le jour 1 du Canada». Le programme a été créé en 1957. Et on peut toujours le changer pour le rendre plus équitable pour TOUTES les provinces.https://www.journaldemontreal.com/2019/08/18/referendum-en-alberta-la-perequation-est-un-droit-clame-legault …,29,63,7,1163598921337319429,https://twitter.com/MaximeBernier/status/1163598921337319429,2791988124,2019-08-19 23:49:36+00:00,Mon Aug 19 23:49:36 +0000 2019,@francoislegault,,,https://www.journaldemontreal.com/2019/08/18/referendum-en-alberta-la-perequation-est-un-droit-clame-legault
MaximeBernier,,2/ And here’s the @peoplespca plan to do it.https://www.peoplespartyofcanada.ca/equalization_fairness_for_all_provinces …,129,329,8,1163597720520548352,https://twitter.com/MaximeBernier/status/1163597720520548352,2791988124,2019-08-19 23:44:49+00:00,Mon Aug 19 23:44:49 +0000 2019,@peoplespca,,,https://www.peoplespartyofcanada.ca/equalization_fairness_for_all_provinces
MaximeBernier,mtlgazette,"1/ @francoislegault is badly misinformed if he believes that “when Quebec got into Canada, equalization was in the plan. It is part of the original deal.” The program began only in 1957. And there is no reason we cannot change it today to make it fairer for ALL provinces.https://twitter.com/mtlgazette/status/1163236628011323393 …",206,483,21,1163597425422061570,https://twitter.com/MaximeBernier/status/1163597425422061570,2791988124,2019-08-19 23:43:39+00:00,Mon Aug 19 23:43:39 +0000 2019,@francoislegault,,,https://twitter.com/mtlgazette/status/1163236628011323393
AndrewScheer,,The Dieppe Raid laid the groundwork for a successful D-Day. Join me in honouring those who fought for Canada in this raid and throughout World War II. Lest we forget. My statement: https://www.facebook.com/AndrewScheerMP/posts/2865969843436749 …pic.twitter.com/TEgb40aNed,30,126,11,1163593732928811008,https://twitter.com/AndrewScheer/status/1163593732928811008,256360738,2019-08-19 23:28:59+00:00,Mon Aug 19 23:28:59 +0000 2019,,,,https://www.facebook.com/AndrewScheerMP/posts/2865969843436749
AndrewScheer,,Le Raid de Dieppe a jeté les bases du succès du Débarquement de Normandie. Joignez-vous à moi pour commémorer ceux qui se sont battus pour le Canada lors de ce raid et durant la Deuxième Guerre mondiale. Ne l’oublions jamais. Ma déclaration: https://www.facebook.com/AndrewScheerMP/posts/2865969496770117 …pic.twitter.com/9AkOERjjhZ,4,15,0,1163593676557291520,https://twitter.com/AndrewScheer/status/1163593676557291520,256360738,2019-08-19 23:28:45+00:00,Mon Aug 19 23:28:45 +0000 2019,,,,https://www.facebook.com/AndrewScheerMP/posts/2865969496770117
AndrewScheer,,"Peu importe qui vous êtes ou ce que vous faites, la loi est la loi. Tous les Canadiens sont égaux sous elle. Vous méritez un premier ministre qui appliquera ce principe coûte que coûte.pic.twitter.com/YwLINHF0H6",14,38,12,1163589459545247744,https://twitter.com/AndrewScheer/status/1163589459545247744,256360738,2019-08-19 23:12:00+00:00,Mon Aug 19 23:12:00 +0000 2019,,,,
AndrewScheer,,"No matter who you are, or what you do, the law is the law is the law. All Canadians are equal under it. You deserve a Prime Minister who will abide by it, no matter what.pic.twitter.com/7AVWtTLtYR",267,882,309,1163589459545165824,https://twitter.com/AndrewScheer/status/1163589459545165824,256360738,2019-08-19 23:12:00+00:00,Mon Aug 19 23:12:00 +0000 2019,,,,
JustinTrudeau,,"Had a good meeting with Mayor Labeaume in Quebec City today, focused on how we’ll keep working together to build a stronger economy, create jobs, protect the environment, and invest to make life easier for families – like the important tramway project we announced today.pic.twitter.com/bI45YLE8yf",181,1233,340,1163587547181801477,https://twitter.com/JustinTrudeau/status/1163587547181801477,14260960,2019-08-19 23:04:24+00:00,Mon Aug 19 23:04:24 +0000 2019,,,,
JustinTrudeau,,"Bonne rencontre avec le maire Labeaume à Québec sur la façon dont on travaillera ensemble pour renforcer l’économie, créer des emplois, protéger l’environnement et faciliter la vie des familles ici, comme l’important projet de tramway qu’on a annoncé aujourd'hui.pic.twitter.com/Ainn88BwF4",38,259,27,1163587407217864704,https://twitter.com/JustinTrudeau/status/1163587407217864704,14260960,2019-08-19 23:03:50+00:00,Mon Aug 19 23:03:50 +0000 2019,,,,
AndrewScheer,,My letter to the RCMP today presents what I believe are significant grounds for an investigation into whether or not Trudeau violated Section 139 of the Criminal Code – Obstructing Justice.pic.twitter.com/9eLriPCTGz,97,332,95,1163581909961547776,https://twitter.com/AndrewScheer/status/1163581909961547776,256360738,2019-08-19 22:42:00+00:00,Mon Aug 19 22:42:00 +0000 2019,,,,
AndrewScheer,,Ma lettre à la GRC démontre ce que je crois être matière suffisante à l’ouverture d’une enquête sur la possibilité que Justin Trudeau ait enfreint l’article 139 du Code criminel : entrave à la justice.pic.twitter.com/EVBQ95J9sB,7,25,6,1163581909672185856,https://twitter.com/AndrewScheer/status/1163581909672185856,256360738,2019-08-19 22:42:00+00:00,Mon Aug 19 22:42:00 +0000 2019,,,,
ElizabethMay,,Bienvenue! @pierrenantelhttps://www.ledevoir.com/politique/canada/560922/pierre-nantel-officialise-son-passage-au-parti-vert#…,5,23,1,1163579734665715712,https://twitter.com/ElizabethMay/status/1163579734665715712,16220555,2019-08-19 22:33:21+00:00,Mon Aug 19 22:33:21 +0000 2019,@pierrenantelhttps,#,,https://www.ledevoir.com/politique/canada/560922/pierre-nantel-officialise-son-passage-au-parti-vert#
ElizabethMay,,Welcome @pierrenantel Bienvenue! #PVC #GPChttps://www.cbc.ca/news/politics/pierre-nantel-greens-1.5252289 …,17,37,11,1163578950645374977,https://twitter.com/ElizabethMay/status/1163578950645374977,16220555,2019-08-19 22:30:14+00:00,Mon Aug 19 22:30:14 +0000 2019,@pierrenantel,#PVC #GPChttps,,https://www.cbc.ca/news/politics/pierre-nantel-greens-1.5252289
AndrewScheer,,About to hit the doors in Burlington with @SeanWeirONB. We’re working hard to make sure you have every opportunity to get ahead. Speaking live. Tune in! https://www.facebook.com/AndrewScheerMP/videos/2322804064624653/ …,22,86,18,1163575651502346243,https://twitter.com/AndrewScheer/status/1163575651502346243,256360738,2019-08-19 22:17:08+00:00,Mon Aug 19 22:17:08 +0000 2019,@SeanWeirONB,,,https://www.facebook.com/AndrewScheerMP/videos/2322804064624653/
AndrewScheer,,Je m’apprête à cogner aux portes de Burlington avec @SeanWeirONB. Nous travaillons fort pour donner à tous la possibilité d’améliorer leur quotidien. Je suis en direct. Ne le manquez pas ! https://www.facebook.com/AndrewScheerMP/videos/2322804064624653/ …,2,21,4,1163575639837937665,https://twitter.com/AndrewScheer/status/1163575639837937665,256360738,2019-08-19 22:17:05+00:00,Mon Aug 19 22:17:05 +0000 2019,@SeanWeirONB,,,https://www.facebook.com/AndrewScheerMP/videos/2322804064624653/
MaximeBernier,,"*NOUVELLE POLITIQUE SUR LES ANCIENS COMBATTANTS Le gouvernement du Canada a l’obligation de respecter l’engagement sacré du pays envers nos militaires, hommes et femmes, et de veiller à ce que nos anciens combattants reçoivent le soutien qu’ils méritent.https://www.partipopulaireducanada.ca/anciens_combattants_epauler_les_hommes_et_les_femmes_qui_se_sont_sacrifies_pour_notre_pays …",38,81,4,1163567401478295554,https://twitter.com/MaximeBernier/status/1163567401478295554,2791988124,2019-08-19 21:44:21+00:00,Mon Aug 19 21:44:21 +0000 2019,,,,https://www.partipopulaireducanada.ca/anciens_combattants_epauler_les_hommes_et_les_femmes_qui_se_sont_sacrifies_pour_notre_pays
AndrewScheer,,"Today, in light of both the Ethics Commissioner’s findings and the revelations about the RCMP’s previous involvement, I have formally requested the RCMP take another look into Justin Trudeau’s corruption scandal.pic.twitter.com/5IgFUAGg3d",158,547,124,1163567061970370561,https://twitter.com/AndrewScheer/status/1163567061970370561,256360738,2019-08-19 21:43:00+00:00,Mon Aug 19 21:43:00 +0000 2019,,,,
AndrewScheer,,"Compte tenu des trouvailles du commissaire à l’éthique et des révélations de l’enquête antérieure de la GRC, j’ai demandé officiellement à la GRC d’ouvrir une nouvelle enquête sur le scandale de corruption de Justin Trudeau.pic.twitter.com/1NZOvTpQ5c",5,28,7,1163567061894746112,https://twitter.com/AndrewScheer/status/1163567061894746112,256360738,2019-08-19 21:43:00+00:00,Mon Aug 19 21:43:00 +0000 2019,,,,
MaximeBernier,,*NEW VETERANS POLICY The government of Canada has an obligation to honour the nation’s sacred commitment to our military men and women and make sure our veterans receive the support they deserve.https://www.peoplespartyofcanada.ca/veterans_standing_behind_the_men_and_women_who_sacrificed_for_our_country …,157,332,9,1163567026939580416,https://twitter.com/MaximeBernier/status/1163567026939580416,2791988124,2019-08-19 21:42:51+00:00,Mon Aug 19 21:42:51 +0000 2019,,,,https://www.peoplespartyofcanada.ca/veterans_standing_behind_the_men_and_women_who_sacrificed_for_our_country
ElizabethMay,CTVNews,July was the hottest month ever recorded. The climate crisis isn't some far away myth — it's here. Only @CanadianGreens have a plan to get us to a healthy post-carbon society. #GPC #MissionPossiblehttps://twitter.com/CTVNews/status/1162178676416548864 …,121,335,632,1163565785496748032,https://twitter.com/ElizabethMay/status/1163565785496748032,16220555,2019-08-19 21:37:55+00:00,Mon Aug 19 21:37:55 +0000 2019,@CanadianGreens,#GPC #MissionPossiblehttps,,https://twitter.com/CTVNews/status/1162178676416548864
MaximeBernier,,Watch our Veterans Policy announcement in Gatineau with 42 PPC veterans on stage. Regardez l’annonce de notre politique sur les anciens combattants à Gatineau avec 42 anciens combattants du PPC sur la scène. #PPC2019https://youtu.be/JYXnxUG5Slk,117,226,8,1163565653363740673,https://twitter.com/MaximeBernier/status/1163565653363740673,2791988124,2019-08-19 21:37:24+00:00,Mon Aug 19 21:37:24 +0000 2019,,#PPC2019https,,https://youtu.be/JYXnxUG5Slk
AndrewScheer,,"It's been a slice, @ChefDtv ! Darryl and his team are a perfect example of what can happen when people pursue their dreams. As Prime Minister, I want to help more folks like Darryl build the lives they want and get ahead.pic.twitter.com/NLKArgVIoH",17,64,31,1163563120838807558,https://twitter.com/AndrewScheer/status/1163563120838807558,256360738,2019-08-19 21:27:20+00:00,Mon Aug 19 21:27:20 +0000 2019,@ChefDtv,,,
AndrewScheer,,"Cela fait longtemps qu’on ne s’est pas pointé ici, @ChefDtv ! Darryl et son équipe sont un parfait exemple de ce qui peut arriver quand on poursuit ses rêves. En tant que premier ministre, je veux aider plus de gens à bâtir la vie dont ils rêvent et à améliorer leur quotidien.pic.twitter.com/c6VCTqjqkr",1,15,5,1163563102367027200,https://twitter.com/AndrewScheer/status/1163563102367027200,256360738,2019-08-19 21:27:16+00:00,Mon Aug 19 21:27:16 +0000 2019,@ChefDtv,,,
AndrewScheer,,"Le mal que s’est donné le Cabinet du premier ministre au sujet du procès criminel de SNC, comme l’a démontré le commissaire à l’éthique, est des plus stupéfiants. J’ai officiellement demandé à la GRC d’y jeter un autre coup d’œil.pic.twitter.com/bWW5tBcJHk",9,28,6,1163559008998952960,https://twitter.com/AndrewScheer/status/1163559008998952960,256360738,2019-08-19 21:11:00+00:00,Mon Aug 19 21:11:00 +0000 2019,,,,
AndrewScheer,,"The lengths to which the PMO went to get its way in SNC’s criminal trial, as revealed by the Ethics Commissioner, are truly breathtaking. I have formally requested the RCMP take another look.pic.twitter.com/y55wFVeC5V",99,300,135,1163559008881524736,https://twitter.com/AndrewScheer/status/1163559008881524736,256360738,2019-08-19 21:11:00+00:00,Mon Aug 19 21:11:00 +0000 2019,,,,
AndrewScheer,,"Canadians cannot afford another four years of Justin Trudeau. I sat down with @Albrecht4KitCon, @Woodworth1CPC, @AlanKeeso, @jerryzwaterloo and @SunnyCBridge to talk about our positive Conservative vision over a drink at Mel’s Diner in Kitchener.pic.twitter.com/LWAp1gKfTQ",36,155,73,1163553214312194048,https://twitter.com/AndrewScheer/status/1163553214312194048,256360738,2019-08-19 20:47:58+00:00,Mon Aug 19 20:47:58 +0000 2019,@Albrecht4KitCon @Woodworth1CPC @AlanKeeso @jerryzwaterloo @SunnyCBridge,,,
AndrewScheer,,"Les Canadiens ne peuvent pas se permettre quatre autres années sous Justin Trudeau. J’ai parlé avec @Albrecht4KitCon, @Woodworth1CPC, @AlanKeeso, @jerryzwaterloo et @SunnyCBridge de notre vision conservatrice positive chez Mel’s Diner à Kitchener.pic.twitter.com/r2y0Y1eAQZ",3,20,7,1163553186252316672,https://twitter.com/AndrewScheer/status/1163553186252316672,256360738,2019-08-19 20:47:52+00:00,Mon Aug 19 20:47:52 +0000 2019,@Albrecht4KitCon @Woodworth1CPC @AlanKeeso @jerryzwaterloo @SunnyCBridge,,,
theJagmeetSingh,UN,"On #WorldHumanitarianDay we show support for humanitarian aid workers around the world. And this year, we pay special tribute to women humanitarians, the unsung heroes on the front lines in some of the most difficult conditions around the world taking care of people.https://twitter.com/UN/status/1163210210615447560 …",44,115,3,1163543211090092032,https://twitter.com/theJagmeetSingh/status/1163543211090092032,253340075,2019-08-19 20:08:13+00:00,Mon Aug 19 20:08:13 +0000 2019,,#WorldHumanitarianDay,,https://twitter.com/UN/status/1163210210615447560
theJagmeetSingh,ONU_fr,"En cette Journée mondiale de l'aide humanitaire, nous témoignons notre soutien aux travailleurs et travailleuses humanitaires à travers le monde. Rendons hommage particulier aux #FemmesHumanitaires, héroïnes de l’ombre au devant des situations difficiles pr prendre soin des gens.https://twitter.com/ONU_fr/status/1163300807455862785 …",15,36,0,1163543105880100866,https://twitter.com/theJagmeetSingh/status/1163543105880100866,253340075,2019-08-19 20:07:48+00:00,Mon Aug 19 20:07:48 +0000 2019,,#FemmesHumanitaires,,https://twitter.com/ONU_fr/status/1163300807455862785
JustinTrudeau,,"Big news in Quebec City today! We’re investing in public transit to help people get around the city faster, so they can spend less time on the road and more time with their families. Learn more: http://bit.ly/2Z48mhk pic.twitter.com/PF9s1165BQ",174,1073,486,1163539785216077824,https://twitter.com/JustinTrudeau/status/1163539785216077824,14260960,2019-08-19 19:54:36+00:00,Mon Aug 19 19:54:36 +0000 2019,,,,http://bit.ly/2Z48mhk
JustinTrudeau,,Grande nouvelle à Québec aujourd'hui! Nous investissons dans le transport en commun pour aider les gens à se déplacer plus rapidement en ville et pour leur permettre de passer moins de temps sur la route et plus de temps avec leurs familles. Détails : http://bit.ly/30j5fyJ pic.twitter.com/jpK6UaB4Xc,35,223,32,1163539730656612355,https://twitter.com/JustinTrudeau/status/1163539730656612355,14260960,2019-08-19 19:54:23+00:00,Mon Aug 19 19:54:23 +0000 2019,,,,http://bit.ly/30j5fyJ
yfblanchet,,"Devinez qui c’est qui reprend du service avec nous autres? @Lobstineuse est une incontournable de mes plus proches collaborateurs, une fille qui n’a peur d’aucun défi et qui prendra Beloeil-Chambly en charge pour le @BlocQuebecois! pic.twitter.com/U5QsKIGTvi",27,74,4,1163529913036660736,https://twitter.com/yfblanchet/status/1163529913036660736,38262290,2019-08-19 19:15:23+00:00,Mon Aug 19 19:15:23 +0000 2019,@Lobstineuse @BlocQuebecois,,,
MaximeBernier,,4/ Dites-nous maintenant @theJagmeetSingh si vous êtes systématiquement contre cette règle. Aussi si ça touche des groupes qui font la promotion des pipelines? Réduction de l’immigration? Qui dénoncent le socialisme? Êtes-vous vraiment pour la liberté d’expression?,17,77,4,1163522064797589504,https://twitter.com/MaximeBernier/status/1163522064797589504,2791988124,2019-08-19 18:44:12+00:00,Mon Aug 19 18:44:12 +0000 2019,@theJagmeetSingh,,,
MaximeBernier,,3/ Cet article se concentre sur le climat et la position du PPC. Mais il y a des centaines de sujets potentiellement contentieux qui pourraient être considérés partisans si on applique la règle systématiquement. Cette réglementation n’a pas sa place dans une société libre.,14,63,1,1163521874250412033,https://twitter.com/MaximeBernier/status/1163521874250412033,2791988124,2019-08-19 18:43:26+00:00,Mon Aug 19 18:43:26 +0000 2019,,,,
MaximeBernier,,"2/ La liberté d’expression est une valeur fondamentale du PPC. Le gouvernement libéral a mis en place une série de mesures qui la restreignent, dont celle-ci. La loi devrait seulement réglementer les pubs vraiment partisanes qui mentionnent un parti ou un candidat.",10,36,1,1163521688702783490,https://twitter.com/MaximeBernier/status/1163521688702783490,2791988124,2019-08-19 18:42:42+00:00,Mon Aug 19 18:42:42 +0000 2019,,,,
MaximeBernier,theJagmeetSingh,"1/ ÉC interprètent la loi du mieux qu’ils peuvent mais elle est quand même absurde. Pas pcq nous sommes le seul parti avec un point de vue différent que les alarmistes considèrent illégitime. Mais pcq c’est arbitraire, draconien et ne peut être appliqué de façon systématique.https://twitter.com/theJagmeetSingh/status/1163464870253268992 …",21,78,2,1163521477699952641,https://twitter.com/MaximeBernier/status/1163521477699952641,2791988124,2019-08-19 18:41:52+00:00,Mon Aug 19 18:41:52 +0000 2019,,,,https://twitter.com/theJagmeetSingh/status/1163464870253268992
theJagmeetSingh,,"On the 77th anniversary of the #Dieppe Raid, we pay tribute to the courage of all the those who sacrificed in defence of freedom. We honour those who were killed, or came home forever scarred. We will remember you: #LestWeForgethttps://www.ndp.ca/news/ndp-statement-anniversary-dieppe-raid-1 …",29,98,7,1163520108612018176,https://twitter.com/theJagmeetSingh/status/1163520108612018176,253340075,2019-08-19 18:36:25+00:00,Mon Aug 19 18:36:25 +0000 2019,,#Dieppe #LestWeForgethttps,,https://www.ndp.ca/news/ndp-statement-anniversary-dieppe-raid-1
theJagmeetSingh,,"En ce 77e anniversaire du #Dieppe Raid, saluons le courage des gens qui se sont sacrifié∙es pour défendre la liberté. Rendons hommage aux victimes, aux survivant∙es qui sont revenu∙es marqué∙es à jamais. Nous ne les oublierons pas. #LestWeForgethttps://www.npd.ca/nouvelles/declaration-du-npd-loccasion-de-lanniversaire-du-raid-sur-dieppe …",3,22,1,1163520014605062144,https://twitter.com/theJagmeetSingh/status/1163520014605062144,253340075,2019-08-19 18:36:03+00:00,Mon Aug 19 18:36:03 +0000 2019,,#Dieppe #LestWeForgethttps,,https://www.npd.ca/nouvelles/declaration-du-npd-loccasion-de-lanniversaire-du-raid-sur-dieppe
MaximeBernier,,"4/ Now, @theJagmeetSingh, tell us if you oppose this EC rule systematically. Do you also oppose it if it impacts groups that promote pipelines? Lower immigration levels? That denounce socialism? Do you really believe in free speech?",131,446,22,1163518224341831681,https://twitter.com/MaximeBernier/status/1163518224341831681,2791988124,2019-08-19 18:28:56+00:00,Mon Aug 19 18:28:56 +0000 2019,@theJagmeetSingh,,,
MaximeBernier,,3/ The article focuses on climate change and PPC position. But there are hundreds of potentially contentious issues that could be considered partisan if this rule were to be applied consistently. This excessive regulation of free speech has no place in a free society.,94,336,9,1163517968191565825,https://twitter.com/MaximeBernier/status/1163517968191565825,2791988124,2019-08-19 18:27:55+00:00,Mon Aug 19 18:27:55 +0000 2019,,,,
MaximeBernier,,"2/ Free speech is a fundamental value for the PPC. With its changes to the Elections Act, Lib gov has put in place a series of measures that curtail it. The law should only regulate real partisan advertising, which is when there is mention of a candidate or party by name.",82,222,4,1163517671813591040,https://twitter.com/MaximeBernier/status/1163517671813591040,2791988124,2019-08-19 18:26:44+00:00,Mon Aug 19 18:26:44 +0000 2019,,,,
MaximeBernier,theJagmeetSingh,"1/ EC is interpreting a bad law as best it can, but this rule is still absurd. Not because we’re the only party with a different perspective which climate alarmists believe is not legitimate. But because it is arbitrary, draconian, and cannot be applied consistently.https://twitter.com/theJagmeetSingh/status/1163464877677191169 …",207,499,49,1163517241788440576,https://twitter.com/MaximeBernier/status/1163517241788440576,2791988124,2019-08-19 18:25:02+00:00,Mon Aug 19 18:25:02 +0000 2019,,,,https://twitter.com/theJagmeetSingh/status/1163464877677191169
theJagmeetSingh,,"I met a legend in Montreal @GeorgesStPierre One of the greatest MMA champs of all time, who leads with humility & respect for his opponents and the sport. After he finished rolling & sparring with the class just like anyone else, we got to chat & it was truly an inspirationpic.twitter.com/mpDlYmzmFv",62,512,9,1163511854028771329,https://twitter.com/theJagmeetSingh/status/1163511854028771329,253340075,2019-08-19 18:03:37+00:00,Mon Aug 19 18:03:37 +0000 2019,@GeorgesStPierre,,,
theJagmeetSingh,,"J'ai rencontré une légende à Montréal @GeorgesStPierre Un des plus grands champions MMA qui a toujours fait preuve d'une grande humilité & de respect de ses adversaires. Après son entraînement avec la classe, nous avons pu discuter naturellement et ce fut une vraie inspirationpic.twitter.com/TMgKXyXHVd",12,61,2,1163511846432837632,https://twitter.com/theJagmeetSingh/status/1163511846432837632,253340075,2019-08-19 18:03:35+00:00,Mon Aug 19 18:03:35 +0000 2019,@GeorgesStPierre,,,
yfblanchet,,"Élections Canada ne doit pas bâillonner les groupes écologistes, voyons! @BlocQuebecoispic.twitter.com/1tsPIIhjox",19,37,0,1163509114405826561,https://twitter.com/yfblanchet/status/1163509114405826561,38262290,2019-08-19 17:52:44+00:00,Mon Aug 19 17:52:44 +0000 2019,@BlocQuebecoispic,,,
ElizabethMay,AJWVictoriaBC,"Reminds me of what @KHayhoe experienced when #Facebook started blocking postings of #climate messages as ""political."" Elections Canada needs to differentiate between partisan messages ""Vote Green for real climate action"" and non-partisan ""think climate when you vote."" #GPChttps://twitter.com/AJWVictoriaBC/status/1163472327750717441 …",109,245,23,1163504868205760513,https://twitter.com/ElizabethMay/status/1163504868205760513,16220555,2019-08-19 17:35:52+00:00,Mon Aug 19 17:35:52 +0000 2019,@KHayhoe,#Facebook #climate #GPChttps,,https://twitter.com/AJWVictoriaBC/status/1163472327750717441
JustinTrudeau,,"Our government knows that supporting our unions leads to more jobs for Canadians & a stronger middle class. Together with @UniforCanada, we’ll keep defending workers' rights, helping their families, & respecting the important work they do. Thanks for having me at #Unifor19 today.pic.twitter.com/3TDo9FJMl0",197,1113,221,1163500593325006848,https://twitter.com/JustinTrudeau/status/1163500593325006848,14260960,2019-08-19 17:18:52+00:00,Mon Aug 19 17:18:52 +0000 2019,@UniforCanada,#Unifor19,,
JustinTrudeau,,"Appuyer nos syndicats permet de créer plus d'emplois et de renforcer la classe moyenne. Avec @SyndicatUnifor, on continuera à défendre les droits des travailleurs, à aider leurs familles et à respecter le travail important qu'ils font. Merci de m'avoir invité à #Unifor19.pic.twitter.com/KhIv9mlSJJ",35,229,17,1163500517231927296,https://twitter.com/JustinTrudeau/status/1163500517231927296,14260960,2019-08-19 17:18:34+00:00,Mon Aug 19 17:18:34 +0000 2019,@SyndicatUnifor,#Unifor19,,
AndrewScheer,nationalpost,He’s in prison now and that’s where he should stay. I won’t lift a finger to bring him back to Canada. Justin Trudeau needs to explain why he worked so hard to bring him back.https://twitter.com/nationalpost/status/1163235631104966656 …,1290,3945,981,1163497275081068544,https://twitter.com/AndrewScheer/status/1163497275081068544,256360738,2019-08-19 17:05:41+00:00,Mon Aug 19 17:05:41 +0000 2019,,,,https://twitter.com/nationalpost/status/1163235631104966656
