username,to,text,retweets,favorites,replies,id,permalink,author_id,date,formatted_date,mentions,hashtags,geo,urls
JustinTrudeau,,"Ramadan is about the values we all hold dear as Canadians – compassion, peace, and serving others. Last night, I joined members of the Muslim community in Milton to break fast – thank you for welcoming me to this special Iftar meal.pic.twitter.com/yCtQr5TEyp",1746,8174,984,1126977541842063361,https://twitter.com/JustinTrudeau/status/1126977541842063361,14260960,2019-05-10 22:29:18+00:00,Fri May 10 22:29:18 +0000 2019,,,,
JustinTrudeau,,"Le Ramadan porte sur les valeurs qui nous sont chères en tant que Canadiens : la compassion, la paix et l’entraide. Hier soir, je me suis joint aux membres de la communauté musulmane de Milton pour rompre le jeûne. Merci de m'avoir accueilli à ce repas spécial de l’Iftar.pic.twitter.com/dZ0hjDPXjF",226,1196,111,1126977487060312064,https://twitter.com/JustinTrudeau/status/1126977487060312064,14260960,2019-05-10 22:29:05+00:00,Fri May 10 22:29:05 +0000 2019,,,,
JustinTrudeau,,I spoke with @POTUS Donald Trump today. More on what we talked about here:https://pm.gc.ca/eng/news/2019/05/10/prime-minister-justin-trudeau-speaks-president-united-states-america-donald-trump …,81,321,316,1126974855277101056,https://twitter.com/JustinTrudeau/status/1126974855277101056,14260960,2019-05-10 22:18:38+00:00,Fri May 10 22:18:38 +0000 2019,@POTUS,,,https://pm.gc.ca/eng/news/2019/05/10/prime-minister-justin-trudeau-speaks-president-united-states-america-donald-trump
JustinTrudeau,,J'ai parlé avec le @POTUS Donald Trump aujourd'hui. Plus de détails ici :https://pm.gc.ca/fra/nouvelles/2019/05/10/premier-ministre-justin-trudeau-sentretient-president-des-etats-unis-donald …,21,129,12,1126974769637855237,https://twitter.com/JustinTrudeau/status/1126974769637855237,14260960,2019-05-10 22:18:17+00:00,Fri May 10 22:18:17 +0000 2019,@POTUS,,,https://pm.gc.ca/fra/nouvelles/2019/05/10/premier-ministre-justin-trudeau-sentretient-president-des-etats-unis-donald
JustinTrudeau,,"Today’s Job Numbers One million new jobs since 2015 100,000+ jobs in the last month alone And most of those are full-time jobs The highest one-month job growth on record",898,4574,743,1126964590959648770,https://twitter.com/JustinTrudeau/status/1126964590959648770,14260960,2019-05-10 21:37:51+00:00,Fri May 10 21:37:51 +0000 2019,,,,
JustinTrudeau,,"Données d’aujourd'hui sur l’emploi Un million de nouveaux emplois depuis 2015 Plus de 100 000 emplois au cours du dernier mois Et il s’agit, pour la plupart, d’emplois à temps plein La plus forte croissance mensuelle de l'emploi jamais enregistrée",69,395,28,1126964556738199552,https://twitter.com/JustinTrudeau/status/1126964556738199552,14260960,2019-05-10 21:37:42+00:00,Fri May 10 21:37:42 +0000 2019,,,,
AndrewScheer,,Everything in Canada keeps getting more expensive - and housing is certainly no exception. Today at @CHBANational I talked about ways Conservatives will help you keep more of your money so you can build the life you want.pic.twitter.com/5F6oVOvE4R,22,121,75,1126963608448057345,https://twitter.com/AndrewScheer/status/1126963608448057345,256360738,2019-05-10 21:33:56+00:00,Fri May 10 21:33:56 +0000 2019,@CHBANational,,,
AndrewScheer,,Tout au Canada coûte de plus en plus cher et le logement ne fait pas exception. Aujourd’hui à la @CHBANational j’ai dit comment les conservateurs vous aideront à garder plus de votre argent pour vous offrir la vie que vous voulez.pic.twitter.com/nXPD1p3V7H,6,21,2,1126963468832317441,https://twitter.com/AndrewScheer/status/1126963468832317441,256360738,2019-05-10 21:33:23+00:00,Fri May 10 21:33:23 +0000 2019,@CHBANational,,,
theJagmeetSingh,,"Money laundering inflates the cost of housing, and fuels the opioid crisis – but with $47 billion in #dirtymoney a year being laundered in Canada, it’s time for the federal government to stop turning a blind eye and take action to protect Canadians.https://www.ctvnews.ca/canada/5-billion-laundered-through-b-c-real-estate-in-2018-driving-up-home-prices-1.4415765 …",106,260,19,1126959411195449349,https://twitter.com/theJagmeetSingh/status/1126959411195449349,253340075,2019-05-10 21:17:16+00:00,Fri May 10 21:17:16 +0000 2019,,#dirtymoney,,https://www.ctvnews.ca/canada/5-billion-laundered-through-b-c-real-estate-in-2018-driving-up-home-prices-1.4415765
theJagmeetSingh,,"Le blanchiment d’argent gonfle le coût du logement et alimente la crise des opioïdes. Avec 47 milliards $en argent sale blanchis au Canada chaque année, le gouvernement fédéral doit cesser de fermer les yeux et agir pour protéger la population canadienne. https://www.ctvnews.ca/canada/5-billion-laundered-through-b-c-real-estate-in-2018-driving-up-home-prices-1.4415765 …",4,18,1,1126959402555146240,https://twitter.com/theJagmeetSingh/status/1126959402555146240,253340075,2019-05-10 21:17:14+00:00,Fri May 10 21:17:14 +0000 2019,,,,https://www.ctvnews.ca/canada/5-billion-laundered-through-b-c-real-estate-in-2018-driving-up-home-prices-1.4415765
AndrewScheer,,"This week, I shared My Vision for Canada’s foreign policy to make Canada stronger in a turbulent world. Keep an eye out for more speeches on #MyVisionForCanada in the coming weeks on the major issues our country is facing today.pic.twitter.com/a2VJJ7C08F",216,734,175,1126959104495357959,https://twitter.com/AndrewScheer/status/1126959104495357959,256360738,2019-05-10 21:16:03+00:00,Fri May 10 21:16:03 +0000 2019,,#MyVisionForCanada,,
AndrewScheer,,"Cette semaine, j’ai présenté ma politique étrangère Ma vision pour le Canada afin de rendre le Canada plus fort dans un monde turbulent. Soyez à l’écoute pour d’autres discours sur #MaVisionPourLeCanada au cours des prochaines semaines sur les principaux enjeux de notre pays.pic.twitter.com/QztfVJH1u4",6,24,3,1126959066897702912,https://twitter.com/AndrewScheer/status/1126959066897702912,256360738,2019-05-10 21:15:54+00:00,Fri May 10 21:15:54 +0000 2019,,#MaVisionPourLeCanada,,
JustinTrudeau,,"We’re doubling the infrastructure funding we give directly to municipalities – so communities like Edmonton have the tools they need to get important projects built, to make your life easier & more affordable. More: https://bit.ly/2PX4VBh pic.twitter.com/p2vVjJ1BO0",145,606,189,1126958433926819841,https://twitter.com/JustinTrudeau/status/1126958433926819841,14260960,2019-05-10 21:13:23+00:00,Fri May 10 21:13:23 +0000 2019,,,,https://bit.ly/2PX4VBh
JustinTrudeau,,"On double le financement des infrastructures accordé directement aux municipalités pour que des communautés comme Edmonton aient les outils nécessaires pour réaliser des projets importants, et pour rendre la vie plus facile et abordable. Info: https://bit.ly/30au942 pic.twitter.com/E7ICEtTEGm",28,160,15,1126958348547633152,https://twitter.com/JustinTrudeau/status/1126958348547633152,14260960,2019-05-10 21:13:02+00:00,Fri May 10 21:13:02 +0000 2019,,,,https://bit.ly/30au942
yfblanchet,,J’ai signé pour le Bloc Québécois la Déclaration d’urgence climatique. Le temps nous est compté pour la transition et créer de la richesse pour les régions du Québec. Soyons positifs tout en expliquant que c’est impossible dans le Canada pétrolier. https://www.journaldequebec.com/2019/05/10/le-bloc-quebecois-signe-la-declaration-durgence-climatique …,31,87,5,1126951915563180033,https://twitter.com/yfblanchet/status/1126951915563180033,38262290,2019-05-10 20:47:29+00:00,Fri May 10 20:47:29 +0000 2019,,,,https://www.journaldequebec.com/2019/05/10/le-bloc-quebecois-signe-la-declaration-durgence-climatique
JustinTrudeau,,"My thanks to Mayor @doniveson for the meeting in Edmonton today. We focused on what we’ve accomplished these past few years, & how we’ll keep working together to create jobs, grow the economy, & build important infrastructure projects that will make life better for Edmontonians.pic.twitter.com/khPvQU9G3t",102,648,151,1126937820596191232,https://twitter.com/JustinTrudeau/status/1126937820596191232,14260960,2019-05-10 19:51:28+00:00,Fri May 10 19:51:28 +0000 2019,@doniveson,,,
JustinTrudeau,,"Merci au maire @doniveson pour notre rencontre à Edmonton. Nous avons parlé de nos réalisations des dernières années et de ce que nous ferons ensemble pour créer des emplois, faire croître l’économie et réaliser des projets d’infrastructure qui améliorent la vie des Edmontoniens.pic.twitter.com/r94A2lCHKf",15,184,11,1126937758067507201,https://twitter.com/JustinTrudeau/status/1126937758067507201,14260960,2019-05-10 19:51:13+00:00,Fri May 10 19:51:13 +0000 2019,@doniveson,,,
yfblanchet,,"Si vous ne lisez qu’un seul texte aujourd’hui, je vous suggère celui-ci sur la vulnérabilité des enfants exposés à l’influence des enseignants. N’hésitez pas à partager... @fvailleshttps://www.lapresse.ca/debats/chroniques/francis-vailles/201905/09/01-5225481-pourquoi-limage-des-profs-doit-etre-laique.php …",18,36,4,1126932053629505537,https://twitter.com/yfblanchet/status/1126932053629505537,38262290,2019-05-10 19:28:33+00:00,Fri May 10 19:28:33 +0000 2019,@fvailleshttps,,,https://www.lapresse.ca/debats/chroniques/francis-vailles/201905/09/01-5225481-pourquoi-limage-des-profs-doit-etre-laique.php
MaximeBernier,,Finally got blocked by @michelleRempel! Poor little entitled princess could not take the heat anymore. Too many people criticizing her hypocritical virtue-signalling and her support for Far Left authoritarians. Anyone still wondering why I left CPC? #BlockedByRempel #PPC2019pic.twitter.com/MnLx5FEZiA,329,1128,700,1126929615975587845,https://twitter.com/MaximeBernier/status/1126929615975587845,2791988124,2019-05-10 19:18:52+00:00,Fri May 10 19:18:52 +0000 2019,@michelleRempel,#BlockedByRempel #PPC2019pic,,
yfblanchet,,"Quelle honte, encore! Je serai demain à l’UMQ et je rappellerai à tous que Québec ne peut pas pas être accusé de faire de l’obstruction dans son propre champ de compétence exclusive! Voyons donc...! Et avec notre propre $géré à coups de mensonges.#https://www.journaldequebec.com/2019/05/10/tramway-de-quebec-joel-lightbound-tire-a-boulets-rouges-sur-la-caq …",33,60,4,1126925485647245314,https://twitter.com/yfblanchet/status/1126925485647245314,38262290,2019-05-10 19:02:27+00:00,Fri May 10 19:02:27 +0000 2019,,#https,,https://www.journaldequebec.com/2019/05/10/tramway-de-quebec-joel-lightbound-tire-a-boulets-rouges-sur-la-caq
yfblanchet,,J’ai l’impression que le côté obscur de la transition du municipal - Il a démissionné - vers les Conservateurs va soulever des questions. Beaucoup de questions. Comme si on ne savait pas tout...pic.twitter.com/Q17plNMCbf,8,20,0,1126917660002930689,https://twitter.com/yfblanchet/status/1126917660002930689,38262290,2019-05-10 18:31:21+00:00,Fri May 10 18:31:21 +0000 2019,,,,
JustinTrudeau,,"We have a plan to grow our economy – and it’s working. Canadians have created over 1 million jobs since 2015, including more than 100,000 in the last month alone – most of which are full time.https://www.ctvnews.ca/business/canada-s-labour-market-surprises-with-record-breaking-employment-gain-1.4416790 …",455,1892,533,1126894249553874952,https://twitter.com/JustinTrudeau/status/1126894249553874952,14260960,2019-05-10 16:58:20+00:00,Fri May 10 16:58:20 +0000 2019,,,,https://www.ctvnews.ca/business/canada-s-labour-market-surprises-with-record-breaking-employment-gain-1.4416790
JustinTrudeau,,"Nous avons un plan pour faire croître notre économie – et il fonctionne. Les Canadiens ont créé plus de 1 million d’emplois depuis 2015, dont plus de 100 000 au cours du dernier mois seulement – et la plupart sont à temps plein.https://www.lapresse.ca/affaires/economie/201905/10/01-5225505-le-taux-de-chomage-au-quebec-a-son-plus-bas-depuis-1976.php?utm_categorieinterne=trafficdrivers&utm_contenuinterne=cyberpresse_B2_la-presse-affaires_1243376_section_POS1 …",51,269,21,1126894211666673665,https://twitter.com/JustinTrudeau/status/1126894211666673665,14260960,2019-05-10 16:58:11+00:00,Fri May 10 16:58:11 +0000 2019,,,,https://www.lapresse.ca/affaires/economie/201905/10/01-5225505-le-taux-de-chomage-au-quebec-a-son-plus-bas-depuis-1976.php?utm_categorieinterne=trafficdrivers&utm_contenuinterne=cyberpresse_B2_la-presse-affaires_1243376_section_POS1
AndrewScheer,,"As Prime Minister, I will firmly reject the idea that Canada should be neutral on the big questions of our time.pic.twitter.com/P0tnUym4ek",253,960,940,1126893168509816832,https://twitter.com/AndrewScheer/status/1126893168509816832,256360738,2019-05-10 16:54:02+00:00,Fri May 10 16:54:02 +0000 2019,,,,
AndrewScheer,,"Comme premier ministre, je vais rejeter fermement l’idée que le Canada devrait être neutre sur les principaux enjeux de notre époque.pic.twitter.com/tukCyMC7MB",4,18,3,1126893159286493185,https://twitter.com/AndrewScheer/status/1126893159286493185,256360738,2019-05-10 16:54:00+00:00,Fri May 10 16:54:00 +0000 2019,,,,
JustinTrudeau,,"One. Million. Jobs. We’ll stay focused on investing in Canadians, to grow our economy & create even more jobs.pic.twitter.com/Hj5RRaFJMg",411,1564,454,1126876136208838656,https://twitter.com/JustinTrudeau/status/1126876136208838656,14260960,2019-05-10 15:46:21+00:00,Fri May 10 15:46:21 +0000 2019,,,,
MaximeBernier,,*Mute function in English! Masquer in French.,17,108,7,1126876086619578368,https://twitter.com/MaximeBernier/status/1126876086619578368,2791988124,2019-05-10 15:46:10+00:00,Fri May 10 15:46:10 +0000 2019,,,,
JustinTrudeau,,Un. Million. D’emplois. Nous continuerons d’investir résolument dans les Canadiens pour faire croître notre économie et créer encore plus d’emplois.pic.twitter.com/zH2wcL4u2x,32,189,14,1126876085646446593,https://twitter.com/JustinTrudeau/status/1126876085646446593,14260960,2019-05-10 15:46:09+00:00,Fri May 10 15:46:09 +0000 2019,,,,
theJagmeetSingh,,"Instead of suspending the Safe Third Country agreement, Trudeau’s gov’t is making it even harder for asylum seekers – including women fleeing domestic violence. Justin Trudeau says he’s a feminist – but this says otherwise.https://www.thestar.com/news/canada/2019/05/08/canadas-refugee-changes-will-hurt-women-asylum-seekers-organizations-say.html …",159,323,52,1126865013292113921,https://twitter.com/theJagmeetSingh/status/1126865013292113921,253340075,2019-05-10 15:02:09+00:00,Fri May 10 15:02:09 +0000 2019,,,,https://www.thestar.com/news/canada/2019/05/08/canadas-refugee-changes-will-hurt-women-asylum-seekers-organizations-say.html
theJagmeetSingh,,"Au lieu de suspendre l’Entente sur les tiers pays sûrs, le gouv Trudeau rend les choses plus difficiles pour les demandeurs d’asile, y compris pour les femmes fuyant la violence conjugale. Justin Trudeau se dit féministe, mais cela indique le contraire.https://www.ledevoir.com/politique/canada/553914/des-groupes-de-femmes-denoncent-les-changements-a-la-loi-sur-les-refugies …",9,21,0,1126864785956573184,https://twitter.com/theJagmeetSingh/status/1126864785956573184,253340075,2019-05-10 15:01:15+00:00,Fri May 10 15:01:15 +0000 2019,,,,https://www.ledevoir.com/politique/canada/553914/des-groupes-de-femmes-denoncent-les-changements-a-la-loi-sur-les-refugies
MaximeBernier,,Certains craignent que «diviser le vote» va aider les libéraux. Mais qui le fait? Scheer divise le vote centriste. Rempel divise le vote de gauche. Le PPC crée une vraie alternative basée sur des PRINCIPES. Laissez le PCC diviser le vote centre/gauche et venez avec nous!,27,57,5,1126864001101651973,https://twitter.com/MaximeBernier/status/1126864001101651973,2791988124,2019-05-10 14:58:08+00:00,Fri May 10 14:58:08 +0000 2019,,,,
MaximeBernier,,Some people are preoccupied that “splitting the vote” will help Libs. But who’s doing it? Scheer splitting the LibCon centrist vote. Rempel splitting the left vote. PPC is creating a real PRINCIPLED alternative. Let the Tories split the centre/left vote and come with us!,286,757,148,1126863137611890688,https://twitter.com/MaximeBernier/status/1126863137611890688,2791988124,2019-05-10 14:54:42+00:00,Fri May 10 14:54:42 +0000 2019,,,,
MaximeBernier,,"For all those who are blocked by @MichelleRempel and cannot see how she jumped to conclusion and used a fake news article to virtue signal, as Liberals do all the time, here’s a screenshot. Oh, looks like this tweet is being ratioed!pic.twitter.com/B9aGGjcXbT",82,188,39,1126859993947545601,https://twitter.com/MaximeBernier/status/1126859993947545601,2791988124,2019-05-10 14:42:13+00:00,Fri May 10 14:42:13 +0000 2019,@MichelleRempel,,,
AndrewScheer,,. @blackvotecanada is doing great work encouraging Black Canadians to run for office. I sat down with them and listened to their concerns and learned about their important initiatives. Looking forward to working together to involve more Black Canadians in Canadian politics.pic.twitter.com/fJ3Fr2z1ot,34,131,55,1126857257147359232,https://twitter.com/AndrewScheer/status/1126857257147359232,256360738,2019-05-10 14:31:20+00:00,Fri May 10 14:31:20 +0000 2019,@blackvotecanada,,,
AndrewScheer,,. @blackvotecanada fait un excellent travail pour encourager les Canadiens noirs à se présenter en politique. J’ai entendu ses préoccupations et appris sur ses importantes initiatives. Je suis impatient de travailler ensemble pour avoir plus de Canadiens noirs en politique.pic.twitter.com/gcZZfXYg4X,4,17,0,1126856829638725633,https://twitter.com/AndrewScheer/status/1126856829638725633,256360738,2019-05-10 14:29:38+00:00,Fri May 10 14:29:38 +0000 2019,@blackvotecanada,,,
MaximeBernier,,2/ Nous avons explicitement dit à nos candidats dans les partielles de ne bloquer personne. Et je donne la même directive aux nouveaux candidats et à nos associations. Vous pouvez masquer les trolls et ceux qui vous harcèlent. Mais ne bloquez personne.,15,34,0,1126855533565292545,https://twitter.com/MaximeBernier/status/1126855533565292545,2791988124,2019-05-10 14:24:29+00:00,Fri May 10 14:24:29 +0000 2019,,,,
MaximeBernier,CanadianPatri15,1/ Rempel n’a aucun respect pour les Canadiens. Elle agit comme une princesse qui se prend pour une autre et qui ne tolère aucune critique. Et son chef semble incapable de la ramener à l’ordre. Nous sommes des serviteurs du public. Le public a le droit de voir nos messages.https://twitter.com/CanadianPatri15/status/1126842459353485318 …,24,57,3,1126854744696397825,https://twitter.com/MaximeBernier/status/1126854744696397825,2791988124,2019-05-10 14:21:21+00:00,Fri May 10 14:21:21 +0000 2019,,,,https://twitter.com/CanadianPatri15/status/1126842459353485318
MaximeBernier,,"2/ Our by-election candidates were explicitly told to NOT block anyone. And I am giving all the new candidates, as well as our official EDAs, the same directive. You can use the Mask function for trolls and others who harass you. But don’t block anyone.",89,321,25,1126853832607182848,https://twitter.com/MaximeBernier/status/1126853832607182848,2791988124,2019-05-10 14:17:44+00:00,Fri May 10 14:17:44 +0000 2019,,,,
MaximeBernier,CanadianPatri15,1/ She has no respect for Canadians. She keeps acting like an entitled princess who cannot tolerate the slightest criticism. And her leader seems unable to keep this shameful attitude in check. We are public servants. Canadians have a right to see our public communications.https://twitter.com/CanadianPatri15/status/1126842459353485318 …,175,467,56,1126853697739399168,https://twitter.com/MaximeBernier/status/1126853697739399168,2791988124,2019-05-10 14:17:12+00:00,Fri May 10 14:17:12 +0000 2019,,,,https://twitter.com/CanadianPatri15/status/1126842459353485318
MaximeBernier,,As I said. She wants to court the far left but doesn’t want real conservatives to know about it.pic.twitter.com/8irkePNHoi,33,83,7,1126848917147197440,https://twitter.com/MaximeBernier/status/1126848917147197440,2791988124,2019-05-10 13:58:12+00:00,Fri May 10 13:58:12 +0000 2019,,,,
MaximeBernier,Mega_chops,She doesn’t want you to see all the SJW nonsense she tweets to appeal to left-wingers. Part of the Tory strategy to split the LibCon vote and replace the Liberals. It could create a backlash among real conservatives if it becomes too obvious.https://twitter.com/Mega_chops/status/1126830919808163841 …,81,205,40,1126847812887511040,https://twitter.com/MaximeBernier/status/1126847812887511040,2791988124,2019-05-10 13:53:49+00:00,Fri May 10 13:53:49 +0000 2019,,,,https://twitter.com/Mega_chops/status/1126830919808163841
MaximeBernier,,"Mon gouvernement va abolir la taxe sur le carbone des libéraux, ne va imposer aucune nouvelle taxe, subvention ou réglementation comme dans le plan d’Andrew Scheer, et va laisser les provinces gérer leurs propres programmes. #ÉQUITÉ #RESPECT #PPC2019https://business.financialpost.com/opinion/ottawa-will-make-alberta-pay-a-higher-carbon-tax-than-quebecs-thats-unfair/ …",27,76,8,1126843017686548481,https://twitter.com/MaximeBernier/status/1126843017686548481,2791988124,2019-05-10 13:34:45+00:00,Fri May 10 13:34:45 +0000 2019,,#ÉQUITÉ #RESPECT #PPC2019https,,https://business.financialpost.com/opinion/ottawa-will-make-alberta-pay-a-higher-carbon-tax-than-quebecs-thats-unfair/
MaximeBernier,,"My government will repeal the Liberal carbon tax, will not impose any additional taxes, subsidies or regulations as Scheer is planning, and will let provinces manage their own programs. #FAIRNESS #RESPECT #PPC2019 https://business.financialpost.com/opinion/ottawa-will-make-alberta-pay-a-higher-carbon-tax-than-quebecs-thats-unfair/ …",253,543,60,1126841723265724416,https://twitter.com/MaximeBernier/status/1126841723265724416,2791988124,2019-05-10 13:29:37+00:00,Fri May 10 13:29:37 +0000 2019,,#FAIRNESS #RESPECT #PPC2019,,https://business.financialpost.com/opinion/ottawa-will-make-alberta-pay-a-higher-carbon-tax-than-quebecs-thats-unfair/
JustinTrudeau,,"Since 2015, we’ve been investing in you to create more jobs & grow our economy. And that plan is working - over 1,000,000 Canadians now have jobs compared to 4 years ago.",635,3584,737,1126832640949137413,https://twitter.com/JustinTrudeau/status/1126832640949137413,14260960,2019-05-10 12:53:31+00:00,Fri May 10 12:53:31 +0000 2019,,,,
JustinTrudeau,,"Depuis 2015, nous investissons en vous pour créer plus d'emplois et faire croître notre économie. Et ce plan fonctionne : plus d'un million de Canadiens ont un emploi aujourd’hui qu’il y a quatre ans.",44,312,19,1126832579250917376,https://twitter.com/JustinTrudeau/status/1126832579250917376,14260960,2019-05-10 12:53:17+00:00,Fri May 10 12:53:17 +0000 2019,,,,
AndrewScheer,,We need new solutions for the housing crisis in Canada. Justin Trudeau’s failed policies have only made things worse. Speaking with @CHBANational LIVE: https://www.facebook.com/pg/AndrewScheerMP/videos/?ref=page_internal …,47,191,91,1126829852093448192,https://twitter.com/AndrewScheer/status/1126829852093448192,256360738,2019-05-10 12:42:26+00:00,Fri May 10 12:42:26 +0000 2019,@CHBANational,,,https://www.facebook.com/pg/AndrewScheerMP/videos/?ref=page_internal
AndrewScheer,,Il faut trouver de nouvelles solutions à la crise du logement au Canada. Les politiques d’échec de Justin Trudeau ne font qu’empirer les choses. EN DIRECT à @CHBANational: https://www.facebook.com/pg/AndrewScheerMP/videos/?ref=page_internal …,2,16,0,1126829795751415808,https://twitter.com/AndrewScheer/status/1126829795751415808,256360738,2019-05-10 12:42:13+00:00,Fri May 10 12:42:13 +0000 2019,@CHBANational,,,https://www.facebook.com/pg/AndrewScheerMP/videos/?ref=page_internal
MaximeBernier,,"So, fake news that started as “PPC candidate expelled for being gay” ends up being a totally different story after journalists do their job. Don’t believe any of the hit pieces about PPC being intolerant. It’s all leftist propaganda or shoddy journalism.https://www.woodstocksentinelreview.com/news/local-news/bernier-fires-back-at-media-allegations-of-turfing-gay-candidate-in-oxford-county/wcm/0c43527e-7215-4aeb-912b-74b880c62e20/ …",292,714,43,1126819848942772225,https://twitter.com/MaximeBernier/status/1126819848942772225,2791988124,2019-05-10 12:02:41+00:00,Fri May 10 12:02:41 +0000 2019,,,,https://www.woodstocksentinelreview.com/news/local-news/bernier-fires-back-at-media-allegations-of-turfing-gay-candidate-in-oxford-county/wcm/0c43527e-7215-4aeb-912b-74b880c62e20/
yfblanchet,,"Gestion de l’offre: Rien au budget; Rien aux crédits; Le directeur parlementaire du budget (neutre) affirme que les procédures régulières ne permettent pas les compensations; Justin Trudeau prend les producteurs en otage: «pour vos chèques, vous devez voter pour moi.»pic.twitter.com/qlnh7blcm9",28,34,3,1126813038869471232,https://twitter.com/yfblanchet/status/1126813038869471232,38262290,2019-05-10 11:35:38+00:00,Fri May 10 11:35:38 +0000 2019,,,,
AndrewScheer,,"This is unacceptable. Justin Trudeau smeared the reputation of another honourable individual who stood up to him, just like he did in the SNC-Lavalin Scandal. @nationalpost front page today.pic.twitter.com/tJp593KzOv",312,887,70,1126677111819984896,https://twitter.com/AndrewScheer/status/1126677111819984896,256360738,2019-05-10 02:35:30+00:00,Fri May 10 02:35:30 +0000 2019,@nationalpost,,,
AndrewScheer,,"C’est inacceptable. Justin Trudeau a sali la réputation d’une personne honorable qui l’a confronté, comme il l’a fait dans le scandale SNC-Lavalin. Manchette du @nationalpost aujourd’hui.pic.twitter.com/c3NpBHvkPg",10,21,5,1126677092425437184,https://twitter.com/AndrewScheer/status/1126677092425437184,256360738,2019-05-10 02:35:26+00:00,Fri May 10 02:35:26 +0000 2019,@nationalpost,,,
