username,to,text,retweets,favorites,replies,id,permalink,author_id,date,formatted_date,mentions,hashtags,geo,urls
AndrewScheer,nationalpost,"Il est en prison maintenant, là où il devrait être. Je ne tenterai jamais de le rapatrier au Canada. Je ne comprends pas pourquoi Justin Trudeau a déployé tant d'efforts pour le rapatrier.https://twitter.com/nationalpost/status/1163235631104966656 …",17,75,7,1163497248044519424,https://twitter.com/AndrewScheer/status/1163497248044519424,256360738,2019-08-19 17:05:35+00:00,Mon Aug 19 17:05:35 +0000 2019,,,,https://twitter.com/nationalpost/status/1163235631104966656
AndrewScheer,,"We know that Justin Trudeau broke the law. Now we need to find out if he committed a crime. Today, with @KrystinaWaler in St. Catharines, I released my letter to the RCMP asking them to look into Trudeau’s SNC-Lavalin corruption scandal.pic.twitter.com/zd0XNh3v0F",130,413,207,1163493181440352261,https://twitter.com/AndrewScheer/status/1163493181440352261,256360738,2019-08-19 16:49:25+00:00,Mon Aug 19 16:49:25 +0000 2019,@KrystinaWaler,,,
AndrewScheer,,"Nous savons que Justin Trudeau a enfreint la loi. Nous devons maintenant savoir s’il a commis un crime. Aujourd’hui, avec @KrystinaWaler à St. Catharines, j’ai rendu publique ma lettre à la GRC, lui demandant de se pencher sur le scandale de corruption SNC-Lavalin de Trudeau.pic.twitter.com/fWOsz7kskf",9,47,5,1163493138507456514,https://twitter.com/AndrewScheer/status/1163493138507456514,256360738,2019-08-19 16:49:15+00:00,Mon Aug 19 16:49:15 +0000 2019,@KrystinaWaler,,,
MaximeBernier,,Maxime Bernier estime qu’un débat des chefs sans lui ne sera pas « un vrai débat »https://ici.radio-canada.ca/nouvelle/1265289/elections-federales-bernier-debat-chefs-parti-populaire-canada …,32,118,14,1163487447738720256,https://twitter.com/MaximeBernier/status/1163487447738720256,2791988124,2019-08-19 16:26:38+00:00,Mon Aug 19 16:26:38 +0000 2019,,,,https://ici.radio-canada.ca/nouvelle/1265289/elections-federales-bernier-debat-chefs-parti-populaire-canada
JustinTrudeau,,Our government will always support Canada’s workers. Watch my speech at @UniforTheUnion’s Convention in Quebec City : http://bit.ly/33M3sEo,113,672,443,1163476826402041862,https://twitter.com/JustinTrudeau/status/1163476826402041862,14260960,2019-08-19 15:44:26+00:00,Mon Aug 19 15:44:26 +0000 2019,@UniforTheUnion,,,http://bit.ly/33M3sEo
JustinTrudeau,,Notre gouvernement appuiera toujours les travailleurs du Canada. Regardez mon discours au congrès du @SyndicatUnifor à Québec : http://bit.ly/33M3sEo,28,165,17,1163476774690406400,https://twitter.com/JustinTrudeau/status/1163476774690406400,14260960,2019-08-19 15:44:14+00:00,Mon Aug 19 15:44:14 +0000 2019,@SyndicatUnifor,,,http://bit.ly/33M3sEo
AndrewScheer,,We know Justin Trudeau broke the law. Now we need to know if he committed a crime. Read my letter to the RCMP.pic.twitter.com/Cb6XFb4kO0,440,1128,273,1163476620960772096,https://twitter.com/AndrewScheer/status/1163476620960772096,256360738,2019-08-19 15:43:37+00:00,Mon Aug 19 15:43:37 +0000 2019,,,,
AndrewScheer,,"Justin Trudeau a enfreint la loi. Maintenant, nous devons savoir s’il a commis un crime. Lisez ma lettre à la GRC.pic.twitter.com/54XbGrapW1",16,48,7,1163476547694727169,https://twitter.com/AndrewScheer/status/1163476547694727169,256360738,2019-08-19 15:43:19+00:00,Mon Aug 19 15:43:19 +0000 2019,,,,
theJagmeetSingh,,"How about no, Elections Canada. One #ClimateChange denying Maxime Bernier isn't equal to a worldwide scientific consensus that the climate emergency is real & urgent. It's not partisan to discuss the single greatest threat faced by humanity.https://www.cbc.ca/news/politics/environment-groups-warned-climate-change-real-partisan-1.5251763 …",854,2587,377,1163464877677191169,https://twitter.com/theJagmeetSingh/status/1163464877677191169,253340075,2019-08-19 14:56:57+00:00,Mon Aug 19 14:56:57 +0000 2019,,#ClimateChange,,https://www.cbc.ca/news/politics/environment-groups-warned-climate-change-real-partisan-1.5251763
theJagmeetSingh,,"Non, Élections Canada. Maxime Bernier niant le changement climatique n'égale pas un consensus scientifique mondial; l'urgence climatique est réelle & urgente. Il n'est pas partisan de discuter de la plus grande menace à laquelle l'humanité est confrontée.https://ici.radio-canada.ca/nouvelle/1265203/scrutin-canada-ottawa-environnement-ecologie …",29,94,8,1163464870253268992,https://twitter.com/theJagmeetSingh/status/1163464870253268992,253340075,2019-08-19 14:56:55+00:00,Mon Aug 19 14:56:55 +0000 2019,,,,https://ici.radio-canada.ca/nouvelle/1265203/scrutin-canada-ottawa-environnement-ecologie
JustinTrudeau,,"Every day, humanitarian aid workers around the world make a lasting impact in the lives of millions of people. On #WorldHumanitarianDay, we pay tribute to their important work and recognize the sacrifices they make to help communities in crisis.https://pm.gc.ca/en/news/statements/2019/08/19/statement-prime-minister-world-humanitarian-day …",210,862,135,1163453364367241218,https://twitter.com/JustinTrudeau/status/1163453364367241218,14260960,2019-08-19 14:11:12+00:00,Mon Aug 19 14:11:12 +0000 2019,,#WorldHumanitarianDay,,https://pm.gc.ca/en/news/statements/2019/08/19/statement-prime-minister-world-humanitarian-day
JustinTrudeau,,"Chaque jour, des travailleurs humanitaires changent de façon durable la vie de millions de gens. En cette #JournéeMondialeDeLAideHumanitaire, nous rendons hommage à leur travail et reconnaissons leurs sacrifices pour aider les communautés en crise.https://pm.gc.ca/fr/nouvelles/declarations/2019/08/19/declaration-du-premier-ministre-loccasion-de-la-journee-mondiale …",32,151,14,1163453192220401665,https://twitter.com/JustinTrudeau/status/1163453192220401665,14260960,2019-08-19 14:10:31+00:00,Mon Aug 19 14:10:31 +0000 2019,,#JournéeMondialeDeLAideHumanitaire,,https://pm.gc.ca/fr/nouvelles/declarations/2019/08/19/declaration-du-premier-ministre-loccasion-de-la-journee-mondiale
AndrewScheer,,We know Justin Trudeau broke the law. Today I’m calling on the RCMP to investigate whether or not he committed a crime in the SNC-Lavalin corruption scandal. WATCH LIVE: https://www.facebook.com/AndrewScheerMP/videos/2278917689025238/ …,540,1884,713,1163453064822579200,https://twitter.com/AndrewScheer/status/1163453064822579200,256360738,2019-08-19 14:10:01+00:00,Mon Aug 19 14:10:01 +0000 2019,,,,https://www.facebook.com/AndrewScheerMP/videos/2278917689025238/
AndrewScheer,,"Justin Trudeau a enfreint la loi. Aujourd’hui, je demande à la GRC d’enquêter sur la possibilité qu’il ait commis un crime dans le scandale de corruption SNC-Lavalin. Regardez en direct : https://www.facebook.com/AndrewScheerMP/videos/2278917689025238/ …",14,50,7,1163453051044319232,https://twitter.com/AndrewScheer/status/1163453051044319232,256360738,2019-08-19 14:09:57+00:00,Mon Aug 19 14:09:57 +0000 2019,,,,https://www.facebook.com/AndrewScheerMP/videos/2278917689025238/
ElizabethMay,,"Suppose a politician decided smoking is good for you, would doctors have to register as third parties in an election to stress importance of kicking the habit? Elections Canada must reconsider. #climate #GPC https://www.nationalnewswatch.com/2019/08/18/environment-groups-warned-saying-climate-is-real-could-be-seen-as-partisan-2/#.XVqmth4pAlT …",594,1621,288,1163446361154568192,https://twitter.com/ElizabethMay/status/1163446361154568192,16220555,2019-08-19 13:43:22+00:00,Mon Aug 19 13:43:22 +0000 2019,,#climate #GPC #,,https://www.nationalnewswatch.com/2019/08/18/environment-groups-warned-saying-climate-is-real-could-be-seen-as-partisan-2/#.XVqmth4pAlT
JustinTrudeau,,"Today, we join Afghans and the Afghan-Canadian community in celebrating one hundred years of Afghanistan's Independence:https://pm.gc.ca/en/news/statements/2019/08/19/statement-prime-minister-afghanistans-independence-day …",216,1192,208,1163436278869889024,https://twitter.com/JustinTrudeau/status/1163436278869889024,14260960,2019-08-19 13:03:19+00:00,Mon Aug 19 13:03:19 +0000 2019,,,,https://pm.gc.ca/en/news/statements/2019/08/19/statement-prime-minister-afghanistans-independence-day
JustinTrudeau,,"Aujourd'hui, nous nous joignons aux Afghans et à la communauté afghane du Canada pour célébrer les cent ans de l'indépendance de l'Afghanistan :https://pm.gc.ca/fr/nouvelles/declarations/2019/08/19/declaration-du-premier-ministre-loccasion-du-jour-de …",22,181,8,1163436152784920578,https://twitter.com/JustinTrudeau/status/1163436152784920578,14260960,2019-08-19 13:02:49+00:00,Mon Aug 19 13:02:49 +0000 2019,,,,https://pm.gc.ca/fr/nouvelles/declarations/2019/08/19/declaration-du-premier-ministre-loccasion-du-jour-de
JustinTrudeau,,"On this day in 1942, nearly 5,000 Canadians fought with courage and resilience in the Dieppe Raid. Their heroism changed the course of history, and their sacrifices will never be forgotten. #LestWeForgethttps://pm.gc.ca/en/news/statements/2019/08/19/statement-prime-minister-77th-anniversary-dieppe-raid …",414,1838,323,1163423544602255361,https://twitter.com/JustinTrudeau/status/1163423544602255361,14260960,2019-08-19 12:12:43+00:00,Mon Aug 19 12:12:43 +0000 2019,,#LestWeForgethttps,,https://pm.gc.ca/en/news/statements/2019/08/19/statement-prime-minister-77th-anniversary-dieppe-raid
JustinTrudeau,,"En ce jour en 1942, près de 5 000 Canadiens ont combattu avec courage et résilience lors de l’offensive sur Dieppe. Leur héroïsme a changé le cours de l'histoire et leurs sacrifices ne seront pas oubliés. #NoublionsJamaishttps://pm.gc.ca/fr/nouvelles/declarations/2019/08/19/declaration-du-premier-ministre-loccasion-du-77e-anniversaire-de …",59,257,12,1163423402427899904,https://twitter.com/JustinTrudeau/status/1163423402427899904,14260960,2019-08-19 12:12:09+00:00,Mon Aug 19 12:12:09 +0000 2019,,#NoublionsJamaishttps,,https://pm.gc.ca/fr/nouvelles/declarations/2019/08/19/declaration-du-premier-ministre-loccasion-du-77e-anniversaire-de
yfblanchet,,"Le réchauffement planétaire: un enjeu ""partisan""? L'affaire la plus farfelue entendue depuis un moment. Ho! Et ce n'est pas Bernier, le principal bénéficiaire. C'est Justin Trudeau qui aimerait mieux ne pas en entendre parler sauf à sa propre façon...https://www.lesoleil.com/actualite/politique/parler-du-rechauffement-climatique-pourrait-etre-considere-comme-partisan-284b90752bae066b945998b07b57cdfc …",35,69,2,1163415652817936384,https://twitter.com/yfblanchet/status/1163415652817936384,38262290,2019-08-19 11:41:21+00:00,Mon Aug 19 11:41:21 +0000 2019,,,,https://www.lesoleil.com/actualite/politique/parler-du-rechauffement-climatique-pourrait-etre-considere-comme-partisan-284b90752bae066b945998b07b57cdfc
ElizabethMay,CKNW,Hooray!!!!https://twitter.com/CKNW/status/1163283568451293187 …,5,61,1,1163293276855779328,https://twitter.com/ElizabethMay/status/1163293276855779328,16220555,2019-08-19 03:35:04+00:00,Mon Aug 19 03:35:04 +0000 2019,,,,https://twitter.com/CKNW/status/1163283568451293187
yfblanchet,,Un bout d’entrevue à @RadioCanadaInfo lors du défilé de la Fierté. À vous de juger et partager... @BlocQuebecoispic.twitter.com/PSB121eaxd,10,28,1,1163265845709156352,https://twitter.com/yfblanchet/status/1163265845709156352,38262290,2019-08-19 01:46:04+00:00,Mon Aug 19 01:46:04 +0000 2019,@RadioCanadaInfo @BlocQuebecoispic,,,
JustinTrudeau,,"Pride is about so much more than a parade. It’s about celebrating our differences, and supporting one another no matter whom we love. #loveislove #prideMTLpic.twitter.com/eI7PsV51y2",1510,9795,997,1163255309391028225,https://twitter.com/JustinTrudeau/status/1163255309391028225,14260960,2019-08-19 01:04:12+00:00,Mon Aug 19 01:04:12 +0000 2019,,#loveislove #prideMTLpic,,
JustinTrudeau,,"La Fierté est beaucoup plus qu’un défilé. Elle vise à nous permettre de célébrer nos différences et d’être solidaires les uns des autres, peu importe qui on aime. #LamourCestLamour #FiertéMTLpic.twitter.com/K6SPGV7nP7",136,1047,62,1163255219041591297,https://twitter.com/JustinTrudeau/status/1163255219041591297,14260960,2019-08-19 01:03:51+00:00,Mon Aug 19 01:03:51 +0000 2019,,#LamourCestLamour #FiertéMTLpic,,
AndrewScheer,nationalpost,"To @anitavandenbeld, @RajSainiMP, @MonaFortier, @frankbaylis, @MPicardLiberal, and @beynate: Make the right decision on Wednesday. Let Parliament investigate the SNC-Lavalin scandal. You owe it to Canadians.https://twitter.com/nationalpost/status/1162814548988039170 …",231,652,110,1163241338676162560,https://twitter.com/AndrewScheer/status/1163241338676162560,256360738,2019-08-19 00:08:41+00:00,Mon Aug 19 00:08:41 +0000 2019,@anitavandenbeld @RajSainiMP @MonaFortier @frankbaylis @MPicardLiberal @beynate,,,https://twitter.com/nationalpost/status/1162814548988039170
AndrewScheer,nationalpost,"À @anitavandenbeld, @RajSainiMP, @MonaFortier, @frankbaylis, @MPicardLiberal et @beynate: Prenez la bonne décision mercredi. Laissez le Parlement enquêter sur le scandale SNC-Lavalin. Vous le devez aux Canadiens.https://twitter.com/nationalpost/status/1162814548988039170 …",15,65,7,1163241307655090176,https://twitter.com/AndrewScheer/status/1163241307655090176,256360738,2019-08-19 00:08:34+00:00,Mon Aug 19 00:08:34 +0000 2019,@anitavandenbeld @RajSainiMP @MonaFortier @frankbaylis @MPicardLiberal @beynate,,,https://twitter.com/nationalpost/status/1162814548988039170
