username,to,text,retweets,favorites,replies,id,permalink,author_id,date,formatted_date,mentions,hashtags,geo,urls
AndrewScheer,nationalpost,Appalling. It’s hard to believe the treatment Vice-Admiral Mark Norman and his family were subject to from their own government. Justin Trudeau should apologize to him and launch a public inquiry to get to the bottom of this awful ordeal.https://twitter.com/nationalpost/status/1129485123039178753 …,501,1495,195,1129879013571342336,https://twitter.com/AndrewScheer/status/1129879013571342336,256360738,2019-05-18 22:38:43+00:00,Sat May 18 22:38:43 +0000 2019,,,,https://twitter.com/nationalpost/status/1129485123039178753
AndrewScheer,nationalpost,Scandaleux. Il est difficile de croire au traitement du vice-amiral Mark Norman et de sa famille par leur propre gouvernement. Justin Trudeau devrait s’excuser et lancer une enquête publique pour faire la lumière sur cette terrible épreuve.https://twitter.com/nationalpost/status/1129485123039178753 …,15,75,7,1129878994994827264,https://twitter.com/AndrewScheer/status/1129878994994827264,256360738,2019-05-18 22:38:39+00:00,Sat May 18 22:38:39 +0000 2019,,,,https://twitter.com/nationalpost/status/1129485123039178753
ElizabethMay,,The recently crowned Green Man and Queen of the May. #MayneIsland #MayDay #SGI #GPCpic.twitter.com/RiMHIFs26N,5,62,10,1129861434857275392,https://twitter.com/ElizabethMay/status/1129861434857275392,16220555,2019-05-18 21:28:52+00:00,Sat May 18 21:28:52 +0000 2019,,#MayneIsland #MayDay #SGI #GPCpic,,
yfblanchet,,Au Gala Grand défi: Bâtir ma région à Gaspé. Une formidable initiative gaspésienne pour encourager l’entrepreneuriat auprès des jeunes. ⁦ @krimichaud⁩ ⁦ @MeganneMelancon⁩ ⁦ @BlocQuebecois⁩pic.twitter.com/y8dAJI4lxF,6,16,0,1129847123086925829,https://twitter.com/yfblanchet/status/1129847123086925829,38262290,2019-05-18 20:32:00+00:00,Sat May 18 20:32:00 +0000 2019,@krimichaud @MeganneMelancon @BlocQuebecois,,,
yfblanchet,,"Avec Mégane Perry-Mélançon, Guy Bernatchez, Kristina Michaud et Marilene Gill pour la renaissance excitante du Bloc Québécois dans Gaspésie-les-Îles. Un beau succès. pic.twitter.com/wXLWktE0PO",28,82,5,1129842403375030274,https://twitter.com/yfblanchet/status/1129842403375030274,38262290,2019-05-18 20:13:15+00:00,Sat May 18 20:13:15 +0000 2019,,,,
AndrewScheer,,Les gens arrivent à peine à s’en sortir. Ils ne peuvent sûrement pas améliorer leur quotidien. Le Canada devrait être un pays de « oui ».pic.twitter.com/nFGled1BMP,6,27,5,1129839322029580289,https://twitter.com/AndrewScheer/status/1129839322029580289,256360738,2019-05-18 20:01:00+00:00,Sat May 18 20:01:00 +0000 2019,,,,
AndrewScheer,,Right now people are barely getting by. And they’re definitely not getting ahead. Canada should be a country of “yes.”pic.twitter.com/EkYycLbThZ,94,350,112,1129839321798856704,https://twitter.com/AndrewScheer/status/1129839321798856704,256360738,2019-05-18 20:01:00+00:00,Sat May 18 20:01:00 +0000 2019,,,,
ElizabethMay,,On Mayne Island for #MayDay greeted by Green Man. #Mayne #SGIpic.twitter.com/yrgPiNwk5l,8,41,5,1129832655439007744,https://twitter.com/ElizabethMay/status/1129832655439007744,16220555,2019-05-18 19:34:30+00:00,Sat May 18 19:34:30 +0000 2019,,#MayDay #Mayne #SGIpic,,
theJagmeetSingh,,"Today, on Mullivaikkal Remembrance Day, we continue to seek justice for the families and survivors of the Tamil genocide. I unequivocally support the calls for an international investigation into acts of genocide and accountability for the perpetrators.https://www.ndp.ca/Mullivaikkal",52,139,11,1129815360151203840,https://twitter.com/theJagmeetSingh/status/1129815360151203840,253340075,2019-05-18 18:25:47+00:00,Sat May 18 18:25:47 +0000 2019,,,,https://www.ndp.ca/Mullivaikkal
theJagmeetSingh,,"En ce jour commémoratif du massacre tamoul à Mullivaikkal, nous continuons de réclamer justice pour les familles & les survivant·es. Je supporte les demandes pour une enquête internationale sur les actes génocidaires & l’imputabilité des responsables.https://www.npd.ca/Mullivaikkal",4,14,1,1129815130567524353,https://twitter.com/theJagmeetSingh/status/1129815130567524353,253340075,2019-05-18 18:24:52+00:00,Sat May 18 18:24:52 +0000 2019,,,,https://www.npd.ca/Mullivaikkal
JustinTrudeau,,"Congratulations, @ScottMorrisonMP on your electoral victory in Australia. I look forward to working together to create jobs and new opportunities for Canadians and Australians alike.https://pm.gc.ca/eng/news/2019/05/18/statement-prime-minister-canada-results-australian-general-election …",82,588,267,1129809606660771840,https://twitter.com/JustinTrudeau/status/1129809606660771840,14260960,2019-05-18 18:02:55+00:00,Sat May 18 18:02:55 +0000 2019,@ScottMorrisonMP,,,https://pm.gc.ca/eng/news/2019/05/18/statement-prime-minister-canada-results-australian-general-election
JustinTrudeau,,"Félicitations, @ScottMorrisonMP, pour votre victoire électorale en Australie. J’ai hâte de travailler avec vous afin de créer des emplois et de nouvelles opportunités pour les Canadiens comme pour les Australiens.https://pm.gc.ca/fra/nouvelles/2019/05/18/declaration-du-premier-ministre-du-canada-concernant-les-resultats-de-lelection …",22,165,18,1129809483973185536,https://twitter.com/JustinTrudeau/status/1129809483973185536,14260960,2019-05-18 18:02:26+00:00,Sat May 18 18:02:26 +0000 2019,@ScottMorrisonMP,,,https://pm.gc.ca/fra/nouvelles/2019/05/18/declaration-du-premier-ministre-du-canada-concernant-les-resultats-de-lelection
AndrewScheer,,Canadians can’t afford Justin Trudeau’s Carbon Tax. It’s making life more expensive while doing nothing for the environment. You can thank Justin Trudeau for the high gas prices as you fill up over the long weekend.http://angusreid.org/gas-prices/,315,909,535,1129808868555595776,https://twitter.com/AndrewScheer/status/1129808868555595776,256360738,2019-05-18 17:59:59+00:00,Sat May 18 17:59:59 +0000 2019,,,,http://angusreid.org/gas-prices/
AndrewScheer,,Les Canadiens ne peuvent pas se permettre la taxe sur le carbone de Justin Trudeau. Elle rend la vie plus chère sans rien faire pour l’environnement. Vous pouvez remercier Justin Trudeau pour l’augmentation du prix de l’essence cette fin de semaine. http://angusreid.org/gas-prices/,7,26,4,1129808802868539392,https://twitter.com/AndrewScheer/status/1129808802868539392,256360738,2019-05-18 17:59:44+00:00,Sat May 18 17:59:44 +0000 2019,,,,http://angusreid.org/gas-prices/
ElizabethMay,michaelcoren,Thank you. Smear campaigns distorting my views are par for the course. The assault on women's rights is chilling. Attacking the country's only woman leader is an odd distraction.https://twitter.com/michaelcoren/status/1129764348241633281 …,103,410,28,1129795719211016193,https://twitter.com/ElizabethMay/status/1129795719211016193,16220555,2019-05-18 17:07:44+00:00,Sat May 18 17:07:44 +0000 2019,,,,https://twitter.com/michaelcoren/status/1129764348241633281
ElizabethMay,thejamesriley,Fighting climate breakdown will create millions of jobs. Skills shortage is a bigger problem. #GPC #GPCMissionPossiblehttps://twitter.com/thejamesriley/status/1129790628093542400 …,22,39,5,1129793787503374336,https://twitter.com/ElizabethMay/status/1129793787503374336,16220555,2019-05-18 17:00:04+00:00,Sat May 18 17:00:04 +0000 2019,,#GPC #GPCMissionPossiblehttps,,https://twitter.com/thejamesriley/status/1129790628093542400
ElizabethMay,CBCTheHouse,So great to hear a CBC panel with a Green pundit! Thanks! @Joannrobertsk #GPC #cdnpoli @CBCTheHousehttps://twitter.com/CBCTheHouse/status/1129763574405115906 …,13,35,0,1129793005152493568,https://twitter.com/ElizabethMay/status/1129793005152493568,16220555,2019-05-18 16:56:57+00:00,Sat May 18 16:56:57 +0000 2019,@Joannrobertsk @CBCTheHousehttps,#GPC #cdnpoli,,https://twitter.com/CBCTheHouse/status/1129763574405115906
ElizabethMay,JanetHealth,Thank you! Really honoured to have your support. #GPChttps://twitter.com/JanetHealth/status/1129789072803794945 …,2,13,3,1129792003061927936,https://twitter.com/ElizabethMay/status/1129792003061927936,16220555,2019-05-18 16:52:58+00:00,Sat May 18 16:52:58 +0000 2019,,#GPChttps,,https://twitter.com/JanetHealth/status/1129789072803794945
ElizabethMay,,"Did lawmakers in Alabama and Missouri watch Handmaid's Tale and think it was a ""how to"" manual? Deeply disturbing assault on women's rights. #GPC #AbortionIsAHumanRight",115,439,33,1129789067682504704,https://twitter.com/ElizabethMay/status/1129789067682504704,16220555,2019-05-18 16:41:18+00:00,Sat May 18 16:41:18 +0000 2019,,#GPC #AbortionIsAHumanRight,,
MaximeBernier,,"Les Australiens ont voté pour moins d’immigration, moins d’interventionnisme étatique dans l’économie, et contre les coûteuses politiques climatiques de la gauche. Cette tendance grossit partout et atteindra le Canada en octobre!https://nyti.ms/2HqG9ac",55,143,3,1129788970756390913,https://twitter.com/MaximeBernier/status/1129788970756390913,2791988124,2019-05-18 16:40:55+00:00,Sat May 18 16:40:55 +0000 2019,,,,https://nyti.ms/2HqG9ac
MaximeBernier,,"Australians voted for less immigration, less government intervention in the economy, and against the costly climate change policies of the Left. This trend is growing everywhere and will reach Canada in October!https://nyti.ms/2HqG9ac",1150,2852,206,1129786897126047744,https://twitter.com/MaximeBernier/status/1129786897126047744,2791988124,2019-05-18 16:32:41+00:00,Sat May 18 16:32:41 +0000 2019,,,,https://nyti.ms/2HqG9ac
theJagmeetSingh,,This rule is completely arbitrary – and the outcome is egregiously disproportionate to the alleged offence.https://globalnews.ca/news/5288366/canada-international-student-who-worked-too-much-deportation/ …,108,363,35,1129786115303587840,https://twitter.com/theJagmeetSingh/status/1129786115303587840,253340075,2019-05-18 16:29:34+00:00,Sat May 18 16:29:34 +0000 2019,,,,https://globalnews.ca/news/5288366/canada-international-student-who-worked-too-much-deportation/
theJagmeetSingh,,"Un étudiant étranger a été arrêté pour avoir trop travaillé et pourrait maintenant être expulsé du pays. Cette règle est absolument arbitraire et ce qui arrive à cet étudiant est complètement disproportionné, par rapport à l'infraction alléguée. https://globalnews.ca/news/5288366/canada-international-student-who-worked-too-much-deportation/ …",7,28,2,1129786102057975808,https://twitter.com/theJagmeetSingh/status/1129786102057975808,253340075,2019-05-18 16:29:31+00:00,Sat May 18 16:29:31 +0000 2019,,,,https://globalnews.ca/news/5288366/canada-international-student-who-worked-too-much-deportation/
ElizabethMay,INTEGRITYBC,"At the provincial and federal level, Greens have been pushing for inquiry into money laundering. Very pleased this is finally happening. #dirtymoney #bcgreens #GPChttps://twitter.com/INTEGRITYBC/status/1129513359408111616 …",17,41,6,1129785549722537985,https://twitter.com/ElizabethMay/status/1129785549722537985,16220555,2019-05-18 16:27:20+00:00,Sat May 18 16:27:20 +0000 2019,,#dirtymoney #bcgreens #GPChttps,,https://twitter.com/INTEGRITYBC/status/1129513359408111616
ElizabethMay,,Such great news that the tariffs on steel and aluminum are lifted. Congrats @cafreeland #GPC,225,2172,126,1129784171298033664,https://twitter.com/ElizabethMay/status/1129784171298033664,16220555,2019-05-18 16:21:51+00:00,Sat May 18 16:21:51 +0000 2019,@cafreeland,#GPC,,
ElizabethMay,BobHeaslip,Mission Possible means we move off fossil fuels. 60% less by 2030. Zero by 2050. Exports are reduced. @BobHeaslip,9,31,5,1129783688793747456,https://twitter.com/ElizabethMay/status/1129783688793747456,16220555,2019-05-18 16:19:56+00:00,Sat May 18 16:19:56 +0000 2019,@BobHeaslip,,,
ElizabethMay,VyeOne,"I have always supported the right of any woman to safe, legal abortion. Full stop. @VyeOne",10,71,2,1129783095572303872,https://twitter.com/ElizabethMay/status/1129783095572303872,16220555,2019-05-18 16:17:34+00:00,Sat May 18 16:17:34 +0000 2019,@VyeOne,,,
ElizabethMay,2chevronsback,Correct. These smears and attacks are a reaction fm other parties to our growing support. @2chevronsback @marlenejennings @papillon4444,11,45,12,1129782494423707649,https://twitter.com/ElizabethMay/status/1129782494423707649,16220555,2019-05-18 16:15:11+00:00,Sat May 18 16:15:11 +0000 2019,@2chevronsback @marlenejennings @papillon4444,,,
ElizabethMay,michaelcoren,Exactly. We must ensure abortions remain legal and accessible to any woman.https://twitter.com/michaelcoren/status/1129768934096474113 …,23,92,7,1129771834692423680,https://twitter.com/ElizabethMay/status/1129771834692423680,16220555,2019-05-18 15:32:50+00:00,Sat May 18 15:32:50 +0000 2019,,,,https://twitter.com/michaelcoren/status/1129768934096474113
ElizabethMay,CouncilofCDNs,"Please check out #GPCMissionPossible . Greens are committed to doing what it takes to hold to the Paris 1.5 degree target, and do it with equity, justice and honest hope. #GPChttps://twitter.com/CouncilofCDNs/status/1129767556867330048 …",28,56,4,1129770911547027456,https://twitter.com/ElizabethMay/status/1129770911547027456,16220555,2019-05-18 15:29:10+00:00,Sat May 18 15:29:10 +0000 2019,,#GPCMissionPossible #GPChttps,,https://twitter.com/CouncilofCDNs/status/1129767556867330048
yfblanchet,,"Enfin! Gaspé! Guy Bernatchez, un autre jeune et formidable candidat pour nous et le Québec, mais surtout la Gaspésie et les Îles! ⁦ @GillMarilene⁩ ⁦ @BlocQuebecois⁩pic.twitter.com/OZT94Lx8H5",17,46,2,1129770225715621890,https://twitter.com/yfblanchet/status/1129770225715621890,38262290,2019-05-18 15:26:26+00:00,Sat May 18 15:26:26 +0000 2019,@GillMarilene @BlocQuebecois,,,
MaximeBernier,,La gauche devient plus autoritaire tous les jours au Canada et dans d’autres démocraties et ses attaques contre nos libertés s’intensifient. -censure en ligne -contrôle des médias -alarmisme climatique -culte de la diversité -contrôle des armes -immigration de masse -mondialisme,58,135,17,1129760500819144704,https://twitter.com/MaximeBernier/status/1129760500819144704,2791988124,2019-05-18 14:47:47+00:00,Sat May 18 14:47:47 +0000 2019,,,,
JustinTrudeau,,"This week in Paris, Canada signed the #ChristchurchCall to Action, and announced we’ll be launching a new Digital Charter. We’re stepping up and working to restore trust in the digital world, remove hateful & violent content online, and hold social media platforms accountable.pic.twitter.com/dX9mhPaDu5",828,4543,1006,1129759928921595911,https://twitter.com/JustinTrudeau/status/1129759928921595911,14260960,2019-05-18 14:45:31+00:00,Sat May 18 14:45:31 +0000 2019,,#ChristchurchCall,,
JustinTrudeau,,"Cette semaine à Paris, le Canada a signé l' #AppelDeChristchurch et annoncé le lancement d'une Charte numérique. On vise à rétablir la confiance dans le monde numérique, à éliminer le contenu haineux et violent en ligne et à demander des comptes aux plateformes de médias sociaux.pic.twitter.com/N1bZnlwYxH",85,531,38,1129759830615494656,https://twitter.com/JustinTrudeau/status/1129759830615494656,14260960,2019-05-18 14:45:08+00:00,Sat May 18 14:45:08 +0000 2019,,#AppelDeChristchurch,,
ElizabethMay,sarmcbride,"Out of context quotes from a strong defence of abortion rights, explaining to nuns why making sure abortion is legal saves lives. I have never ever opposed a woman's right to safe, legal abortion. Period.https://twitter.com/sarmcbride/status/1129626802723274752 …",55,227,20,1129759389450231809,https://twitter.com/ElizabethMay/status/1129759389450231809,16220555,2019-05-18 14:43:23+00:00,Sat May 18 14:43:23 +0000 2019,,,,https://twitter.com/sarmcbride/status/1129626802723274752
MaximeBernier,,"The Left is every day becoming more openly authoritarian in Canada and in other democracies, and its attacks on our freedoms are intensifying. -censorship online -enforced speech -control of the press -climate alarmism -gun control -diversity cult -mass immigration -globalism",905,2095,182,1129759364619935744,https://twitter.com/MaximeBernier/status/1129759364619935744,2791988124,2019-05-18 14:43:17+00:00,Sat May 18 14:43:17 +0000 2019,,,,
MaximeBernier,RudyMeteo,L’hystérie climatique s’intensifie partout. Les partis ont passé la semaine à débattre une déclaration d’état d’urgence climatique à Ottawa. Et les médias vont maintenant adopter des termes plus alarmistes pour faire encore plus peur au monde.https://twitter.com/RudyMeteo/status/1129705733472313344 …,42,82,5,1129753684005523463,https://twitter.com/MaximeBernier/status/1129753684005523463,2791988124,2019-05-18 14:20:42+00:00,Sat May 18 14:20:42 +0000 2019,,,,https://twitter.com/RudyMeteo/status/1129705733472313344
MaximeBernier,,"Climate hysteria is intensifying everywhere. Parties debated declaring a “climate emergency” this week in Ottawa. And since climate change doesn’t sound alarmist enough, the media are now officially switching to “climate emergency, crisis or breakdown.”https://www.theguardian.com/environment/2019/may/17/why-the-guardian-is-changing-the-language-it-uses-about-the-environment?CMP=share_btn_tw …",440,950,209,1129752126039691266,https://twitter.com/MaximeBernier/status/1129752126039691266,2791988124,2019-05-18 14:14:31+00:00,Sat May 18 14:14:31 +0000 2019,,,,https://www.theguardian.com/environment/2019/may/17/why-the-guardian-is-changing-the-language-it-uses-about-the-environment?CMP=share_btn_tw
AndrewScheer,,Un Canada indépendant sur le plan énergétique fonctionnerait à pleins calibres dans l’ensemble des secteurs et régions. Nous avons du pétrole. Mettons un terme à toutes les importations de pétrole étranger une bonne fois pour toutes.pic.twitter.com/NLY3wqfS7p,10,37,5,1129748725264527360,https://twitter.com/AndrewScheer/status/1129748725264527360,256360738,2019-05-18 14:01:00+00:00,Sat May 18 14:01:00 +0000 2019,,,,
AndrewScheer,,An energy independent Canada would be a Canada firing on all cylinders – across all sectors and regions. We have more than enough Canadian oil – so let’s put an end to all foreign oil imports once and for all.pic.twitter.com/xeTpfeeMBJ,491,1489,288,1129748725121900546,https://twitter.com/AndrewScheer/status/1129748725121900546,256360738,2019-05-18 14:01:00+00:00,Sat May 18 14:01:00 +0000 2019,,,,
yfblanchet,,Il serait dommage de renoncer à une réforme démocratique saine et salutaire pour que quelques députés ou même un gouvernement protègent leur job. J’ai confiance que Québec fera mieux qu’Ottawa et respectera son engagement solennel. ⁦ @BlocQuebecois⁩https://www.ledevoir.com/politique/quebec/554708/la-ministre-sonia-lebel-suspend-les-consultations-sur-la-reforme-du-mode-de-scrutin …,14,35,6,1129738792959709184,https://twitter.com/yfblanchet/status/1129738792959709184,38262290,2019-05-18 13:21:32+00:00,Sat May 18 13:21:32 +0000 2019,@BlocQuebecois,,,https://www.ledevoir.com/politique/quebec/554708/la-ministre-sonia-lebel-suspend-les-consultations-sur-la-reforme-du-mode-de-scrutin
yfblanchet,,"Analyse pertinente et d’un niveau intellectuel qui tranche avec la démagogie et l’enflure ambiantes. Tout insiste, que c’en soit l’intention ou pas, pour que le Québec affirme qui il est comme argument d’accueil et d’intégration généreux.https://www.ledevoir.com/politique/quebec/554686/le-projet-de-loi-mettra-t-il-reellement-fin-au-debat …",19,26,1,1129737651131699201,https://twitter.com/yfblanchet/status/1129737651131699201,38262290,2019-05-18 13:17:00+00:00,Sat May 18 13:17:00 +0000 2019,,,,https://www.ledevoir.com/politique/quebec/554686/le-projet-de-loi-mettra-t-il-reellement-fin-au-debat
JustinTrudeau,,"It’s been 10 years since the end of the armed conflict in Sri Lanka. Today, we remember those who were killed, and extend our sympathies to Tamil-Canadians and everyone who suffered & lost loved ones.https://pm.gc.ca/eng/news/2019/05/18/statement-prime-minister-10th-anniversary-end-armed-conflict-sri-lanka …",337,1188,109,1129735899493879808,https://twitter.com/JustinTrudeau/status/1129735899493879808,14260960,2019-05-18 13:10:02+00:00,Sat May 18 13:10:02 +0000 2019,,,,https://pm.gc.ca/eng/news/2019/05/18/statement-prime-minister-10th-anniversary-end-armed-conflict-sri-lanka
JustinTrudeau,,"Dix ans se sont écoulés depuis la fin du conflit armé au Sri Lanka. Aujourd'hui, nous nous souvenons de ceux qui sont morts et offrons nos condoléances aux Canadiens tamouls et à tous ceux qui ont souffert et perdu des proches.https://pm.gc.ca/fra/nouvelles/2019/05/18/declaration-du-premier-ministre-loccasion-du-10e-anniversaire-de-la-fin-du …",36,250,15,1129735761270587392,https://twitter.com/JustinTrudeau/status/1129735761270587392,14260960,2019-05-18 13:09:29+00:00,Sat May 18 13:09:29 +0000 2019,,,,https://pm.gc.ca/fra/nouvelles/2019/05/18/declaration-du-premier-ministre-loccasion-du-10e-anniversaire-de-la-fin-du
yfblanchet,,"Bien sûr, il y a des modulations et des responsabilités mais le ⁦ @BlocQuebecois⁩ est toujours sensibles aux enjeux humanitaires ou simplement humains, et pas du tout sensible à s’aligner sur les USA. «Honte au régime Trudeau |Le Journal de Montréal»https://www.journaldemontreal.com/2019/05/17/honte-au-regime-trudeau …",17,29,1,1129731867685654529,https://twitter.com/yfblanchet/status/1129731867685654529,38262290,2019-05-18 12:54:01+00:00,Sat May 18 12:54:01 +0000 2019,@BlocQuebecois,,,https://www.journaldemontreal.com/2019/05/17/honte-au-regime-trudeau
ElizabethMay,RawStory,@geoffreylaxton,1,2,0,1129590834045771776,https://twitter.com/ElizabethMay/status/1129590834045771776,16220555,2019-05-18 03:33:36+00:00,Sat May 18 03:33:36 +0000 2019,@geoffreylaxton,,,
ElizabethMay,350Canada,Great! Please have a look at #MissionPossible from the #GPC. Meaningful action to the right target! #climatehttps://twitter.com/350Canada/status/1128707638089281536 …,23,69,7,1129587790948134912,https://twitter.com/ElizabethMay/status/1129587790948134912,16220555,2019-05-18 03:21:30+00:00,Sat May 18 03:21:30 +0000 2019,,#MissionPossible #GPC #climatehttps,,https://twitter.com/350Canada/status/1128707638089281536
yfblanchet,,pic.twitter.com/hXBxBMLLrr,13,24,1,1129563838679080960,https://twitter.com/yfblanchet/status/1129563838679080960,38262290,2019-05-18 01:46:20+00:00,Sat May 18 01:46:20 +0000 2019,,,,
MaximeBernier,,"Libs impose diversity cult on universities. “What does “equity, diversity, and inclusion” mean in practice? Certain categories of people must be favoured in academic competitions, while unfavoured categories of people must be excluded.” https://pjmedia.com/news-and-politics/canadian-government-imposes-social-justice-on-all-universities/ … #NewsandPolitics",201,388,55,1129550013300912129,https://twitter.com/MaximeBernier/status/1129550013300912129,2791988124,2019-05-18 00:51:23+00:00,Sat May 18 00:51:23 +0000 2019,,#NewsandPolitics,,https://pjmedia.com/news-and-politics/canadian-government-imposes-social-justice-on-all-universities/
MaximeBernier,MaryamMonsef,Vous voulez savoir ce que les libéraux visent en essayant de restreindre la liberté d’expression sur les médias sociaux? La ministre Monsef donne un de mes tweets comme exemple de «violence et haine en ligne» qu’il faut «éradiquer».https://twitter.com/MaryamMonsef/status/1129479802271031296 …,38,87,4,1129539971222855680,https://twitter.com/MaximeBernier/status/1129539971222855680,2791988124,2019-05-18 00:11:29+00:00,Sat May 18 00:11:29 +0000 2019,,,,https://twitter.com/MaryamMonsef/status/1129479802271031296
MaximeBernier,MaryamMonsef,Want to know what the Liberals have in mind as they push to restrict free speech on social media? Minister Maryam Monsef offers my tweet about being blocked by Rempel as an example of “online violence and hate” that needs to be “stamped out.”https://twitter.com/MaryamMonsef/status/1129479802271031296 …,322,643,106,1129538659047354369,https://twitter.com/MaximeBernier/status/1129538659047354369,2791988124,2019-05-18 00:06:16+00:00,Sat May 18 00:06:16 +0000 2019,,,,https://twitter.com/MaryamMonsef/status/1129479802271031296
