username,to,text,retweets,favorites,replies,id,permalink,author_id,date,formatted_date,mentions,hashtags,geo,urls
AndrewScheer,,"Once again, the Trudeau Liberals have been caught red-handed abusing the power of their offices to reward their rich and powerful friends. My statement: https://www.facebook.com/AndrewScheerMP/posts/2762774730422928 …",412,1023,312,1146201143409819648,https://twitter.com/AndrewScheer/status/1146201143409819648,256360738,2019-07-02 23:37:02+00:00,Tue Jul 02 23:37:02 +0000 2019,,,,https://www.facebook.com/AndrewScheerMP/posts/2762774730422928
AndrewScheer,,"Encore une fois, les libéraux de Trudeau ont été pris la main dans le sac tandis qu’ils abusaient du pouvoir de leur cabinet pour récompenser leurs amis riches et puissants. Ma déclaration: https://www.facebook.com/AndrewScheerMP/posts/2762776700422731 …",9,24,5,1146201119976316929,https://twitter.com/AndrewScheer/status/1146201119976316929,256360738,2019-07-02 23:36:57+00:00,Tue Jul 02 23:36:57 +0000 2019,,,,https://www.facebook.com/AndrewScheerMP/posts/2762776700422731
AndrewScheer,,Justin Trudeau has failed and Canadians are paying for it. Our canola farmers are paying for it. Our beef and pork producers are paying for it. And Michael Spavor and Michael Kovrig are paying for it. It’s time to send the message that Canada will not be pushed around.pic.twitter.com/kyKcsjucYg,226,624,312,1146196374385549312,https://twitter.com/AndrewScheer/status/1146196374385549312,256360738,2019-07-02 23:18:05+00:00,Tue Jul 02 23:18:05 +0000 2019,,,,
AndrewScheer,,Justin Trudeau échoue et les Canadiens en paient le prix. Nos producteurs de canola en paient le prix. Nos éleveurs de porc et de bœuf en paient le prix. Michael Spavor et Michael Kovrig en paient le prix. Il est temps de faire comprendre que le Canada ne se laissera pas faire.pic.twitter.com/ewEUHy9Rw4,10,27,4,1146196341405736964,https://twitter.com/AndrewScheer/status/1146196341405736964,256360738,2019-07-02 23:17:57+00:00,Tue Jul 02 23:17:57 +0000 2019,,,,
yfblanchet,,"Presque triste... Sortir du pétrole est mathématique. Aucune des solutions n'évite de réduire l'extraction, la transformation, l'exportation et la combustion du pétrole. Aucune. Les Verts essaient d'être pétroliers et verts, semble-t-il. C'est impossible.https://www.lapresse.ca/actualites/politique/201906/29/01-5232109-la-position-delizabeth-may-sur-le-petrole-critiquee.php?utm_source=dlvr.it&utm_medium=twitter …",36,62,12,1146191215580327936,https://twitter.com/yfblanchet/status/1146191215580327936,38262290,2019-07-02 22:57:35+00:00,Tue Jul 02 22:57:35 +0000 2019,,,,https://www.lapresse.ca/actualites/politique/201906/29/01-5232109-la-position-delizabeth-may-sur-le-petrole-critiquee.php?utm_source=dlvr.it&utm_medium=twitter
JustinTrudeau,,"Canada will always stand with the people of Ukraine, and we’ll continue to support their efforts on the path to greater democracy, security, and prosperity. Read more about my meeting with @ZelenskyyUa and this week’s @UkrReformConf: https://bit.ly/2XiN89V pic.twitter.com/qfDou1k7xk",224,1396,225,1146180513666863106,https://twitter.com/JustinTrudeau/status/1146180513666863106,14260960,2019-07-02 22:15:04+00:00,Tue Jul 02 22:15:04 +0000 2019,@ZelenskyyUa @UkrReformConf,,,https://bit.ly/2XiN89V
JustinTrudeau,,"Le Canada sera toujours solidaire du peuple ukrainien et appuiera les efforts déployés par le pays pour améliorer la démocratie, la sécurité et la prospérité. Pour en savoir plus sur ma rencontre avec @ZelenskyyUa et la @ConfReformesUkr de cette semaine : https://bit.ly/2LzBJjB pic.twitter.com/an9QTOTESV",40,316,24,1146180125010120704,https://twitter.com/JustinTrudeau/status/1146180125010120704,14260960,2019-07-02 22:13:31+00:00,Tue Jul 02 22:13:31 +0000 2019,@ZelenskyyUa @ConfReformesUkr,,,https://bit.ly/2LzBJjB
AndrewScheer,CTVNews,Justin Trudeau rend la vie plus chère pour les Canadiens. Dans le nord où le coût de la vie est déjà extrêmement élevé sa taxe sur le carbone fait du mal aux Canadiens et n’aide en rien l’environnement. Demain j’irai au Yukon pour expliquer comment j’abolirai cette taxe injuste.https://twitter.com/CTVNews/status/1145738997995622403 …,8,29,3,1146177478089687040,https://twitter.com/AndrewScheer/status/1146177478089687040,256360738,2019-07-02 22:03:00+00:00,Tue Jul 02 22:03:00 +0000 2019,,,,https://twitter.com/CTVNews/status/1145738997995622403
AndrewScheer,CTVNews,"Justin Trudeau is making life more expensive for Canadians. In the north, where the cost of living is already extremely high, his carbon tax hurts Canadians and does nothing for the environment. I'll be in Yukon Territory tomorrow, talking about scrapping Trudeau’s unfair tax.https://twitter.com/CTVNews/status/1145738997995622403 …",363,1181,320,1146177477968113667,https://twitter.com/AndrewScheer/status/1146177477968113667,256360738,2019-07-02 22:03:00+00:00,Tue Jul 02 22:03:00 +0000 2019,,,,https://twitter.com/CTVNews/status/1145738997995622403
AndrewScheer,,J’ai appris à quel point les familles d’Iqaluit ont de la difficulté à joindre les deux bouts. Justin Trudeau leur rend la tâche encore plus difficile avec sa taxe sur le carbone qui fait monter le coût de la vie sans aider notre environnement. C’est pour ça que je l’abolirai!pic.twitter.com/o52iyknAwy,8,18,1,1146146779475402752,https://twitter.com/AndrewScheer/status/1146146779475402752,256360738,2019-07-02 20:01:01+00:00,Tue Jul 02 20:01:01 +0000 2019,,,,
AndrewScheer,,"I heard firsthand in Iqaluit recently how hard it is for families to get by with the high cost of living. Now, Justin Trudeau is making it even worse with his carbon tax that makes life more expensive while doing nothing to help the environment. That’s why I'll scrap it.pic.twitter.com/krziAYGMgX",103,378,312,1146146775973208064,https://twitter.com/AndrewScheer/status/1146146775973208064,256360738,2019-07-02 20:01:00+00:00,Tue Jul 02 20:01:00 +0000 2019,,,,
JustinTrudeau,,"Welcome to Toronto, @ZelenskyyUa. Canadians stand with the Ukrainian people & will always defend Ukraine’s sovereignty. We are close friends & allies, and together we’re working to create more good, middle class jobs for people in both our countries.pic.twitter.com/QEA1ZV1Ism",252,1620,168,1146145765854720000,https://twitter.com/JustinTrudeau/status/1146145765854720000,14260960,2019-07-02 19:56:59+00:00,Tue Jul 02 19:56:59 +0000 2019,@ZelenskyyUa,,,
JustinTrudeau,,"Bienvenue à Toronto, @ZelenskyyUa. Les Canadiens sont solidaires du peuple ukrainien et vont toujours défendre la souveraineté de l’Ukraine. Nous sommes des amis et des alliés proches, et nous créons ensemble plus de bons emplois pour la classe moyenne de nos deux pays.pic.twitter.com/DfHOj36qMh",40,289,15,1146145692014063617,https://twitter.com/JustinTrudeau/status/1146145692014063617,14260960,2019-07-02 19:56:41+00:00,Tue Jul 02 19:56:41 +0000 2019,@ZelenskyyUa,,,
JustinTrudeau,,"Lieutenant Governor Tom Molloy's dedicated service to Canadians and his work to advance reconciliation with Indigenous peoples made Canada a better place. Sophie and I send our deepest condolences to his family and friends, & to the people of Saskatchewan.https://pm.gc.ca/eng/news/2019/07/02/statement-prime-minister-death-lieutenant-governor-saskatchewan-tom-molloy …",67,453,19,1146142272003727360,https://twitter.com/JustinTrudeau/status/1146142272003727360,14260960,2019-07-02 19:43:06+00:00,Tue Jul 02 19:43:06 +0000 2019,,,,https://pm.gc.ca/eng/news/2019/07/02/statement-prime-minister-death-lieutenant-governor-saskatchewan-tom-molloy
JustinTrudeau,,Le dévouement du lieutenant-gouverneur Tom Molloy envers les Canadiens et son travail de réconciliation avec les Autochtones ont rendu le Canada meilleur. Sophie et moi offrons nos sincères condoléances à sa famille et à la population de la Saskatchewan.https://pm.gc.ca/fra/nouvelles/2019/07/02/declaration-du-premier-ministre-concernant-deces-du-lieutenant-gouverneur-de-la …,10,119,2,1146142211052101632,https://twitter.com/JustinTrudeau/status/1146142211052101632,14260960,2019-07-02 19:42:52+00:00,Tue Jul 02 19:42:52 +0000 2019,,,,https://pm.gc.ca/fra/nouvelles/2019/07/02/declaration-du-premier-ministre-concernant-deces-du-lieutenant-gouverneur-de-la
yfblanchet,,"Ma grand-mère Joséphine - une femme douce - habitait à la maison et réservait ses seules colères aux méchants de la lutte dans la petite télé N&B. Jacques Rougeau, c’était une star! Mes condoléances à celles et ceux qui l’ont aimé, de près ou à l’écran.https://www.lapresse.ca/sports/sports-de-combat/201907/02/01-5232418-lancien-lutteur-jacques-rougeau-pere-est-mort.php …",22,85,8,1146122269716094977,https://twitter.com/yfblanchet/status/1146122269716094977,38262290,2019-07-02 18:23:37+00:00,Tue Jul 02 18:23:37 +0000 2019,,,,https://www.lapresse.ca/sports/sports-de-combat/201907/02/01-5232418-lancien-lutteur-jacques-rougeau-pere-est-mort.php
MaximeBernier,,"5/ Francis: “People should be given entry if they fill a job that a Canadian cannot perform. Instead, the Liberals are like an HR Department that recruits people then hopes they find jobs or match those already posted.”",103,324,24,1146114899795501056,https://twitter.com/MaximeBernier/status/1146114899795501056,2791988124,2019-07-02 17:54:20+00:00,Tue Jul 02 17:54:20 +0000 2019,,,,
MaximeBernier,,4/ Francis: “The Liberals also add that more immigration is needed to boost the size of the country’s population overall. But the vast majority of new entrants will end up crowding into a handful of already-crowded cities.”,86,295,6,1146114793562095616,https://twitter.com/MaximeBernier/status/1146114793562095616,2791988124,2019-07-02 17:53:55+00:00,Tue Jul 02 17:53:55 +0000 2019,,,,
MaximeBernier,,"3/ Francis: “The Liberals claim that the huge increase in immigration is required to fill skills shortages. But nearly half of those admitted won’t be working, perhaps ever, and wouldn’t qualify to be admitted as economic immigrants with skills.”",92,256,13,1146114670002135041,https://twitter.com/MaximeBernier/status/1146114670002135041,2791988124,2019-07-02 17:53:25+00:00,Tue Jul 02 17:53:25 +0000 2019,,,,
MaximeBernier,,"2/ Francis: “This 1M — half of whom are family immigrants and not economically free-standing immigrants — is unsustainable. Equivalent to the population of both Ottawa and Edmonton, that’s a lot of health care, educational costs, infrastructure pressure, and housing shortages.”",96,259,9,1146114560698527744,https://twitter.com/MaximeBernier/status/1146114560698527744,2791988124,2019-07-02 17:52:59+00:00,Tue Jul 02 17:52:59 +0000 2019,,,,
MaximeBernier,nationalpost,"1/ Diane Francis offers several good arguments against accepting 1M immigrants in the next 3 years, as the Trudeau government is planning to do. But our leftist elites don’t want a rational discussion. Their only argument is that it’s “racist” to want lower immigration levels.https://twitter.com/nationalpost/status/1146038077149929473 …",398,850,65,1146114314090274817,https://twitter.com/MaximeBernier/status/1146114314090274817,2791988124,2019-07-02 17:52:00+00:00,Tue Jul 02 17:52:00 +0000 2019,,,,https://twitter.com/nationalpost/status/1146038077149929473
yfblanchet,Alduceppe,Réjean Tremblay donne un appui sans équivoque à @Alduceppe https://twitter.com/Alduceppe/status/1146094169049501696 …,13,40,0,1146096064635838465,https://twitter.com/yfblanchet/status/1146096064635838465,38262290,2019-07-02 16:39:29+00:00,Tue Jul 02 16:39:29 +0000 2019,@Alduceppe,,,https://twitter.com/Alduceppe/status/1146094169049501696
yfblanchet,,Loïc Tassé est une des voix les plus solides en relations internationales au Québec. Il n'a pas la langue dans sa poche. Justin trudeau passe ici un mauvais moment. Pas méchant... Pas compétent. Le Canada est un petit moutin vulnérable sous sa gouverne...https://www.journaldemontreal.com/2019/06/29/un-sommet-domine-par-des-ignorants-ou-des-assassins …,30,43,2,1146087134891270147,https://twitter.com/yfblanchet/status/1146087134891270147,38262290,2019-07-02 16:04:00+00:00,Tue Jul 02 16:04:00 +0000 2019,,,,https://www.journaldemontreal.com/2019/06/29/un-sommet-domine-par-des-ignorants-ou-des-assassins
yfblanchet,,"Vague importante de nouveaux comptes avec peu d'abonnés chacun qui viennent dénigrer mes propos de façon systématique. Des airs d'attaque de trolls montées par des adversaires. Au pif, les commentaires ont une touche plutôt conservatrice. Au pif, c'est pas fini...",80,214,45,1146086595826737152,https://twitter.com/yfblanchet/status/1146086595826737152,38262290,2019-07-02 16:01:52+00:00,Tue Jul 02 16:01:52 +0000 2019,,,,
AndrewScheer,,"J’ai voyagé à travers notre beau pays hier pour célébrer avec des Canadiens d’un océan à l’autre! J’étais à Kelowna, au concert et, ensuite, aux feux d’artifice avec notre candidate conservatrice @TracyGrayKLC. Joyeuse fête du Canada!pic.twitter.com/DGJZW3BbHd",4,29,6,1146059840235511811,https://twitter.com/AndrewScheer/status/1146059840235511811,256360738,2019-07-02 14:15:33+00:00,Tue Jul 02 14:15:33 +0000 2019,@TracyGrayKLC,,,
AndrewScheer,,"Trois provinces, quatre vols, cinq fuseaux horaires, un seul beau pays. J’ai eu une merveilleuse Fête du Canada pancanadienne. Où avez-vous célébré? pic.twitter.com/PNHqOnMTS8",1,22,3,1146055675165982720,https://twitter.com/AndrewScheer/status/1146055675165982720,256360738,2019-07-02 13:59:00+00:00,Tue Jul 02 13:59:00 +0000 2019,,,,
AndrewScheer,,"Three provinces, four flights, five time zones, one beautiful country. I had an amazing cross-country Canada Day. Where did you celebrate? pic.twitter.com/mKGsX14wyH",51,472,93,1146055675157630976,https://twitter.com/AndrewScheer/status/1146055675157630976,256360738,2019-07-02 13:59:00+00:00,Tue Jul 02 13:59:00 +0000 2019,,,,
yfblanchet,,Une des rares apparitions de Pauline Marois - d’autres se gênent moins - ici en soutien à la loi québécoise sur la laïcité de l’État. Un peu son « Le Québec sait ce qui est bon pour le Québec » du @BlocQuebecois... https://www.lapresse.ca/actualites/politique/201907/01/01-5232343-loi-sur-la-laicite-de-letat-jen-prends-un-peu-le-merite-dit-marois.php …,41,92,4,1146019418356559879,https://twitter.com/yfblanchet/status/1146019418356559879,38262290,2019-07-02 11:34:56+00:00,Tue Jul 02 11:34:56 +0000 2019,@BlocQuebecois,,,https://www.lapresse.ca/actualites/politique/201907/01/01-5232343-loi-sur-la-laicite-de-letat-jen-prends-un-peu-le-merite-dit-marois.php
yfblanchet,,"Texte du @JdeMontreal qui met en lumière que le pays imaginaire n’est pas le Québec. C’est le Canada. Ce qui unit le Canada, c’est sa condamnation de ce qu’est, ce que veut et ce que fait le Québec. Mais qu’est-ce qu’on fait dans ce pays-là?! https://www.journaldemontreal.com/2019/07/01/o-canada-terre-de-nos-chicanes …",55,104,19,1146017200689614848,https://twitter.com/yfblanchet/status/1146017200689614848,38262290,2019-07-02 11:26:07+00:00,Tue Jul 02 11:26:07 +0000 2019,@JdeMontreal,,,https://www.journaldemontreal.com/2019/07/01/o-canada-terre-de-nos-chicanes
yfblanchet,,"Et ce sont les droits des chiens (!?) dont on entendra le plus parler avec indignation lorsque des gens outrés et effrayés demanderont plutôt des mesures pour protéger les humains face aux chiens dangereux... Puissant lobby, pouvoirs publics peureux...https://www.lenouvelliste.ca/actualites/justice-et-faits-divers/un-pitbull-attaque-un-bebe-a-louiseville-090926c858565a8f7305a6483351604e …",25,63,5,1146007330724728832,https://twitter.com/yfblanchet/status/1146007330724728832,38262290,2019-07-02 10:46:54+00:00,Tue Jul 02 10:46:54 +0000 2019,,,,https://www.lenouvelliste.ca/actualites/justice-et-faits-divers/un-pitbull-attaque-un-bebe-a-louiseville-090926c858565a8f7305a6483351604e
AndrewScheer,,I travelled across our beautiful country today to celebrate with Canadians from coast to coast! Right now I’m in Kelowna at the Kelowna Canada Day Concert and Fireworks Show with our Conservative Candidate @TracyGrayKLC. Happy Canada Day!pic.twitter.com/8QawYCYrOT,83,594,83,1145929446194601984,https://twitter.com/AndrewScheer/status/1145929446194601984,256360738,2019-07-02 05:37:24+00:00,Tue Jul 02 05:37:24 +0000 2019,@TracyGrayKLC,,,
ElizabethMay,deAdder,I am so distressed. Your work is brilliant. I wish I could help. What can your supporters do? #GPChttps://twitter.com/deAdder/status/1145557223155884032 …,54,274,31,1145924820992847872,https://twitter.com/ElizabethMay/status/1145924820992847872,16220555,2019-07-02 05:19:02+00:00,Tue Jul 02 05:19:02 +0000 2019,,#GPChttps,,https://twitter.com/deAdder/status/1145557223155884032
ElizabethMay,,A great shot from earlier today as @kidderjohn and I start out in #SidneyByTheSea #CanadaDay2019 parade! #GPCpic.twitter.com/8V7BhMo3NK,11,66,1,1145858246470586368,https://twitter.com/ElizabethMay/status/1145858246470586368,16220555,2019-07-02 00:54:29+00:00,Tue Jul 02 00:54:29 +0000 2019,@kidderjohn,#SidneyByTheSea #CanadaDay2019 #GPCpic,,
AndrewScheer,,"Two down, one to go! I just finished in Toronto, my second stop of the day in my cross-country Canada Day tour. Now off to Kelowna for some more celebrations and then fireworks!pic.twitter.com/PVrkCTYo55",127,772,95,1145857658186022913,https://twitter.com/AndrewScheer/status/1145857658186022913,256360738,2019-07-02 00:52:09+00:00,Tue Jul 02 00:52:09 +0000 2019,,,,
AndrewScheer,,"Il ne me reste plus qu’un arrêt à faire! Je viens de finir à Toronto, le deuxième arrêt de ma tournée nationale pour la Fête du Canada. Maintenant, direction Kelowna pour plus de festivités et, ensuite, des feux d’artifice!pic.twitter.com/HZEWtFslhX",8,46,1,1145857565651349504,https://twitter.com/AndrewScheer/status/1145857565651349504,256360738,2019-07-02 00:51:47+00:00,Tue Jul 02 00:51:47 +0000 2019,,,,
