username,to,text,retweets,favorites,replies,id,permalink,author_id,date,formatted_date,mentions,hashtags,geo,urls
MaximeBernier,,"Il y a 2 sem, un sondage Léger indiquait que 52% des Canadiens veulent me voir aux débats. Aujourd’hui, une majorité de Qcois disent la même chose. La @debats_can respectera-t-elle leur droit démocratique d’entendre tous les points de vue avant de voter?https://journalmetro.com/elections-federales-2019/2376694/maxime-bernier-doit-participer-debat-croit-moitie-quebecois/ …",31,96,5,1173575316654231553,https://twitter.com/MaximeBernier/status/1173575316654231553,2791988124,2019-09-16 12:32:14+00:00,Mon Sep 16 12:32:14 +0000 2019,@debats_can,,,https://journalmetro.com/elections-federales-2019/2376694/maxime-bernier-doit-participer-debat-croit-moitie-quebecois/
MaximeBernier,,"Two weeks ago, a Léger poll showed 52% of Canadians want to see me in debates. Today another poll says a majority of Quebecers think the same. Will the @debates_can respect the democratic right of these Canadians to hear all sides before voting? https://journalmetro.com/elections-federales-2019/2376694/maxime-bernier-doit-participer-debat-croit-moitie-quebecois/ …",475,1146,80,1173573961344528384,https://twitter.com/MaximeBernier/status/1173573961344528384,2791988124,2019-09-16 12:26:50+00:00,Mon Sep 16 12:26:50 +0000 2019,@debates_can,,,https://journalmetro.com/elections-federales-2019/2376694/maxime-bernier-doit-participer-debat-croit-moitie-quebecois/
MaximeBernier,,Come meet me when I am in Moncton during my New Brunswick tour Wednesday (September 18) afternoon! Venez me rencontrer lors de mon arrêt à Moncton durant ma tournée du Nouveau-Brunswick mercredi (18 septembre) après-midi!https://www.peoplespartyofcanada.ca/maxime_bernier_in_moncton …,117,260,17,1173570101062328321,https://twitter.com/MaximeBernier/status/1173570101062328321,2791988124,2019-09-16 12:11:30+00:00,Mon Sep 16 12:11:30 +0000 2019,,,,https://www.peoplespartyofcanada.ca/maxime_bernier_in_moncton
MaximeBernier,,I’ll be in Miramichi Wednesday (September 18) morning. Hope to see you there! Je serai à Miramichi mercredi (18 septembre) matin. J’espère vous y rencontrer!https://www.peoplespartyofcanada.ca/maxime_bernier_in_miramichi …,58,142,8,1173568199469744130,https://twitter.com/MaximeBernier/status/1173568199469744130,2791988124,2019-09-16 12:03:57+00:00,Mon Sep 16 12:03:57 +0000 2019,,,,https://www.peoplespartyofcanada.ca/maxime_bernier_in_miramichi
yfblanchet,,Solide bilan d’un solide dimanche: • plateforme et un budget de campagne adoptés à l’unanimité • candidats enthousiastes • une grande innovation en lutte aux changements climatiques • financement de la télé québécoise et tapis rouge #polcanhttps://www.lesoleil.com/actualite/elections-2019/le-bloc-propose-une-perequation-verte-d78b7193b744739a872f383a5edddfa7 …,25,54,0,1173560697902510083,https://twitter.com/yfblanchet/status/1173560697902510083,38262290,2019-09-16 11:34:08+00:00,Mon Sep 16 11:34:08 +0000 2019,,#polcanhttps,,https://www.lesoleil.com/actualite/elections-2019/le-bloc-propose-une-perequation-verte-d78b7193b744739a872f383a5edddfa7
yfblanchet,,Sur le tapis rouge du #galadesgemeaux avec @ndeziel @trudel_denis @moniquepauze et @MichelDuchesne8 Une agréable soirée avant de quitter pour Mont-Laurier rejoindre @HeleneGaudreau pic.twitter.com/tSskZKnqcy,5,16,0,1173448465663373313,https://twitter.com/yfblanchet/status/1173448465663373313,38262290,2019-09-16 04:08:10+00:00,Mon Sep 16 04:08:10 +0000 2019,@ndeziel @trudel_denis @moniquepauze @MichelDuchesne8 @HeleneGaudreau,#galadesgemeaux,,
AndrewScheer,,"Finally met a childhood hero, Mr. Mugs.pic.twitter.com/i9LIwciio7",96,692,75,1173410108979720192,https://twitter.com/AndrewScheer/status/1173410108979720192,256360738,2019-09-16 01:35:45+00:00,Mon Sep 16 01:35:45 +0000 2019,,,,
AndrewScheer,,J’ai enfin rencontré un héros d’enfance: M. Mugs.pic.twitter.com/E1uWD5rDl5,6,48,3,1173410084434698242,https://twitter.com/AndrewScheer/status/1173410084434698242,256360738,2019-09-16 01:35:39+00:00,Mon Sep 16 01:35:39 +0000 2019,,,,
JustinTrudeau,,"In Canada, anything is possible. You’re an inspiration, @Bandreescu_ and we’re all so proud of you. #SheTheNorth #SheTheChamppic.twitter.com/HLTifl4RDH",930,7936,309,1173408297682124802,https://twitter.com/JustinTrudeau/status/1173408297682124802,14260960,2019-09-16 01:28:33+00:00,Mon Sep 16 01:28:33 +0000 2019,@Bandreescu_,#SheTheNorth #SheTheChamppic,,
JustinTrudeau,,"Au Canada, tout est possible. Tu es une source d’inspiration, @Bandreescu_, et nous sommes tous très fiers de toi. pic.twitter.com/0WO2Wv3YSh",58,551,21,1173408074763255808,https://twitter.com/JustinTrudeau/status/1173408074763255808,14260960,2019-09-16 01:27:40+00:00,Mon Sep 16 01:27:40 +0000 2019,@Bandreescu_,,,
AndrewScheer,,Did you hear about the Universal Tax Cut I announced today? Tonight I’m with our Conservative candidate @Byron4CA in Parksville talking about our plan to put more money in your pocket. Watch LIVE: https://www.facebook.com/AndrewScheerMP/videos/479645915957155/ …,254,878,169,1173406567993159680,https://twitter.com/AndrewScheer/status/1173406567993159680,256360738,2019-09-16 01:21:41+00:00,Mon Sep 16 01:21:41 +0000 2019,@Byron4CA,,,https://www.facebook.com/AndrewScheerMP/videos/479645915957155/
AndrewScheer,,"Avez-vous entendu parler de la Baisse d’Impôt Pour Tous que j’ai annoncée aujourd’hui? Ce soir, @Byron4CA et moi sommes à Parksville pour parler de notre plan pour laisser plus d’argent dans vos poches. Regardez EN DIRECT: https://www.facebook.com/AndrewScheerMP/videos/479645915957155/ …",5,23,6,1173406554244165634,https://twitter.com/AndrewScheer/status/1173406554244165634,256360738,2019-09-16 01:21:38+00:00,Mon Sep 16 01:21:38 +0000 2019,@Byron4CA,,,https://www.facebook.com/AndrewScheerMP/videos/479645915957155/
MaximeBernier,PresseCan,"«La seule formation politique mettant de l’avant un plan accéléré vers l’élimination du déficit est le PPC, qui suggère de couper des milliards de dollars dans les dépenses, notamment en abolissant l’aide internationale et les subventions aux entreprises.»https://twitter.com/PresseCan/status/1173258172959797248 …",34,89,7,1173404758494863361,https://twitter.com/MaximeBernier/status/1173404758494863361,2791988124,2019-09-16 01:14:29+00:00,Mon Sep 16 01:14:29 +0000 2019,,,,https://twitter.com/PresseCan/status/1173258172959797248
JustinTrudeau,,The rain held off for a quick stop in Cobourg this afternoon with #TeamRudd. @RuddKim works hard every day for families in her community - let’s send her back to Ottawa this fall! #ChooseForwardpic.twitter.com/Msoa98wJqZ,100,763,126,1173395836933431298,https://twitter.com/JustinTrudeau/status/1173395836933431298,14260960,2019-09-16 00:39:02+00:00,Mon Sep 16 00:39:02 +0000 2019,@RuddKim,#TeamRudd #ChooseForwardpic,,
JustinTrudeau,,La pluie a cessé le temps d’un arrêt rapide à Cobourg cet après-midi avec l’ #ÉquipeRudd. @RuddKim travaille fort chaque jour pour les familles de sa communauté. Réélisons-la comme députée cet automne! #ChoisirDAvancerpic.twitter.com/7RaeFaJjqq,23,182,15,1173395744994332673,https://twitter.com/JustinTrudeau/status/1173395744994332673,14260960,2019-09-16 00:38:40+00:00,Mon Sep 16 00:38:40 +0000 2019,@RuddKim,#ÉquipeRudd #ChoisirDAvancerpic,,
MaximeBernier,LP_Elections,"Malgré la décision US de bannir les arômes, il n’y a encore aucun lien prouvé avec les problèmes de santé. Pas de raison d’interdire, ce qui encouragerait les utilisateurs à se tourner à la cigarette, plus dommageable. Laissons les adultes responsables décider pour eux-mêmes.https://twitter.com/LP_Elections/status/1172254196093063183 …",43,123,12,1173392019357650944,https://twitter.com/MaximeBernier/status/1173392019357650944,2791988124,2019-09-16 00:23:52+00:00,Mon Sep 16 00:23:52 +0000 2019,,,,https://twitter.com/LP_Elections/status/1172254196093063183
ElizabethMay,,"Watching those in power fail to take real climate action has been painful. We’ve been given a clear deadline, and we have solutions available. With the right leadership and political courage, we can fix this.https://www.thestar.com/opinion/contributors/2019/09/03/elizabeth-may-we-have-had-decades-to-stop-the-climate-crisis-the-era-of-procrastination-must-end.html …",327,857,305,1173390915983032325,https://twitter.com/ElizabethMay/status/1173390915983032325,16220555,2019-09-16 00:19:29+00:00,Mon Sep 16 00:19:29 +0000 2019,,,,https://www.thestar.com/opinion/contributors/2019/09/03/elizabeth-may-we-have-had-decades-to-stop-the-climate-crisis-the-era-of-procrastination-must-end.html
MaximeBernier,,"Despite US decision to ban flavours, there is no indication so far of a link with health issues. A ban is unwarranted and would encourage users to return to cigarettes, which are more harmful. Let’s allow responsible adults to make their own choices.https://globalnews.ca/news/5899815/vaping-ban-canada-election/ …",355,1066,162,1173390557743374336,https://twitter.com/MaximeBernier/status/1173390557743374336,2791988124,2019-09-16 00:18:04+00:00,Mon Sep 16 00:18:04 +0000 2019,,,,https://globalnews.ca/news/5899815/vaping-ban-canada-election/
