username,to,text,retweets,favorites,replies,id,permalink,author_id,date,formatted_date,mentions,hashtags,geo,urls
MaximeBernier,,Aidez-moi à participer aux débats des chefs. Signez notre pétition: https://www.partipopulaireducanada.ca/envoyez_maxime_au_debats …pic.twitter.com/dDTBDZPaDv,106,205,19,1165033673638469638,https://twitter.com/MaximeBernier/status/1165033673638469638,2791988124,2019-08-23 22:50:47+00:00,Fri Aug 23 22:50:47 +0000 2019,,,,https://www.partipopulaireducanada.ca/envoyez_maxime_au_debats
JustinTrudeau,,I spoke to @ZelenskyyUa yesterday ahead of the #G7. Get the details on our call:https://pm.gc.ca/en/news/readouts/2019/08/23/prime-minister-justin-trudeau-speaks-president-volodymyr-zelenskyy-ukraine …,66,385,103,1165030865744945153,https://twitter.com/JustinTrudeau/status/1165030865744945153,14260960,2019-08-23 22:39:38+00:00,Fri Aug 23 22:39:38 +0000 2019,@ZelenskyyUa,#G7,,https://pm.gc.ca/en/news/readouts/2019/08/23/prime-minister-justin-trudeau-speaks-president-volodymyr-zelenskyy-ukraine
JustinTrudeau,,Je me suis entretenu avec @ZelenskyyUa hier avant le #G7. Plus de détails :https://pm.gc.ca/fr/nouvelles/comptes-rendus/2019/08/23/premier-ministre-trudeau-sentretient-president-de-lukraine …,19,154,15,1165030734412898304,https://twitter.com/JustinTrudeau/status/1165030734412898304,14260960,2019-08-23 22:39:06+00:00,Fri Aug 23 22:39:06 +0000 2019,@ZelenskyyUa,#G7,,https://pm.gc.ca/fr/nouvelles/comptes-rendus/2019/08/23/premier-ministre-trudeau-sentretient-president-de-lukraine
MaximeBernier,,Help me get in the leaders’ debates. Sign our petition! https://www.peoplespartyofcanada.ca/get_max_in_the_debates …pic.twitter.com/jyc5lipOGy,731,1334,246,1165028949610680325,https://twitter.com/MaximeBernier/status/1165028949610680325,2791988124,2019-08-23 22:32:01+00:00,Fri Aug 23 22:32:01 +0000 2019,,,,https://www.peoplespartyofcanada.ca/get_max_in_the_debates
AndrewScheer,winnipegsun,"This is exactly why my first act as Prime Minister will be to repeal Justin Trudeau’s Carbon Tax. I will always put you and your family first, and put more money in your pockets so you can get ahead.https://twitter.com/winnipegsun/status/1164680767743676416 …",879,2646,1065,1165021143478128640,https://twitter.com/AndrewScheer/status/1165021143478128640,256360738,2019-08-23 22:01:00+00:00,Fri Aug 23 22:01:00 +0000 2019,,,,https://twitter.com/winnipegsun/status/1164680767743676416
AndrewScheer,winnipegsun,"C’est justement pourquoi, en tant que premier ministre, mon premier geste sera d’annuler la taxe sur le carbone de Justin Trudeau. Je ferai toujours passer vos familles et vous en premier. Je vous laisserai plus d’argent pour que vous puissiez améliorer votre quotidien.https://twitter.com/winnipegsun/status/1164680767743676416 …",21,74,13,1165021143327281153,https://twitter.com/AndrewScheer/status/1165021143327281153,256360738,2019-08-23 22:01:00+00:00,Fri Aug 23 22:01:00 +0000 2019,,,,https://twitter.com/winnipegsun/status/1164680767743676416
yfblanchet,,Valeurs conservatrices partagées par Yves Lévesque? • Droit des femmes à disposer de leur corps hué au Parlement • Mariage entre conjoints du même sexe • Pétrole • Pas de prix sur les émissions de carbone... Et sur les médias... qui l’a compris?!? https://www.lenouvelliste.ca/actualites/elections-federales-yves-levesque-mise-sur-la-fibre-nationaliste-bf8650a0cbe4bac548994e2248df3179 …,18,28,3,1165019400291934210,https://twitter.com/yfblanchet/status/1165019400291934210,38262290,2019-08-23 21:54:04+00:00,Fri Aug 23 21:54:04 +0000 2019,,,,https://www.lenouvelliste.ca/actualites/elections-federales-yves-levesque-mise-sur-la-fibre-nationaliste-bf8650a0cbe4bac548994e2248df3179
theJagmeetSingh,HuffPost,"While the Amazon burns, PM Trudeau is negotiating a new free trade deal with Bolsonaro and Mercosur. Mr. Trudeau, instead of hollow statements, let’s take action. Halt the negotiations with Bolsonaro now — until the fires are out and the lungs of the planet are safe.https://twitter.com/HuffPost/status/1164601880594407424 …",562,1320,82,1165018296195960833,https://twitter.com/theJagmeetSingh/status/1165018296195960833,253340075,2019-08-23 21:49:41+00:00,Fri Aug 23 21:49:41 +0000 2019,,,,https://twitter.com/HuffPost/status/1164601880594407424
theJagmeetSingh,HuffPost,"Pendant que l’Amazonie brûle, le PM négocie un accord de libre-échange avec M. Bolsonaro et le Mercosur. M. Trudeau, au lieu de déclarations vaines, passons à l'action. Stoppez les négociations, jusqu'à ce que les poumons de la planète soient en sécurité.https://twitter.com/HuffPost/status/1164601880594407424 …",16,38,2,1165018286251229185,https://twitter.com/theJagmeetSingh/status/1165018286251229185,253340075,2019-08-23 21:49:39+00:00,Fri Aug 23 21:49:39 +0000 2019,,,,https://twitter.com/HuffPost/status/1164601880594407424
ElizabethMay,sgann_dart,Check out #MissionPossible. We call for a cross-party inner cabinet for a non-partisan response to the #ClimateEmergency . #GPChttps://twitter.com/sgann_dart/status/1164962852832272390 …,14,28,4,1165015012223533058,https://twitter.com/ElizabethMay/status/1165015012223533058,16220555,2019-08-23 21:36:38+00:00,Fri Aug 23 21:36:38 +0000 2019,,#MissionPossible #ClimateEmergency #GPChttps,,https://twitter.com/sgann_dart/status/1164962852832272390
ElizabethMay,christoaivalis,"Our commitment to social justice is not for sale. To be clear, 1.5 degrees means a rapid exit from all fossil fuels. Just to set the record straight. #GPChttps://twitter.com/christoaivalis/status/1164955783605493760 …",39,123,17,1165014489378377728,https://twitter.com/ElizabethMay/status/1165014489378377728,16220555,2019-08-23 21:34:33+00:00,Fri Aug 23 21:34:33 +0000 2019,,#GPChttps,,https://twitter.com/christoaivalis/status/1164955783605493760
MaximeBernier,,"EDITORIAL: “If People’s Party of Canada leader Maxime Bernier is not allowed to participate in this year’s federal leaders’ debates, it will seriously call into question the impartiality of the whole process.”https://torontosun.com/opinion/editorials/editorial-let-maxime-bernier-debate/ …",620,1309,127,1165005745391357954,https://twitter.com/MaximeBernier/status/1165005745391357954,2791988124,2019-08-23 20:59:49+00:00,Fri Aug 23 20:59:49 +0000 2019,,,,https://torontosun.com/opinion/editorials/editorial-let-maxime-bernier-debate/
JustinTrudeau,,"We’ve been focused on making life more affordable for Canadians, and one of the first things we did as a government was cut taxes for the middle class. That means 9 million Canadians now have more money in their pockets to help with the cost of living.pic.twitter.com/8Xn7Tkq4sQ",464,2446,1005,1164996708197195778,https://twitter.com/JustinTrudeau/status/1164996708197195778,14260960,2019-08-23 20:23:54+00:00,Fri Aug 23 20:23:54 +0000 2019,,,,
JustinTrudeau,,"Nous sommes déterminés à rendre la vie plus abordable pour les Canadiens, alors une des premières choses qu’on a faites a été de réduire l’impôt de la classe moyenne. Cela veut dire que 9 millions de Canadiens ont maintenant plus d’argent pour assumer le coût de la vie.pic.twitter.com/AUWYA7uV3W",53,297,36,1164996659023097858,https://twitter.com/JustinTrudeau/status/1164996659023097858,14260960,2019-08-23 20:23:42+00:00,Fri Aug 23 20:23:42 +0000 2019,,,,
theJagmeetSingh,UN,"Today we remember the millions of victims of the transatlantic slave trade, a horrific chapter that continues to reverberate violently through history. We pay tribute to these generations of victims & survivors by continuing the fight against anti-Black racism, today & everyday.https://twitter.com/UN/status/1164750358947749888 …",111,371,18,1164989845304987648,https://twitter.com/theJagmeetSingh/status/1164989845304987648,253340075,2019-08-23 19:56:38+00:00,Fri Aug 23 19:56:38 +0000 2019,,,,https://twitter.com/UN/status/1164750358947749888
theJagmeetSingh,UN,"Rappelons-nous auj. des millions de victimes de la traite transatlantique des esclaves, une partie horrible de notre histoire qui a violemment déplacé des millions de communautés et qui a légalisé le traitement cruel des Noir∙es. Luttons pour que ça ne se reproduise plus jamais.https://twitter.com/UN/status/1164750358947749888 …",3,31,0,1164989567499427841,https://twitter.com/theJagmeetSingh/status/1164989567499427841,253340075,2019-08-23 19:55:32+00:00,Fri Aug 23 19:55:32 +0000 2019,,,,https://twitter.com/UN/status/1164750358947749888
JustinTrudeau,,"Tomorrow, the #G7 countries will meet in France. And my message will be clear: As allies and world leaders, we need to work together in order to build a future where everyone can succeed.pic.twitter.com/G6HKlUvOp9",1149,6252,1197,1164961005530701825,https://twitter.com/JustinTrudeau/status/1164961005530701825,14260960,2019-08-23 18:02:02+00:00,Fri Aug 23 18:02:02 +0000 2019,,#G7,,
JustinTrudeau,,"Demain, alors que les pays du #G7 se réuniront en France, mon message sera clair : en tant qu'alliés et dirigeants du monde, on doit travailler ensemble afin de bâtir un avenir où tout le monde peut réussir.pic.twitter.com/vCXWqHUUT0",135,643,49,1164960976908804097,https://twitter.com/JustinTrudeau/status/1164960976908804097,14260960,2019-08-23 18:01:55+00:00,Fri Aug 23 18:01:55 +0000 2019,,#G7,,
ElizabethMay,christoaivalis,"Hey. Just to correct the record, I never said that. I did say that the process in a minority parliament is to speak with all parties. Greens have a bottom line- ""little bit"" is not on the table. 1.5 to stay alive. And protect human rights. Period.https://twitter.com/christoaivalis/status/1164728530934128643 …",109,321,54,1164952438220021760,https://twitter.com/ElizabethMay/status/1164952438220021760,16220555,2019-08-23 17:27:59+00:00,Fri Aug 23 17:27:59 +0000 2019,,,,https://twitter.com/christoaivalis/status/1164728530934128643
theJagmeetSingh,,"Today, on #BlackRibbonDay, we remember the victims of totalitarian ideologies – and honour their memory by reaffirming our belief in human rights and democracy. Let us all commit ourselves to never standing by in the face of fascism & hatred.https://www.ndp.ca/news/ndp-statement-black-ribbon-day-0 …",103,320,134,1164948716089950209,https://twitter.com/theJagmeetSingh/status/1164948716089950209,253340075,2019-08-23 17:13:12+00:00,Fri Aug 23 17:13:12 +0000 2019,,#BlackRibbonDay,,https://www.ndp.ca/news/ndp-statement-black-ribbon-day-0
theJagmeetSingh,,"En cette journée du Ruban noir, nous commémorons les victimes du totalitarisme et honorons leur mémoire en réitérant notre attachement aux droits humains et à la démocratie. Engageons-nous à ne jamais céder face au fascisme et à la haine.https://www.npd.ca/nouvelles/declaration-du-npd-loccasion-de-la-journee-du-ruban-noir-0 …",3,23,3,1164948280633171968,https://twitter.com/theJagmeetSingh/status/1164948280633171968,253340075,2019-08-23 17:11:28+00:00,Fri Aug 23 17:11:28 +0000 2019,,,,https://www.npd.ca/nouvelles/declaration-du-npd-loccasion-de-la-journee-du-ruban-noir-0
theJagmeetSingh,,"Justin Trudeau a fait de beaux discours sur le climat, avant de laisser tomber le Canada et le monde. Je suis très fier de ma vision pour l’action climatique et les emplois. Soyons du côté de la prochaine génération au lieu de céder aux grands pollueurs.https://lactualite.com/actualites/le-canada-est-bien-loin-datteindre-ses-objectifs-de-reduction-des-ges/ …",14,34,4,1164939471378362368,https://twitter.com/theJagmeetSingh/status/1164939471378362368,253340075,2019-08-23 16:36:28+00:00,Fri Aug 23 16:36:28 +0000 2019,,,,https://lactualite.com/actualites/le-canada-est-bien-loin-datteindre-ses-objectifs-de-reduction-des-ges/
AndrewScheer,,"On Black Ribbon Day, I join in remembering the victims of Communism and Nazism in Europe. It is our duty to educate future generations about the atrocities of the past in order to ensure that these murderous ideologies never have a chance to rise again. https://www.facebook.com/AndrewScheerMP/posts/2874360625931004 …pic.twitter.com/qgYRB3vZ9o",218,513,115,1164936835073789959,https://twitter.com/AndrewScheer/status/1164936835073789959,256360738,2019-08-23 16:25:59+00:00,Fri Aug 23 16:25:59 +0000 2019,,,,https://www.facebook.com/AndrewScheerMP/posts/2874360625931004
AndrewScheer,,"Pour la journée du Ruban noir, je commémore, à vos côtés, les victimes du communisme et du nazisme en Europe. Nous devons éduquer les générations futures sur ces atrocités passées afin d’éviter que de telles idéologies meurtrières renaissent. https://www.facebook.com/AndrewScheerMP/posts/2874359675931099 …pic.twitter.com/QIdwIeUAgm",3,22,3,1164936771165200385,https://twitter.com/AndrewScheer/status/1164936771165200385,256360738,2019-08-23 16:25:44+00:00,Fri Aug 23 16:25:44 +0000 2019,,,,https://www.facebook.com/AndrewScheerMP/posts/2874359675931099
MaximeBernier,,Signez notre pétition! https://www.partipopulaireducanada.ca/envoyez_maxime_au_debats …pic.twitter.com/eDzXpgqrz3,38,69,1,1164936503828631552,https://twitter.com/MaximeBernier/status/1164936503828631552,2791988124,2019-08-23 16:24:40+00:00,Fri Aug 23 16:24:40 +0000 2019,,,,https://www.partipopulaireducanada.ca/envoyez_maxime_au_debats
MaximeBernier,,Sign our petition! https://www.peoplespartyofcanada.ca/get_max_in_the_debates … #LetMaxSpeakpic.twitter.com/PpVhnqjwre,231,349,34,1164935977334427648,https://twitter.com/MaximeBernier/status/1164935977334427648,2791988124,2019-08-23 16:22:35+00:00,Fri Aug 23 16:22:35 +0000 2019,,#LetMaxSpeakpic,,https://www.peoplespartyofcanada.ca/get_max_in_the_debates
MaximeBernier,,Voici ma troisième lettre à David Johnston avec d’autres arguments pour qu’il m’invite aux débats des chefs.https://www.partipopulaireducanada.ca/troisieme_lettre_au_tres_honorable_david_johnston_commissaire_la_commission_des_debats_des_chefs …,37,87,3,1164934356609261581,https://twitter.com/MaximeBernier/status/1164934356609261581,2791988124,2019-08-23 16:16:08+00:00,Fri Aug 23 16:16:08 +0000 2019,,,,https://www.partipopulaireducanada.ca/troisieme_lettre_au_tres_honorable_david_johnston_commissaire_la_commission_des_debats_des_chefs
theJagmeetSingh,,"Justin Trudeau gave pretty speeches on climate, then badly let down Canada, and the world. I’m really proud of my New Deal for climate action and good jobs. Let’s take the side of the next generation, instead of caving to big polluters.https://globalnews.ca/news/5801530/canada-climate-change-plan-g7/?fbclid=IwAR0fqgeTYVtAk9kuK-Me7XJVNJdE60ftwT6iXsqRMagB2W9QgqzIBJtYC5w …",163,608,48,1164933643820773377,https://twitter.com/theJagmeetSingh/status/1164933643820773377,253340075,2019-08-23 16:13:18+00:00,Fri Aug 23 16:13:18 +0000 2019,,,,https://globalnews.ca/news/5801530/canada-climate-change-plan-g7/?fbclid=IwAR0fqgeTYVtAk9kuK-Me7XJVNJdE60ftwT6iXsqRMagB2W9QgqzIBJtYC5w
MaximeBernier,,Here is my third letter to David Johnston with more arguments for inviting me to the Leaders’ Debates. #LetMaxSpeakhttps://www.peoplespartyofcanada.ca/third_letter_to_the_right_honourable_david_johnston_commissioner_of_the_leaders_debates_commission …,328,623,61,1164932354164613127,https://twitter.com/MaximeBernier/status/1164932354164613127,2791988124,2019-08-23 16:08:11+00:00,Fri Aug 23 16:08:11 +0000 2019,,#LetMaxSpeakhttps,,https://www.peoplespartyofcanada.ca/third_letter_to_the_right_honourable_david_johnston_commissioner_of_the_leaders_debates_commission
JustinTrudeau,,"Today on Black Ribbon Day, we join people around the world to pay tribute to the survivors and victims of Communism and Nazism in Europe:https://pm.gc.ca/en/news/statements/2019/08/23/statement-prime-minister-black-ribbon-day …",297,1054,218,1164925784005521408,https://twitter.com/JustinTrudeau/status/1164925784005521408,14260960,2019-08-23 15:42:04+00:00,Fri Aug 23 15:42:04 +0000 2019,,,,https://pm.gc.ca/en/news/statements/2019/08/23/statement-prime-minister-black-ribbon-day
JustinTrudeau,,"En cette journée du Ruban noir, nous nous joignons aux gens de partout dans le monde pour rendre hommage aux survivants et aux victimes du communisme et du nazisme en Europe.https://pm.gc.ca/fr/nouvelles/declarations/2019/08/23/declaration-du-premier-ministre-loccasion-de-la-journee-du-ruban …",76,277,37,1164925640728043520,https://twitter.com/JustinTrudeau/status/1164925640728043520,14260960,2019-08-23 15:41:30+00:00,Fri Aug 23 15:41:30 +0000 2019,,,,https://pm.gc.ca/fr/nouvelles/declarations/2019/08/23/declaration-du-premier-ministre-loccasion-de-la-journee-du-ruban
JustinTrudeau,,"We're on our way to Biarritz, France for the #G7, where we’ll be focused on creating more jobs & opportunities for people, and the steps we can take now to fight the climate crisis.pic.twitter.com/5Zm1seHHjo",245,1747,457,1164908469750763521,https://twitter.com/JustinTrudeau/status/1164908469750763521,14260960,2019-08-23 14:33:16+00:00,Fri Aug 23 14:33:16 +0000 2019,,#G7,,
JustinTrudeau,,"Nous sommes en route pour Biarritz, en France, pour le #G7. On cherchera à créer plus d’emplois et d’opportunités pour les gens, et on parlera des moyens à prendre maintenant pour lutter contre la crise climatique.pic.twitter.com/RyTM3WLhdj",86,426,30,1164908415463940096,https://twitter.com/JustinTrudeau/status/1164908415463940096,14260960,2019-08-23 14:33:03+00:00,Fri Aug 23 14:33:03 +0000 2019,,#G7,,
yfblanchet,,"Traversée Trois-Pistoles/Les Escoumins pour retrouver ⁦ @GillMarilene⁩, quelques entrevues, puis vers le Saguenay où on parlera recherche, aluminium et modèle québécois avec les travailleurs du secteur et l’UQAC. Activité avec ⁦ @SylvainGaudrea2⁩ ce soir! pic.twitter.com/0QRmXJYUM2",4,17,3,1164905546492915713,https://twitter.com/yfblanchet/status/1164905546492915713,38262290,2019-08-23 14:21:39+00:00,Fri Aug 23 14:21:39 +0000 2019,@GillMarilene @SylvainGaudrea2,,,
MaximeBernier,MaximeBernier,"Il y a exactement un an aujourd’hui, j’ai annoncé que je quittais un parti moralement et intellectuellement corrompu. Et que j’allais offrir aux Canadiens une alternative fondée sur des principes. Mission accomplie. Vous aurez un véritable choix le 21 octobre.https://twitter.com/MaximeBernier/status/1032678132707405825 …",63,152,11,1164869744664752128,https://twitter.com/MaximeBernier/status/1164869744664752128,2791988124,2019-08-23 11:59:24+00:00,Fri Aug 23 11:59:24 +0000 2019,,,,https://twitter.com/MaximeBernier/status/1032678132707405825
MaximeBernier,MaximeBernier,"Exactly one year ago today, I announced that I was leaving a morally and intellectually corrupt party. And that I would offer Canadians a principled alternative. Mission accomplished. You will have a real choice on October 21.https://twitter.com/MaximeBernier/status/1032677930831360000 …",655,1757,219,1164868220500795392,https://twitter.com/MaximeBernier/status/1164868220500795392,2791988124,2019-08-23 11:53:20+00:00,Fri Aug 23 11:53:20 +0000 2019,,,,https://twitter.com/MaximeBernier/status/1032677930831360000
yfblanchet,,"Non. Rien n’est réglé. L’exil du trésor scientifique qu’est le Coriolis II n’est pas seulement une perte pour Rimouski et le Québec, mais bien une humiliation signée par Ottawa au détriment de l’environnement, de la science et de l’Est-du-Québec.https://www.lesoleil.com/opinions/point-de-vue/le-coriolis-ii-et-rimouski-meritent-un-port-de-premier-plan-97be8ee4be45c3c6c996ae3abd95e5b9 …",42,53,0,1164855614830534661,https://twitter.com/yfblanchet/status/1164855614830534661,38262290,2019-08-23 11:03:15+00:00,Fri Aug 23 11:03:15 +0000 2019,,,,https://www.lesoleil.com/opinions/point-de-vue/le-coriolis-ii-et-rimouski-meritent-un-port-de-premier-plan-97be8ee4be45c3c6c996ae3abd95e5b9
yfblanchet,,"Les Verts, en bons Canadiens, oublient qu’il s’agit d’une juridiction québécoise. De plus, les électeurs qui voteraient pour eux, comment sauront-ils quelle sera la position au Parlement? Une élection sert à clarifier une position, pas à la rendre confuse.https://journalmetro.com/actualites/national/2365525/les-candidats-du-parti-vert-du-canada-pourraient-appuyer-la-loi-sur-la-laicite/ …",32,45,12,1164852139627352064,https://twitter.com/yfblanchet/status/1164852139627352064,38262290,2019-08-23 10:49:26+00:00,Fri Aug 23 10:49:26 +0000 2019,,,,https://journalmetro.com/actualites/national/2365525/les-candidats-du-parti-vert-du-canada-pourraient-appuyer-la-loi-sur-la-laicite/
yfblanchet,,Crise des médias: • les mesures mineures du fédéral ne sont pas la solution adéquate • Ottawa a peur du problème: le piratage des revenus de publicité par les multinationales • un prêt ponctuel par le fédéral aussi ne coûte rien aux contribuables. https://www.lesoleil.com/actualites/il-faut-lutter-contre-le-piratage-des-articles-croit-yves-francois-blanchet-e9d1c2f15008cb2aab3d5106185cd1ef …,17,20,1,1164850906061561856,https://twitter.com/yfblanchet/status/1164850906061561856,38262290,2019-08-23 10:44:32+00:00,Fri Aug 23 10:44:32 +0000 2019,,,,https://www.lesoleil.com/actualites/il-faut-lutter-contre-le-piratage-des-articles-croit-yves-francois-blanchet-e9d1c2f15008cb2aab3d5106185cd1ef
yfblanchet,,Le Bloc québécois visera une campagne carboneutre | TVA Nouvelleshttps://www.tvanouvelles.ca/2019/08/23/le-bloc-quebecois-visera-une-campagne-carboneutre …,19,33,1,1164848072666636288,https://twitter.com/yfblanchet/status/1164848072666636288,38262290,2019-08-23 10:33:17+00:00,Fri Aug 23 10:33:17 +0000 2019,,,,https://www.tvanouvelles.ca/2019/08/23/le-bloc-quebecois-visera-une-campagne-carboneutre
AndrewScheer,nationalpost,Justin Trudeau must explain why the Liberal party is recruiting members at anti-democracy protests. Conservatives are always on the side of freedom and democracy.https://twitter.com/nationalpost/status/1164693395559845888 …,815,1718,660,1164724974181126144,https://twitter.com/AndrewScheer/status/1164724974181126144,256360738,2019-08-23 02:24:08+00:00,Fri Aug 23 02:24:08 +0000 2019,,,,https://twitter.com/nationalpost/status/1164693395559845888
AndrewScheer,nationalpost,Justin Trudeau doit expliquer pourquoi le Parti libéral recrute des membres lors de manifestations anti-démocratiques. Les Conservateurs sont toujours du côté de la liberté et de la démocratie.https://twitter.com/nationalpost/status/1164693395559845888 …,31,82,9,1164724901279932416,https://twitter.com/AndrewScheer/status/1164724901279932416,256360738,2019-08-23 02:23:50+00:00,Fri Aug 23 02:23:50 +0000 2019,,,,https://twitter.com/nationalpost/status/1164693395559845888
ElizabethMay,,Great to meet Darien from Vision Landscaping! A man with a Green thumb! And a great garden. #GPC #ESS @DavidMernerpic.twitter.com/cQ6uHOZDCZ,3,48,5,1164724567069212672,https://twitter.com/ElizabethMay/status/1164724567069212672,16220555,2019-08-23 02:22:30+00:00,Fri Aug 23 02:22:30 +0000 2019,@DavidMernerpic,#GPC #ESS,,
JustinTrudeau,EmmanuelMacron,"I couldn’t agree more, @EmmanuelMacron. We did lots of work to protect the environment at the #G7 last year in Charlevoix, & we need to continue this weekend. We need to #ActForTheAmazon & act for our planet — our kids & grandkids are counting on us.https://twitter.com/EmmanuelMacron/status/1164617008962527232 …",15036,54202,3305,1164703456453681153,https://twitter.com/JustinTrudeau/status/1164703456453681153,14260960,2019-08-23 00:58:37+00:00,Fri Aug 23 00:58:37 +0000 2019,@EmmanuelMacron,#G7 #ActForTheAmazon,,https://twitter.com/EmmanuelMacron/status/1164617008962527232
JustinTrudeau,EmmanuelMacron,"Je suis tout à fait d’accord, @EmmanuelMacron. Nous avons fait beaucoup de travail pour protéger l’environnement au #G7 à Charlevoix l’an dernier, et il faut continuer ce weekend. Nous devons agir pour l'Amazonie et notre planète – nos enfants et petits-enfants comptent sur nous.https://twitter.com/EmmanuelMacron/status/1164616868080103425 …",1758,6753,530,1164703161766076417,https://twitter.com/JustinTrudeau/status/1164703161766076417,14260960,2019-08-23 00:57:27+00:00,Fri Aug 23 00:57:27 +0000 2019,@EmmanuelMacron,#G7,,https://twitter.com/EmmanuelMacron/status/1164616868080103425
ElizabethMay,AFPespanol,"Marina da Silva, former Green Party of Brazil presidential candidate. The Amazon fires are disastrous. #GPChttps://twitter.com/AFPespanol/status/1164698013933158402 …",12,23,7,1164700705669574656,https://twitter.com/ElizabethMay/status/1164700705669574656,16220555,2019-08-23 00:47:41+00:00,Fri Aug 23 00:47:41 +0000 2019,,#GPChttps,,https://twitter.com/AFPespanol/status/1164698013933158402
ElizabethMay,,Thanks to National Vice-Chief Kim Beaudin of Congress of Aboriginal Peoples ! So helpful to be personally briefed on challenges of indigenous peoples living off-reserve. #GPCpic.twitter.com/x8sBAJWIBK,2,25,3,1164699779906953216,https://twitter.com/ElizabethMay/status/1164699779906953216,16220555,2019-08-23 00:44:01+00:00,Fri Aug 23 00:44:01 +0000 2019,,#GPCpic,,
ElizabethMay,gvpl,Had a wonderful time today at the Bruce Hutchison library in my constituency to promote their wonderful summer reading program for kids! Thanks for having me @gvpl!https://twitter.com/gvpl/status/1164695628070477824 …,5,76,2,1164699312971902976,https://twitter.com/ElizabethMay/status/1164699312971902976,16220555,2019-08-23 00:42:09+00:00,Fri Aug 23 00:42:09 +0000 2019,@gvpl,,,https://twitter.com/gvpl/status/1164695628070477824
yfblanchet,JdeMontreal,"Il serait en effet judicieux que le ministre donne du temps pour que la vente de @airtransat ne se fasse pas au détriment des intérêts économiques, régionaux et linguistiques du Québec. Pourquoi pas un ou des acheteurs québécois? https://twitter.com/JdeMontreal/status/1164696861057437697 …",20,29,0,1164698301087834112,https://twitter.com/yfblanchet/status/1164698301087834112,38262290,2019-08-23 00:38:08+00:00,Fri Aug 23 00:38:08 +0000 2019,@airtransat,,,https://twitter.com/JdeMontreal/status/1164696861057437697
