username,to,text,retweets,favorites,replies,id,permalink,author_id,date,formatted_date,mentions,hashtags,geo,urls
MaximeBernier,,"Listen to my interview with @ABDanielleSmith. We discuss climate alarmism, how Andrew Scheer is splitting the LibCon vote, getting rid of the deficit in two years, and abortion. https://player.fm/series/danielle-smith/the-peoples-party-of-canada …",138,249,29,1134245407494737921,https://twitter.com/MaximeBernier/status/1134245407494737921,2791988124,2019-05-30 23:49:13+00:00,Thu May 30 23:49:13 +0000 2019,@ABDanielleSmith,,,https://player.fm/series/danielle-smith/the-peoples-party-of-canada
MaximeBernier,,"Listen to my interview with Evan Solomon (at 11 min.) We’re discussing immigration, PPC candidates and abortion. http://www.iheartradio.ca/580-cfra/podcasts/hour-2-of-the-evan-solomon-show-for-may-29th-2019-1.9288366 …",106,175,19,1134233270412075010,https://twitter.com/MaximeBernier/status/1134233270412075010,2791988124,2019-05-30 23:00:59+00:00,Thu May 30 23:00:59 +0000 2019,,,,http://www.iheartradio.ca/580-cfra/podcasts/hour-2-of-the-evan-solomon-show-for-may-29th-2019-1.9288366
theJagmeetSingh,,"While Trudeau's Liberals are concerned with helping their friends, we'll make different choices. We'll create a Canadian Climate Bank with a social/enviro mandate & help small businesses make investments in renewable energy. Owned by Canadians, for Cdns.https://www.cbc.ca/news/politics/jagmeet-singh-ndp-climate-new-deal-1.5156443 …",42,142,17,1134222564023263232,https://twitter.com/theJagmeetSingh/status/1134222564023263232,253340075,2019-05-30 22:18:26+00:00,Thu May 30 22:18:26 +0000 2019,,,,https://www.cbc.ca/news/politics/jagmeet-singh-ndp-climate-new-deal-1.5156443
theJagmeetSingh,,Honoured to address @CUPEOntario delegates this morning at #CUPEON19! Together we're stronger as we build the resistance to Ford's reckless cuts & Trudeau's failed commitments to protect workers. I also slipped in an announcement of our plan to create a Canadian Climate Bank:pic.twitter.com/ag6IbFMI2Q,29,132,7,1134222556532289541,https://twitter.com/theJagmeetSingh/status/1134222556532289541,253340075,2019-05-30 22:18:24+00:00,Thu May 30 22:18:24 +0000 2019,@CUPEOntario,#CUPEON19,,
theJagmeetSingh,,"Contrairement aux libéraux, qui s’affairent à aider leurs amis, nous ferions des choix différents. Nous créerons une Banque canadienne du climat avec un mandat social et environnemental pour aider les PME à investir dans les énergies renouvelables. https://www.cbc.ca/news/politics/jagmeet-singh-ndp-climate-new-deal-1.5156443 …",3,11,0,1134222552702816258,https://twitter.com/theJagmeetSingh/status/1134222552702816258,253340075,2019-05-30 22:18:24+00:00,Thu May 30 22:18:24 +0000 2019,,,,https://www.cbc.ca/news/politics/jagmeet-singh-ndp-climate-new-deal-1.5156443
theJagmeetSingh,,C’est un honneur pour moi de m’adresser aux délégué·es du SCFP de l’Ontario au congrès #CUPEON19! Unissons nos forces pour opposer une résistance aux coupes irresponsables de Doug Ford et à l’incapacité de Justin Trudeau à protéger les travailleurs et travailleuses.pic.twitter.com/dL2XBP1GUm,3,13,1,1134222545819975680,https://twitter.com/theJagmeetSingh/status/1134222545819975680,253340075,2019-05-30 22:18:22+00:00,Thu May 30 22:18:22 +0000 2019,,#CUPEON19,,
JustinTrudeau,,"I had a good call with my friend, Quebec City Mayor Labeaume today. Régis, I’m happy to hear you’re in remission and looking forward to continue working with you.",62,966,82,1134218071621754880,https://twitter.com/JustinTrudeau/status/1134218071621754880,14260960,2019-05-30 22:00:35+00:00,Thu May 30 22:00:35 +0000 2019,,,,
JustinTrudeau,,"J'ai eu un bon entretien aujourd'hui avec mon ami, le maire Labeaume de Québec. Régis, j’ai été très heureux d’apprendre la nouvelle de ta rémission et j'ai hâte de continuer à travailler avec toi.",23,257,10,1134218061630906368,https://twitter.com/JustinTrudeau/status/1134218061630906368,14260960,2019-05-30 22:00:33+00:00,Thu May 30 22:00:33 +0000 2019,,,,
ElizabethMay,BCGreens,I well remember Ottawa reporters betting me it would collapse in weeks. They scoffed at my confidence it would last years. #GPC @AJWVictoriaBChttps://twitter.com/BCGreens/status/1134188376196861952 …,51,237,22,1134215314592489477,https://twitter.com/ElizabethMay/status/1134215314592489477,16220555,2019-05-30 21:49:38+00:00,Thu May 30 21:49:38 +0000 2019,@AJWVictoriaBChttps,#GPC,,https://twitter.com/BCGreens/status/1134188376196861952
ElizabethMay,WCELaw,My question in QP today was to @RalphGoodale as to what Canada is doing to protect #Pikangikum FN- Heart-wrenching situation with fire bearing down on them. Goodale promised planes and help in response to Ontario request. #GPChttps://twitter.com/WCELaw/status/1134160570423414784 …,19,42,7,1134214575526748162,https://twitter.com/ElizabethMay/status/1134214575526748162,16220555,2019-05-30 21:46:42+00:00,Thu May 30 21:46:42 +0000 2019,@RalphGoodale,#Pikangikum #GPChttps,,https://twitter.com/WCELaw/status/1134160570423414784
JustinTrudeau,,"There’s no relationship in the world quite like the Canada-US relationship. Today, @VP Pence visited Ottawa to talk about trade, the new NAFTA, and our shared commitment to keep creating good, middle class jobs for people in both our countries. More: https://bit.ly/2MgIYz7 pic.twitter.com/EBRXARhyfd",85,587,336,1134198066817511425,https://twitter.com/JustinTrudeau/status/1134198066817511425,14260960,2019-05-30 20:41:06+00:00,Thu May 30 20:41:06 +0000 2019,@VP,,,https://bit.ly/2MgIYz7
JustinTrudeau,,"La relation qu’entretiennent le Canada et les États-Unis est unique au monde. Le @VP Pence a visité Ottawa aujourd'hui pour parler du commerce, du nouvel ALENA et de notre engagement commun à continuer à créer de bons emplois pour la classe moyenne. Info: https://bit.ly/2Mg764Q pic.twitter.com/1VkEtXi2Ux",23,159,20,1134198007984001032,https://twitter.com/JustinTrudeau/status/1134198007984001032,14260960,2019-05-30 20:40:52+00:00,Thu May 30 20:40:52 +0000 2019,@VP,,,https://bit.ly/2Mg764Q
AndrewScheer,,Yesterday I spoke with Premier @Brian_Pallister about how a Conservative government will be committed to lowering taxes & helping Canadians get ahead. Thank you Premier for your shared commitment to creating opportunities & making life more affordable for Manitobans & Canadians.pic.twitter.com/zAQoBGDwWY,79,312,60,1134195466718122000,https://twitter.com/AndrewScheer/status/1134195466718122000,256360738,2019-05-30 20:30:46+00:00,Thu May 30 20:30:46 +0000 2019,@Brian_Pallister,,,
AndrewScheer,,"Hier, j’ai discuté avec le premier ministre @Brian_Pallister de comment un gouvernement conservateur réduira les taxes et aidera les Canadiens à prospérer. Merci au premier ministre pour son désir de créer des emplois et de faciliter la vie des Manitobains et des Canadiens.pic.twitter.com/96wYW64uRF",6,32,3,1134195331749556224,https://twitter.com/AndrewScheer/status/1134195331749556224,256360738,2019-05-30 20:30:14+00:00,Thu May 30 20:30:14 +0000 2019,@Brian_Pallister,,,
theJagmeetSingh,,Abortion is a fundamental right – and I’m glad Trudeau will say so to Pence today. But here in Canada we need to go further than committing to being #ProChoice – we need to push for better access and universal coverage so no woman who chooses abortion is unable to get one.,590,3113,142,1134163169692332032,https://twitter.com/theJagmeetSingh/status/1134163169692332032,253340075,2019-05-30 18:22:26+00:00,Thu May 30 18:22:26 +0000 2019,,#ProChoice,,
theJagmeetSingh,,"L'avortement est un droit fondamental, et je suis heureux que Justin Trudeau le dise à Mike Pence. Mais ici au Canada, il faut faire plus que nous engager à être #ProChoix : nous devons nous assurer que chaque femme qui fait le choix de l’avortement ait accès à ce service.",15,43,2,1134163145872871425,https://twitter.com/theJagmeetSingh/status/1134163145872871425,253340075,2019-05-30 18:22:20+00:00,Thu May 30 18:22:20 +0000 2019,,#ProChoix,,
AndrewScheer,,It’s time for Canada to think big again! Glad to see more and more people talking about a national energy corridor. It would bring Canadians together in a way we haven’t seen in decades.https://thestarphoenix.com/opinion/columnists/national-corridor-would-boost-economic-growth/wcm/5962c49d-dd85-480b-a777-e69fc996d11d …,362,1177,196,1134150227273965575,https://twitter.com/AndrewScheer/status/1134150227273965575,256360738,2019-05-30 17:31:00+00:00,Thu May 30 17:31:00 +0000 2019,,,,https://thestarphoenix.com/opinion/columnists/national-corridor-would-boost-economic-growth/wcm/5962c49d-dd85-480b-a777-e69fc996d11d
AndrewScheer,,Il est temps que le Canada voie grand de nouveau! Content de voir que de plus en plus de gens parlent d’un corridor énergétique national. Il unirait les Canadiens de façon jamais vue depuis des décennies. https://thestarphoenix.com/opinion/columnists/national-corridor-would-boost-economic-growth/wcm/5962c49d-dd85-480b-a777-e69fc996d11d …,9,33,4,1134150226913005569,https://twitter.com/AndrewScheer/status/1134150226913005569,256360738,2019-05-30 17:31:00+00:00,Thu May 30 17:31:00 +0000 2019,,,,https://thestarphoenix.com/opinion/columnists/national-corridor-would-boost-economic-growth/wcm/5962c49d-dd85-480b-a777-e69fc996d11d
theJagmeetSingh,,"As deadly fires approach #Pikangikum First Nation, we must do everything we can to help evacuate these families. I support Chief Amanda Sainnawap in declaring a state of emergency. My thoughts are with the community.https://www.cbc.ca/news/canada/thunder-bay/pikangikum-first-nation-calls-for-more-evacuation-help-as-fire-nears-1.5155387 …",80,185,5,1134144146292256769,https://twitter.com/theJagmeetSingh/status/1134144146292256769,253340075,2019-05-30 17:06:50+00:00,Thu May 30 17:06:50 +0000 2019,,#Pikangikum,,https://www.cbc.ca/news/canada/thunder-bay/pikangikum-first-nation-calls-for-more-evacuation-help-as-fire-nears-1.5155387
theJagmeetSingh,,"Alors que des incendies mortels approchent de la Première Nation de #Pikangikum, faisons tout notre possible pour aider à évacuer ces familles. J'appuie la cheffe Amanda Sainnawap dans sa déclaration de l'état d'urgence. Mes pensées vont à la communauté.https://ici.radio-canada.ca/nouvelle/1172673/pikangikum-feu-de-foret-evacuation-autochtone-nord-ontario-kapuskasing …",2,11,0,1134144119155109888,https://twitter.com/theJagmeetSingh/status/1134144119155109888,253340075,2019-05-30 17:06:44+00:00,Thu May 30 17:06:44 +0000 2019,,#Pikangikum,,https://ici.radio-canada.ca/nouvelle/1172673/pikangikum-feu-de-foret-evacuation-autochtone-nord-ontario-kapuskasing
ElizabethMay,foodwaterpeace,A fascinating conversation at #PROC about improving decorum in parliament. #GPChttps://twitter.com/foodwaterpeace/status/1134130213191933958 …,9,41,7,1134140939436474368,https://twitter.com/ElizabethMay/status/1134140939436474368,16220555,2019-05-30 16:54:05+00:00,Thu May 30 16:54:05 +0000 2019,,#PROC #GPChttps,,https://twitter.com/foodwaterpeace/status/1134130213191933958
theJagmeetSingh,,Just have to take a moment & give a big shoutout to Burnaby where the road to the Finals started for the Raptors….and let's goooo tonight!!! #WeTheNorthhttps://globalnews.ca/news/5322231/the-toronto-raptors-road-to-the-nba-finals-began-in-burnaby-b-c/ …,9,66,0,1134139548768899078,https://twitter.com/theJagmeetSingh/status/1134139548768899078,253340075,2019-05-30 16:48:34+00:00,Thu May 30 16:48:34 +0000 2019,,#WeTheNorthhttps,,https://globalnews.ca/news/5322231/the-toronto-raptors-road-to-the-nba-finals-began-in-burnaby-b-c/
theJagmeetSingh,,"Je prends un moment pour saluer les gens de Burnaby, en Colombie-Britannique, où la route vers la finale a commencé pour les Raptors. Bon match ce soir!!! #WeTheNorth https://globalnews.ca/news/5322231/the-toronto-raptors-road-to-the-nba-finals-began-in-burnaby-b-c/ …",1,9,0,1134139541605036032,https://twitter.com/theJagmeetSingh/status/1134139541605036032,253340075,2019-05-30 16:48:32+00:00,Thu May 30 16:48:32 +0000 2019,,#WeTheNorth,,https://globalnews.ca/news/5322231/the-toronto-raptors-road-to-the-nba-finals-began-in-burnaby-b-c/
ElizabethMay,,Thanks @SusanDelacourt - that is why I have tried twice to amend the Elections Act to make political parties subject to privacy laws. #GPC https://www.thestar.com/amp/politics/political-opinion/2019/05/29/big-data-has-been-a-big-friend-to-mps.html?__twitter_impression=true …,21,30,0,1134139061248172032,https://twitter.com/ElizabethMay/status/1134139061248172032,16220555,2019-05-30 16:46:38+00:00,Thu May 30 16:46:38 +0000 2019,@SusanDelacourt,#GPC,,https://www.thestar.com/amp/politics/political-opinion/2019/05/29/big-data-has-been-a-big-friend-to-mps.html?__twitter_impression=true
AndrewScheer,CJMENews,"My mother-in-law Barb Ryan has done some incredible work helping new Canadians. Proud to see her and my brother-in-law, @JonRyan9 recognized with honourary Doctor of Laws from @UofRegina!https://twitter.com/CJMENews/status/1133160993679466496 …",46,230,21,1134133008867442691,https://twitter.com/AndrewScheer/status/1134133008867442691,256360738,2019-05-30 16:22:35+00:00,Thu May 30 16:22:35 +0000 2019,@JonRyan9 @UofRegina,,,https://twitter.com/CJMENews/status/1133160993679466496
AndrewScheer,CJMENews,Ma belle-mère Barb Ryan fait un travail incroyable pour aider les nouveaux Canadiens. Je suis fier qu’elle et mon beau-frère @JonRyan9 reçoivent un doctorat honorifique en droit de @UofRegina!https://twitter.com/CJMENews/status/1133160993679466496 …,3,16,0,1134132923060359171,https://twitter.com/AndrewScheer/status/1134132923060359171,256360738,2019-05-30 16:22:14+00:00,Thu May 30 16:22:14 +0000 2019,@JonRyan9 @UofRegina,,,https://twitter.com/CJMENews/status/1133160993679466496
AndrewScheer,,"Canada’s diversity is the result of our strength, and our strength is and always has been our freedom. As Prime Minister, my government will restore fairness, order, and compassion to Canada’s immigration system.https://globalnews.ca/news/5327265/scheer-immigration-plan/ …",204,720,337,1134124840204587008,https://twitter.com/AndrewScheer/status/1134124840204587008,256360738,2019-05-30 15:50:07+00:00,Thu May 30 15:50:07 +0000 2019,,,,https://globalnews.ca/news/5327265/scheer-immigration-plan/
AndrewScheer,,"La diversité du Canada vient de notre force, et notre force est et a toujours été notre liberté. Quand je serai premier ministre, mon gouvernement rétablira l’équité, l’ordre et la compassion du système d’immigration du Canada.https://www.journaldemontreal.com/2019/05/28/scheer-promet-de-mettre-de-lordre-dans-le-systeme-dimmigration-1 …",10,17,10,1134124818373206024,https://twitter.com/AndrewScheer/status/1134124818373206024,256360738,2019-05-30 15:50:02+00:00,Thu May 30 15:50:02 +0000 2019,,,,https://www.journaldemontreal.com/2019/05/28/scheer-promet-de-mettre-de-lordre-dans-le-systeme-dimmigration-1
JustinTrudeau,HistoricaCanada,"Nearly 75 years ago, Canadians like Major Archie MacNaughton bravely fought & sacrificed on D-Day - a pivotal moment in World War II. Sharing stories like his help us remember & honour the heroes who changed the course of history. Watch @HistoricaCanada’s new #HeritageMinute:https://twitter.com/HistoricaCanada/status/1134036728967118851 …",197,1034,107,1134122001650651137,https://twitter.com/JustinTrudeau/status/1134122001650651137,14260960,2019-05-30 15:38:50+00:00,Thu May 30 15:38:50 +0000 2019,@HistoricaCanada,#HeritageMinute,,https://twitter.com/HistoricaCanada/status/1134036728967118851
JustinTrudeau,HistoricaCanada,"Il y a près de 75 ans, des Canadiens comme le major Archie MacNaughton ont vaillament combattu lors du jour J, moment clé de la 2e Guerre mondiale. Leurs histoires nous aident à honorer les héros qui ont changé l’histoire. Voici la nouvelle #MinuteDuPatrimoine d’ @HistoricaCanada:https://twitter.com/HistoricaCanada/status/1134036732414910464 …",25,198,13,1134121831315779584,https://twitter.com/JustinTrudeau/status/1134121831315779584,14260960,2019-05-30 15:38:10+00:00,Thu May 30 15:38:10 +0000 2019,@HistoricaCanada,#MinuteDuPatrimoine,,https://twitter.com/HistoricaCanada/status/1134036732414910464
AndrewScheer,,"Les niveaux d'immigration devraient tenir compte des besoins du Canada, pas de la volonté des politiciens. Comme premier ministre, je vais fixer des niveaux d'immigration dans le meilleur intérêt du Canada et, tout aussi important, en fonction de ceux qui ont besoin du Canada.pic.twitter.com/JEkvcGGay2",6,23,9,1134108326130831361,https://twitter.com/AndrewScheer/status/1134108326130831361,256360738,2019-05-30 14:44:30+00:00,Thu May 30 14:44:30 +0000 2019,,,,
ElizabethMay,,Thanks to Noah Irvine for his campaign to improve mental health services. He is an inspiration. #GPChttps://www.cbc.ca/news/canada/kitchener-waterloo/guelph-noah-irvine-campaign-wrap-up-1.5154001 …,18,68,7,1134104363520155648,https://twitter.com/ElizabethMay/status/1134104363520155648,16220555,2019-05-30 14:28:45+00:00,Thu May 30 14:28:45 +0000 2019,,#GPChttps,,https://www.cbc.ca/news/canada/kitchener-waterloo/guelph-noah-irvine-campaign-wrap-up-1.5154001
AndrewScheer,,"We need an immigration system that moves with the times and will reflect what Canada needs. As Prime Minister, I will set immigration levels consistent with what is in Canada’s best interests and, just as importantly, who needs Canada.pic.twitter.com/35xjup4rMd",298,951,245,1134097131554430976,https://twitter.com/AndrewScheer/status/1134097131554430976,256360738,2019-05-30 14:00:01+00:00,Thu May 30 14:00:01 +0000 2019,,,,
JustinTrudeau,,"Appointing a gender-balanced cabinet isn’t just the right thing to do, it’s the smart thing to do. South Africa joined the growing list of countries who are making this smart choice. Congratulations @CyrilRamaphosa – looking forward to continue working with you & your government.",1141,5720,1340,1134093034860232704,https://twitter.com/JustinTrudeau/status/1134093034860232704,14260960,2019-05-30 13:43:44+00:00,Thu May 30 13:43:44 +0000 2019,@CyrilRamaphosa,,,
JustinTrudeau,,"Nommer un Cabinet paritaire n’est pas seulement la bonne chose à faire; c’est la chose intelligente à faire. L’Afrique du Sud s’est jointe à la liste grandissante de pays qui ont fait ce choix. Félicitations, @CyrilRamaphosa – au plaisir de travailler avec vous et votre équipe.",39,244,13,1134092996843134976,https://twitter.com/JustinTrudeau/status/1134092996843134976,14260960,2019-05-30 13:43:35+00:00,Thu May 30 13:43:35 +0000 2019,@CyrilRamaphosa,,,
yfblanchet,,"Une trop rare rencontre avec ma Première ministre, toujours un modèle de dignité, de retenue et de compétence, et qui a désormais une salle à son nom à l’Assemblée nationale du Québec. pic.twitter.com/MQuAMOJtKo",38,160,5,1134078063397003264,https://twitter.com/yfblanchet/status/1134078063397003264,38262290,2019-05-30 12:44:15+00:00,Thu May 30 12:44:15 +0000 2019,,,,
yfblanchet,,SNC Lavalin: 1. Employés innocents 2. Direction et déontologie changés 3. Ententes de réparation fréquentes en Occident Le Procureur général est indépendant? Qu'il agisse sans s'agenouiller devant les Conservateurs et leurs préjugés anti-Québec.http://www.blocquebecois.org/2019/05/snc-lavalin-subira-un-proces-ottawa-doit-immediatement-conclure-un-accord-de-reparation/ …,8,26,0,1134076125653741568,https://twitter.com/yfblanchet/status/1134076125653741568,38262290,2019-05-30 12:36:33+00:00,Thu May 30 12:36:33 +0000 2019,,,,http://www.blocquebecois.org/2019/05/snc-lavalin-subira-un-proces-ottawa-doit-immediatement-conclure-un-accord-de-reparation/
yfblanchet,,En imposant des conditions pour rendre à Québec l'argent d'une compétence exclusive du Québec - les infrastructures de transport collectif - le gouvernement Trudeau ne respecte pas l'Assemblée nationale et nuit au transport collectif hors-Montréal.https://ici.radio-canada.ca/nouvelle/1172583/negociations-reseau-structurant-valerie-plante-regis-labeaume-francois-legault …,37,48,6,1134075121503735808,https://twitter.com/yfblanchet/status/1134075121503735808,38262290,2019-05-30 12:32:33+00:00,Thu May 30 12:32:33 +0000 2019,,,,https://ici.radio-canada.ca/nouvelle/1172583/negociations-reseau-structurant-valerie-plante-regis-labeaume-francois-legault
ElizabethMay,CoastProtectors,"I hear this from friends and neighbours -""smoke season."" A chilling reference to something we should not be accepting - in summer it is harder to breath. We are in a climate emergency. #MissionPossible #GPC #climatehttps://twitter.com/CoastProtectors/status/1133802771067465728 …",202,393,46,1134066255873433600,https://twitter.com/ElizabethMay/status/1134066255873433600,16220555,2019-05-30 11:57:19+00:00,Thu May 30 11:57:19 +0000 2019,,#MissionPossible #GPC #climatehttps,,https://twitter.com/CoastProtectors/status/1133802771067465728
AndrewScheer,,Justin Trudeau keeps failing to come clean with Canadians in the Vice-Admiral Mark Norman case. Tonight his Liberals voted again to hide documents from Canadians that would have shed light on Trudeau’s corruption and cover-ups.pic.twitter.com/SsbGYuBIfQ,181,384,51,1133918433073074176,https://twitter.com/AndrewScheer/status/1133918433073074176,256360738,2019-05-30 02:09:56+00:00,Thu May 30 02:09:56 +0000 2019,,,,
AndrewScheer,,"Justin Trudeau est incapable d’être honnête avec les Canadiens sur l’affaire du vice-amiral Mark Norman. Ce soir, les libéraux ont encore voté pour cacher aux Canadiens des documents qui auraient fait la lumière sur la corruption et le camouflage de Trudeau.pic.twitter.com/23WHohUv9V",7,33,2,1133918408662298624,https://twitter.com/AndrewScheer/status/1133918408662298624,256360738,2019-05-30 02:09:50+00:00,Thu May 30 02:09:50 +0000 2019,,,,
JustinTrudeau,,"Renegotiating NAFTA was no small task, but Canadians came together & got it done – to maintain a stable economy, strengthen the middle class, protect our jobs, & create new ones. Today we took the next step & introduced legislation to ratify the new NAFTA in the House of Commons.pic.twitter.com/3LD8J59fo8",436,2489,455,1133911728281063424,https://twitter.com/JustinTrudeau/status/1133911728281063424,14260960,2019-05-30 01:43:17+00:00,Thu May 30 01:43:17 +0000 2019,,,,
JustinTrudeau,,"Il n’a pas été facile de renégocier l'ALENA, mais les Canadiens se sont unis pour maintenir une économie stable, renforcer la classe moyenne, protéger nos emplois et en créer d’autres. On dépose aujourd'hui un projet de loi à la Chambre des communes pour ratifier le nouvel ALENA.pic.twitter.com/l8G01EWHQF",41,220,13,1133911644130750464,https://twitter.com/JustinTrudeau/status/1133911644130750464,14260960,2019-05-30 01:42:57+00:00,Thu May 30 01:42:57 +0000 2019,,,,
JustinTrudeau,,"In an increasingly digital world, there are lots of challenges to navigate when it comes to open government - but we're tackling them to strengthen our democracy & focus on you. Thanks to @feministabulous for the chat (& the laughs) at #OGPCanada tonight.pic.twitter.com/gGJw41pCSN",75,374,77,1133901355255500803,https://twitter.com/JustinTrudeau/status/1133901355255500803,14260960,2019-05-30 01:02:04+00:00,Thu May 30 01:02:04 +0000 2019,@feministabulous,#OGPCanada,,
JustinTrudeau,,"Dans un monde de plus en plus numérique, il faut relever beaucoup de défis pour avoir un gouvernement ouvert – et nous allons les relever pour renforcer notre démocratie et mettre l’accent sur vous. Merci à @feministabulous pour la discussion (et les rires) au #PGOCanada ce soir.pic.twitter.com/cn8qLlDOEF",14,142,14,1133901336523759622,https://twitter.com/JustinTrudeau/status/1133901336523759622,14260960,2019-05-30 01:02:00+00:00,Thu May 30 01:02:00 +0000 2019,@feministabulous,#PGOCanada,,
MaximeBernier,PnPCBC,"Trudeau/Freeland n’arrêtent pas de faire la leçon à nos amis sur le genre, le réchauffement etc. Ça explique pourquoi la renégociation de l’ALÉNA a été si difficile. Pourquoi ne pas les laisser gérer leurs affaires internes et se concentrer à défendre les INTÉRÊTS DU CANADA?https://twitter.com/PnPCBC/status/1133802797676269569 …",42,82,8,1133895394944016389,https://twitter.com/MaximeBernier/status/1133895394944016389,2791988124,2019-05-30 00:38:23+00:00,Thu May 30 00:38:23 +0000 2019,,,,https://twitter.com/PnPCBC/status/1133802797676269569
MaximeBernier,PnPCBC,"Trudeau and Freeland keep lecturing our American friends and others on gender issues, climate change etc. That’s one reason NAFTA renegotiations were difficult. Can’t we let other countries manage their internal affairs and have a foreign policy grounded on CANADA’S INTERESTS?https://twitter.com/PnPCBC/status/1133802797676269569 …",351,879,108,1133893995665534977,https://twitter.com/MaximeBernier/status/1133893995665534977,2791988124,2019-05-30 00:32:49+00:00,Thu May 30 00:32:49 +0000 2019,,,,https://twitter.com/PnPCBC/status/1133802797676269569
JustinTrudeau,,"Vaccines are safe, and save lives. Love this shirt, thanks @GinettePT! #VaccinesCauseAdultspic.twitter.com/7TluU4E6VL",1666,8462,385,1133892391268749313,https://twitter.com/JustinTrudeau/status/1133892391268749313,14260960,2019-05-30 00:26:27+00:00,Thu May 30 00:26:27 +0000 2019,@GinettePT,#VaccinesCauseAdultspic,,
JustinTrudeau,,"Les vaccins sont sûrs et sauvent des vies. J'adore cette chemise, merci @GinettePT! #VaccinesCauseAdultspic.twitter.com/8VYKBKuinE",76,497,24,1133892350705590273,https://twitter.com/JustinTrudeau/status/1133892350705590273,14260960,2019-05-30 00:26:17+00:00,Thu May 30 00:26:17 +0000 2019,@GinettePT,#VaccinesCauseAdultspic,,
