username,to,text,retweets,favorites,replies,id,permalink,author_id,date,formatted_date,mentions,hashtags,geo,urls
yfblanchet,,"Donc: • @jkenney, pas @AndrewScheer, mène les Conservateurs du Canada • le PCC et le PLC veulent un pays pétrolier et nient le danger du réch. du climat • la péréquation sert à attacher le Québec au sein d’un Canada qui agit contre sa volonté légitime.https://www.journaldemontreal.com/2019/04/21/le-premier-ministre-albertain-veut-creer-une-alliance-conservatrice-anti-trudeau …",25,28,6,1120095788712058882,https://twitter.com/yfblanchet/status/1120095788712058882,38262290,2019-04-21 22:43:41+00:00,Sun Apr 21 22:43:41 +0000 2019,@jkenney @AndrewScheer,,,https://www.journaldemontreal.com/2019/04/21/le-premier-ministre-albertain-veut-creer-une-alliance-conservatrice-anti-trudeau
AndrewScheer,,Tellement béni d'avoir le soutien et l'amour de ma famille.pic.twitter.com/XM1w4FBfLo,5,52,2,1120085048374509576,https://twitter.com/AndrewScheer/status/1120085048374509576,256360738,2019-04-21 22:01:00+00:00,Sun Apr 21 22:01:00 +0000 2019,,,,
AndrewScheer,,So blessed to have the loving support of my family.pic.twitter.com/eaIQoO3Tw7,102,1200,121,1120085048236105729,https://twitter.com/AndrewScheer/status/1120085048236105729,256360738,2019-04-21 22:01:00+00:00,Sun Apr 21 22:01:00 +0000 2019,,,,
MaximeBernier,,Plusieurs villes et villages de la Beauce sont touchés par les inondations. Je constate les dégâts à Vallée-Jonction avec le personnel de sécurité. Several towns and villages in Beauce are affected by flooding. I’m with security staff in Vallée-Jonction to survey the damage.pic.twitter.com/UrZw936rX7,64,191,10,1120063358181548035,https://twitter.com/MaximeBernier/status/1120063358181548035,2791988124,2019-04-21 20:34:49+00:00,Sun Apr 21 20:34:49 +0000 2019,,,,
JustinTrudeau,,"Today, Sophie and I join Canadians in wishing Queen Elizabeth II a very happy 93rd birthday, and continued health & happiness.pic.twitter.com/gI04FqhMhZ",836,7947,304,1120047905702842368,https://twitter.com/JustinTrudeau/status/1120047905702842368,14260960,2019-04-21 19:33:24+00:00,Sun Apr 21 19:33:24 +0000 2019,,,,
JustinTrudeau,,"Aujourd’hui, Sophie et moi nous joignons aux Canadiens pour offrir à la reine Elizabeth II, qui célèbre son 93e anniversaire, nos meilleurs vœux de santé et de bonheur pour les années à avenir.pic.twitter.com/eZ3f6ealAs",70,573,27,1120047774068822016,https://twitter.com/JustinTrudeau/status/1120047774068822016,14260960,2019-04-21 19:32:53+00:00,Sun Apr 21 19:32:53 +0000 2019,,,,
theJagmeetSingh,,"Wishing a very happy Easter to all those celebrating – today is an important reminder of the universal values of love, compassion and sacrifice. https://www.ndp.ca/news/ndp-statement-celebrating-easter …",34,206,8,1120044315458375684,https://twitter.com/theJagmeetSingh/status/1120044315458375684,253340075,2019-04-21 19:19:08+00:00,Sun Apr 21 19:19:08 +0000 2019,,,,https://www.ndp.ca/news/ndp-statement-celebrating-easter
theJagmeetSingh,,"Joyeuses Pâques à ceux et celles qui célèbrent cette fête. Rappelons-nous aujourd’hui que l’amour, la compassion et le sacrifice sont des valeurs universelles. https://www.npd.ca/nouvelles/declaration-du-npd-pour-paques …",7,38,0,1120043637528829953,https://twitter.com/theJagmeetSingh/status/1120043637528829953,253340075,2019-04-21 19:16:27+00:00,Sun Apr 21 19:16:27 +0000 2019,,,,https://www.npd.ca/nouvelles/declaration-du-npd-pour-paques
JustinTrudeau,,Happy Easter! I hope all those celebrating have a wonderful day spent with family and friends. http://bit.ly/2Gwi93Y pic.twitter.com/lXN2e4r4m4,528,4004,348,1120031744835481600,https://twitter.com/JustinTrudeau/status/1120031744835481600,14260960,2019-04-21 18:29:11+00:00,Sun Apr 21 18:29:11 +0000 2019,,,,http://bit.ly/2Gwi93Y
JustinTrudeau,,Joyeuses Pâques! Je souhaite à tous ceux et celles qui célèbrent aujourd’hui une magnifique journée en famille et entre amis. http://bit.ly/2XxpyH2 pic.twitter.com/cVNcWQJQFz,91,549,47,1120031600991883264,https://twitter.com/JustinTrudeau/status/1120031600991883264,14260960,2019-04-21 18:28:37+00:00,Sun Apr 21 18:28:37 +0000 2019,,,,http://bit.ly/2XxpyH2
JustinTrudeau,,Please read my full statement on the terrorist attacks in Sri Lanka:https://pm.gc.ca/eng/news/2019/04/21/statement-prime-minister-terrorist-attacks-sri-lanka …,336,1388,249,1120009874908360706,https://twitter.com/JustinTrudeau/status/1120009874908360706,14260960,2019-04-21 17:02:17+00:00,Sun Apr 21 17:02:17 +0000 2019,,,,https://pm.gc.ca/eng/news/2019/04/21/statement-prime-minister-terrorist-attacks-sri-lanka
JustinTrudeau,,Lisez ma déclaration sur les attentats terroristes perpétrés au Sri Lanka :https://pm.gc.ca/fra/nouvelles/2019/04/21/declaration-du-premier-ministre-concernant-les-attentats-terroristes-au-sri …,54,219,21,1120009729508630528,https://twitter.com/JustinTrudeau/status/1120009729508630528,14260960,2019-04-21 17:01:42+00:00,Sun Apr 21 17:01:42 +0000 2019,,,,https://pm.gc.ca/fra/nouvelles/2019/04/21/declaration-du-premier-ministre-concernant-les-attentats-terroristes-au-sri
theJagmeetSingh,,Horrific news out of Sri Lanka with terror attacks targeting Christians in a church and hotel on Easter Sunday. My thoughts are with the hundreds of families who lost loved ones – and with the Christian community in Sri Lanka and around the world.,178,866,15,1120005264030273538,https://twitter.com/theJagmeetSingh/status/1120005264030273538,253340075,2019-04-21 16:43:58+00:00,Sun Apr 21 16:43:58 +0000 2019,,,,
theJagmeetSingh,,"Horribles nouvelles du Sri Lanka en ce dimanche de Pâques, avec des attaques terroristes ciblant des chrétiens dans une église et un hôtel. Mes pensées vont aux centaines de familles qui ont perdu des êtres chers, et à la communauté chrétienne du Sri Lanka et à travers le monde.",9,85,1,1120005256639860736,https://twitter.com/theJagmeetSingh/status/1120005256639860736,253340075,2019-04-21 16:43:56+00:00,Sun Apr 21 16:43:56 +0000 2019,,,,
AndrewScheer,,My statement on today’s attacks in Sri Lanka: https://www.facebook.com/AndrewScheerMP/posts/2613846575315745 …,121,286,53,1120000300532805632,https://twitter.com/AndrewScheer/status/1120000300532805632,256360738,2019-04-21 16:24:14+00:00,Sun Apr 21 16:24:14 +0000 2019,,,,https://www.facebook.com/AndrewScheerMP/posts/2613846575315745
AndrewScheer,,Ma déclaration au sujet des attaques au Sri Lanka aujourd’hui: https://www.facebook.com/AndrewScheerMP/posts/2613845225315880 …,10,23,3,1120000203346579458,https://twitter.com/AndrewScheer/status/1120000203346579458,256360738,2019-04-21 16:23:51+00:00,Sun Apr 21 16:23:51 +0000 2019,,,,https://www.facebook.com/AndrewScheerMP/posts/2613845225315880
MaximeBernier,ozzy19506218,"Typical dishonest reply from diversity cultists. Let me explain again: Women and members of minorities who are qualified DON’T NEED employment equity programs. Those who are not qualified should NOT be hired. No group privilege, same rules for everyone. That’s true FAIRNESS.https://twitter.com/ozzy19506218/status/1119936582096703488 …",690,2259,163,1119955063408078848,https://twitter.com/MaximeBernier/status/1119955063408078848,2791988124,2019-04-21 13:24:29+00:00,Sun Apr 21 13:24:29 +0000 2019,,,,https://twitter.com/ozzy19506218/status/1119936582096703488
AndrewScheer,,"On behalf of Canada’s Conservatives, I extend my warmest wishes, from my family to yours, to all those celebrating a blessed and joyful Easter. My full statement: https://www.facebook.com/AndrewScheerMP/videos/564141144094088/ …pic.twitter.com/UUd66enZeO",344,1860,132,1119951128278589440,https://twitter.com/AndrewScheer/status/1119951128278589440,256360738,2019-04-21 13:08:51+00:00,Sun Apr 21 13:08:51 +0000 2019,,,,https://www.facebook.com/AndrewScheerMP/videos/564141144094088/
AndrewScheer,,"Au nom des conservateurs du Canada, de ma famille à la vôtre, je souhaite à tous ceux qui célèbrent une fête de Pâques joyeuse et bénie. Ma déclaration: https://www.facebook.com/AndrewScheerMP/videos/340132739970994/ …pic.twitter.com/JboNjDGmzv",12,59,6,1119951006861864960,https://twitter.com/AndrewScheer/status/1119951006861864960,256360738,2019-04-21 13:08:22+00:00,Sun Apr 21 13:08:22 +0000 2019,,,,https://www.facebook.com/AndrewScheerMP/videos/340132739970994/
JustinTrudeau,,Absolutely horrific news from Sri Lanka. Canada strongly condemns the heinous attacks on Christians at churches and hotels. Our hearts & thoughts are with the families & loved ones of those killed and all those injured.,3822,19601,996,1119944673747972096,https://twitter.com/JustinTrudeau/status/1119944673747972096,14260960,2019-04-21 12:43:12+00:00,Sun Apr 21 12:43:12 +0000 2019,,,,
JustinTrudeau,,Des nouvelles absolument horribles du Sri Lanka. Le Canada condamne avec vigueur les attaques haineuses commises contre les Chrétiens dans des églises et des hôtels. Nos cœurs et nos pensées accompagnent les familles et les proches des personnes tuées ou blessées.,231,1031,48,1119944594936954880,https://twitter.com/JustinTrudeau/status/1119944594936954880,14260960,2019-04-21 12:42:53+00:00,Sun Apr 21 12:42:53 +0000 2019,,,,
AndrewScheer,,"Justin Trudeau has failed to be honest with Canadians and when he gets caught he tries to change the channel, shift blame, and spreads fear and division. This October Canadians will have the opportunity to say no more to Justin Trudeau’s falsehoods.pic.twitter.com/Tmn3Pqhyx2",1844,3849,630,1119757954557927424,https://twitter.com/AndrewScheer/status/1119757954557927424,256360738,2019-04-21 00:21:15+00:00,Sun Apr 21 00:21:15 +0000 2019,,,,
AndrewScheer,,"Justin Trudeau est incapable d’être honnête avec les Canadiens. Quand il se fait prendre, il tente de détourner l’attention, de faire porter le blâme à quelqu’un d’autre et de semer la peur et la division. En octobre, les Canadiens pourront dire non aux mensonges de Trudeau.pic.twitter.com/Gymoa6MmcS",31,112,14,1119757859800190979,https://twitter.com/AndrewScheer/status/1119757859800190979,256360738,2019-04-21 00:20:52+00:00,Sun Apr 21 00:20:52 +0000 2019,,,,
