username,to,text,retweets,favorites,replies,id,permalink,author_id,date,formatted_date,mentions,hashtags,geo,urls
theJagmeetSingh,,"Today I vowed never to prop up an Andrew Scheer government. I guess they’re just double checking? Still no, Sarah. Still no.pic.twitter.com/rEMkZEEEsY",1760,12106,1235,1164683479218577408,https://twitter.com/theJagmeetSingh/status/1164683479218577408,253340075,2019-08-22 23:39:14+00:00,Thu Aug 22 23:39:14 +0000 2019,,,,
JustinTrudeau,SohiAmarjeet,". @SohiAmarjeet is absolutely right. Canadians work hard to drive our economy, build our communities, and contribute to our country every single day. And our government will always stand up for you.https://twitter.com/SohiAmarjeet/status/1164516400695824385 …",273,1651,522,1164677357355114501,https://twitter.com/JustinTrudeau/status/1164677357355114501,14260960,2019-08-22 23:14:55+00:00,Thu Aug 22 23:14:55 +0000 2019,@SohiAmarjeet,,,https://twitter.com/SohiAmarjeet/status/1164516400695824385
JustinTrudeau,SohiAmarjeet,". @SohiAmarjeet a tout à fait raison. Les Canadiens travaillent fort pour faire croître notre économie, renforcer nos communautés et contribuer chaque jour à notre pays. Notre gouvernement défendra toujours vos intérêts.https://twitter.com/SohiAmarjeet/status/1164516400695824385 …",28,213,30,1164677236647178240,https://twitter.com/JustinTrudeau/status/1164677236647178240,14260960,2019-08-22 23:14:26+00:00,Thu Aug 22 23:14:26 +0000 2019,@SohiAmarjeet,,,https://twitter.com/SohiAmarjeet/status/1164516400695824385
yfblanchet,,"Que des jeunes de la trempe de Maxime Blanchette-Joncas @BlanchetteMax soient candidats au @BlocQuebecois est une indication extraordinaire que notre parti, son offre politique et l’idée d’un pays bien à nous touchent désormais une autre génération. https://www.lavantage.qc.ca/article/2019/08/22/maxime-blanchette-joncas-se-presente-a-l-investiture-bloquiste …",21,31,0,1164675912866160641,https://twitter.com/yfblanchet/status/1164675912866160641,38262290,2019-08-22 23:09:10+00:00,Thu Aug 22 23:09:10 +0000 2019,@BlanchetteMax @BlocQuebecois,,,https://www.lavantage.qc.ca/article/2019/08/22/maxime-blanchette-joncas-se-presente-a-l-investiture-bloquiste
theJagmeetSingh,,Huge thank you to everybody in Brampton who helped make our event last night such a huge success – especially to our incredible volunteers. we really showed up & made it clear that people in Brampton are ready for an NDP government that's in it for them. What a great night!pic.twitter.com/WXACi11sOc,30,225,16,1164670578072195077,https://twitter.com/theJagmeetSingh/status/1164670578072195077,253340075,2019-08-22 22:47:59+00:00,Thu Aug 22 22:47:59 +0000 2019,,,,
theJagmeetSingh,,Merci aux gens de Brampton qui ont fait de notre événement d'hier soir un franc succès. Nous sommes allé∙es voir les gens de la région de Peel : ils et elles sont clairement prêt∙es pour un gouvernement néo-démocrate qui travaille pour eux et elles. Quelle belle soirée!pic.twitter.com/IhkrQyCEGJ,12,43,0,1164670563803127808,https://twitter.com/theJagmeetSingh/status/1164670563803127808,253340075,2019-08-22 22:47:55+00:00,Thu Aug 22 22:47:55 +0000 2019,,,,
yfblanchet,,"Première rencontre avec Louis Gagnon, notre candidat du @BlocQuebecois dans Montmagny-L’Islet-Kamouraska-Rivière-du-Loup. Sympathique, enraciné et brillant, ce Louis-là! Dabs l’Est-du-Québec, on joue pour la Coupe! https://www.infodimanche.com/actualites/elections-canada-2019/370067/yves-francois-blanchet-de-passage-a-riviere-du-loup …",16,22,0,1164650540229365760,https://twitter.com/yfblanchet/status/1164650540229365760,38262290,2019-08-22 21:28:21+00:00,Thu Aug 22 21:28:21 +0000 2019,@BlocQuebecois,,,https://www.infodimanche.com/actualites/elections-canada-2019/370067/yves-francois-blanchet-de-passage-a-riviere-du-loup
theJagmeetSingh,,"Les préjugés répugnants d'Andrew Scheer contre la communauté LGBTQI2S+ sont très douloureux. C'est pourquoi, si les Canadiennes et Canadiens décident de former un gouvernement minoritaire en octobre, je ne soutiendrai ni Andrew Scheer ni les conservateurs.https://www.lapresse.ca/actualites/politique/201908/22/01-5238302-un-vieux-discours-de-scheer-contre-le-mariage-gai-refait-surface.php …",30,97,8,1164637316130004994,https://twitter.com/theJagmeetSingh/status/1164637316130004994,253340075,2019-08-22 20:35:48+00:00,Thu Aug 22 20:35:48 +0000 2019,,,,https://www.lapresse.ca/actualites/politique/201908/22/01-5238302-un-vieux-discours-de-scheer-contre-le-mariage-gai-refait-surface.php
theJagmeetSingh,,"Andrew Scheer’s disgusting prejudice against LGBTQI2S+ people and families is very painful for many Canadians. This is exactly why, if Canadians deliver a minority government in October, I will not prop up Andrew Scheer and the Conservatives.https://www.thestar.com/politics/federal/2019/08/22/andrew-scheer-said-gay-couples-lack-inherent-quality-of-marriage-in-tape-of-2005-speech-unearthed-by-liberals.html …",1186,5054,1296,1164631112678817792,https://twitter.com/theJagmeetSingh/status/1164631112678817792,253340075,2019-08-22 20:11:09+00:00,Thu Aug 22 20:11:09 +0000 2019,,,,https://www.thestar.com/politics/federal/2019/08/22/andrew-scheer-said-gay-couples-lack-inherent-quality-of-marriage-in-tape-of-2005-speech-unearthed-by-liberals.html
JustinTrudeau,,"Scientists and researchers make the discoveries that drive our country forward - we need to make sure they have the tools and funds to do so. I sat down with @ChiefSciCan Dr. Mona Nemer today for an update on her work, and how we can keep supporting Canada’s brightest minds.pic.twitter.com/9iST9ufmoJ",272,1487,197,1164621199453954049,https://twitter.com/JustinTrudeau/status/1164621199453954049,14260960,2019-08-22 19:31:46+00:00,Thu Aug 22 19:31:46 +0000 2019,@ChiefSciCan,,,
JustinTrudeau,,"Les scientifiques et les chercheurs font des découvertes qui font avancer notre pays. J'ai rencontré Dre Mona Nemer, @ChiefSciCan, pour discuter de son travail et de la façons dont on peut continuer à soutenir la communauté scientifique.pic.twitter.com/I4ktsGNvfF",34,211,20,1164621050526781440,https://twitter.com/JustinTrudeau/status/1164621050526781440,14260960,2019-08-22 19:31:10+00:00,Thu Aug 22 19:31:10 +0000 2019,@ChiefSciCan,,,
JustinTrudeau,,"Welcome to Ottawa, @SecPompeo. As longtime partners and allies, Canada and the US will continue working together to strengthen our relationship, grow the middle class, and create opportunities for people on both sides of the border.pic.twitter.com/XUFOF4HOpd",116,835,224,1164611747430445058,https://twitter.com/JustinTrudeau/status/1164611747430445058,14260960,2019-08-22 18:54:12+00:00,Thu Aug 22 18:54:12 +0000 2019,@SecPompeo,,,
JustinTrudeau,,"Bienvenue à Ottawa, @SecPompeo. En tant qu’alliés de longue date, le Canada et les États-Unis vont continuer de travailler ensemble pour renforcer notre relation, faire croître la classe moyenne et créer des opportunités pour les gens des deux côtés de la frontière.pic.twitter.com/un5LW0xhpN",23,187,16,1164611616006135809,https://twitter.com/JustinTrudeau/status/1164611616006135809,14260960,2019-08-22 18:53:41+00:00,Thu Aug 22 18:53:41 +0000 2019,@SecPompeo,,,
theJagmeetSingh,,"#DearJack ""Love is better than anger. Hope is better than fear."" Eight years after leaving us, your leadership continues to fill our hearts with hope that a better world is always possible – and worth fighting for. Thanks, Jackpic.twitter.com/oFSQoQmYVR",194,924,23,1164584498991980546,https://twitter.com/theJagmeetSingh/status/1164584498991980546,253340075,2019-08-22 17:05:56+00:00,Thu Aug 22 17:05:56 +0000 2019,,#DearJack,,
theJagmeetSingh,,"« L’amour est cent fois meilleur que la haine. L’espoir est meilleur que la peur. » Huit ans après le décès de Jack Layton, son leadership continue de nous inspirer l’espoir qu’un monde meilleur est encore possible. Le combat mérite d’être mené. Merci Jackpic.twitter.com/JKJZV1GJM2",16,63,4,1164584493245747200,https://twitter.com/theJagmeetSingh/status/1164584493245747200,253340075,2019-08-22 17:05:54+00:00,Thu Aug 22 17:05:54 +0000 2019,,,,
MaximeBernier,ErinOTooleMP,"And how can we take YOU seriously @ErinOTooleMP when you want to send “more aid, development and refugee support” to Saudi Arabia and other rich countries in the Gulf region to improve relations with them? Sounds just like Trudeau. https://www.spencerfernando.com/2019/08/02/foolish-conservatives-strangely-musing-about-closer-ties-with-saudi-arabia-giving-more-foreign-aid-to-gulf-region/ …https://twitter.com/ErinOTooleMP/status/1164281755714707456 …",293,724,81,1164511919321092098,https://twitter.com/MaximeBernier/status/1164511919321092098,2791988124,2019-08-22 12:17:31+00:00,Thu Aug 22 12:17:31 +0000 2019,@ErinOTooleMP,,,"https://www.spencerfernando.com/2019/08/02/foolish-conservatives-strangely-musing-about-closer-ties-with-saudi-arabia-giving-more-foreign-aid-to-gulf-region/,https://twitter.com/ErinOTooleMP/status/1164281755714707456"
yfblanchet,,"Des épluchettes de blé-d’Inde, il n’y en a pas autant qu’on en imagine en politique l’été. Pourtant! Celle de @ChristineNorm a été un gros et savoureux succès, fréquenté par plusieurs de nos candidats. Le cœur et le dynamisme des militants permettent tous les espoirs. pic.twitter.com/qofiLwgeCw",9,27,2,1164491215657754624,https://twitter.com/yfblanchet/status/1164491215657754624,38262290,2019-08-22 10:55:15+00:00,Thu Aug 22 10:55:15 +0000 2019,@ChristineNorm,,,
MaximeBernier,AndrewLawton,"Elle fait partie de l’establishment politique comme les autres: en faveur d’un gros État, alarmiste, mondialiste, pro immigration de masse. Pourquoi voudrait-elle que je que je remette tout ça en question aux débats? Le PPC lui soutire des votes à elle aussi.https://twitter.com/AndrewLawton/status/1164254527052234754 …",42,94,5,1164347353366765569,https://twitter.com/MaximeBernier/status/1164347353366765569,2791988124,2019-08-22 01:23:36+00:00,Thu Aug 22 01:23:36 +0000 2019,,,,https://twitter.com/AndrewLawton/status/1164254527052234754
MaximeBernier,,"La «compensation» de 1,75G$pour une petite ouverture du marché ne règlera rien. Les contribuables vont payer plus. Les consommateurs vont continuer de payer plus. Plus de fermes vont disparaître. Une autre occasion ratée de changer ce mauvais système.https://www.thechronicleherald.ca/business/perspectives-on-business/sylvain-charlebois-compensation-payments-to-farmers-dont-help-consumers-at-the-cash-register-343296/#.XV3s2zaofFo.twitter …",27,68,2,1164346401255579648,https://twitter.com/MaximeBernier/status/1164346401255579648,2791988124,2019-08-22 01:19:49+00:00,Thu Aug 22 01:19:49 +0000 2019,,#,,https://www.thechronicleherald.ca/business/perspectives-on-business/sylvain-charlebois-compensation-payments-to-farmers-dont-help-consumers-at-the-cash-register-343296/#.XV3s2zaofFo.twitter
MaximeBernier,,The $1.75B “compensation” to dairy farmers for a small opening of our market will solve nothing. Taxpayers will pay more. Consumers will continue to pay more. More farms will disappear. Another missed opportunity to change this bad system. https://www.thechronicleherald.ca/business/perspectives-on-business/sylvain-charlebois-compensation-payments-to-farmers-dont-help-consumers-at-the-cash-register-343296/#.XV3q-ixNhcE.twitter …,170,340,18,1164345086244732928,https://twitter.com/MaximeBernier/status/1164345086244732928,2791988124,2019-08-22 01:14:35+00:00,Thu Aug 22 01:14:35 +0000 2019,,#,,https://www.thechronicleherald.ca/business/perspectives-on-business/sylvain-charlebois-compensation-payments-to-farmers-dont-help-consumers-at-the-cash-register-343296/#.XV3q-ixNhcE.twitter
MaximeBernier,AndrewLawton,"She’s part of the political establishment just like the others: in favour of big government, climate alarmist, globalist, pro mass immigration. Why would she want me to question all this nonsense at the debates? The PPC is taking votes away from her too.https://twitter.com/AndrewLawton/status/1164254527052234754 …",306,729,65,1164343094164299776,https://twitter.com/MaximeBernier/status/1164343094164299776,2791988124,2019-08-22 01:06:40+00:00,Thu Aug 22 01:06:40 +0000 2019,,,,https://twitter.com/AndrewLawton/status/1164254527052234754
MaximeBernier,,"En septembre dernier, j’ai défendu les consommateurs canadiens contre tout l’establishment politique. Aujourd’hui, tous les autres partis veulent m’exclure des Débats des chefs parce que je suis le seul qui dit quelque chose de différent et cela leur fait peur.pic.twitter.com/sNQeRWvUlB",57,151,10,1164341497602498561,https://twitter.com/MaximeBernier/status/1164341497602498561,2791988124,2019-08-22 01:00:20+00:00,Thu Aug 22 01:00:20 +0000 2019,,,,
MaximeBernier,,"Last September, I stood up in the HoC to defend Canadian consumers against the whole political establishment. Today, all the other parties want to shut me out of the Leaders’ Debates because I’m the only one who says something different and they’re afraid. #LetMaxSpeakpic.twitter.com/1NvKDVga9b",562,1232,108,1164335586385235969,https://twitter.com/MaximeBernier/status/1164335586385235969,2791988124,2019-08-22 00:36:50+00:00,Thu Aug 22 00:36:50 +0000 2019,,#LetMaxSpeakpic,,
AndrewScheer,,Too many Canadians feel like they are barely getting by and not getting ahead. @BrianForNepean and I will work everyday to put more money in your pockets. Because a dollar in the hands of someone who earned it is always better spent than by the gov't who taxed it.pic.twitter.com/j1bOq4fIoU,155,557,208,1164333445222457344,https://twitter.com/AndrewScheer/status/1164333445222457344,256360738,2019-08-22 00:28:20+00:00,Thu Aug 22 00:28:20 +0000 2019,@BrianForNepean,,,
AndrewScheer,,"Trop de Canadiens se sentent incapables d’améliorer leur quotidien. @BrianForNepean et moi travaillerons d’arrache-pied pour laisser plus d’argent dans vos poches. Un dollar est toujours mieux dépensé, par celui qui l’a durement gagné, que par le gouvernement qui l’a taxé.pic.twitter.com/ug51ZbTKbT",4,24,4,1164333430022254593,https://twitter.com/AndrewScheer/status/1164333430022254593,256360738,2019-08-22 00:28:16+00:00,Thu Aug 22 00:28:16 +0000 2019,@BrianForNepean,,,
