username,to,text,retweets,favorites,replies,id,permalink,author_id,date,formatted_date,mentions,hashtags,geo,urls
JustinTrudeau,PresidentRuvi,"Sophie and I are deeply saddened to hear of this, @PresidentRuvi. Canadians are thinking of you and Nechama, and wishing her a speedy recovery.https://twitter.com/PresidentRuvi/status/1113172844509364226 …",155,1187,263,1113222121289912322,https://twitter.com/JustinTrudeau/status/1113222121289912322,14260960,2019-04-02 23:30:11+00:00,Tue Apr 02 23:30:11 +0000 2019,@PresidentRuvi,,,https://twitter.com/PresidentRuvi/status/1113172844509364226
JustinTrudeau,PresidentRuvi,"Sophie et moi sommes profondément attristés d'apprendre cela, @PresidentRuvi. Les Canadiens pensent à vous et à Nechama et lui souhaitent un prompt rétablissement.https://twitter.com/PresidentRuvi/status/1113172844509364226 …",36,186,25,1113222090314924032,https://twitter.com/JustinTrudeau/status/1113222090314924032,14260960,2019-04-02 23:30:03+00:00,Tue Apr 02 23:30:03 +0000 2019,@PresidentRuvi,,,https://twitter.com/PresidentRuvi/status/1113172844509364226
AndrewScheer,,Shorter Justin Trudeau: Political interference in a criminal proceeding? A-OK. Recording a phone call? Unconscionable.,828,2807,228,1113219041307561986,https://twitter.com/AndrewScheer/status/1113219041307561986,256360738,2019-04-02 23:17:56+00:00,Tue Apr 02 23:17:56 +0000 2019,,,,
AndrewScheer,,Justin Trudeau en bref: L’ingérence politique dans une affaire criminelle? Pas de problème. Enregistrer un appel téléphonique? Déraisonnable.,15,62,7,1113218976987910144,https://twitter.com/AndrewScheer/status/1113218976987910144,256360738,2019-04-02 23:17:41+00:00,Tue Apr 02 23:17:41 +0000 2019,,,,
AndrewScheer,,"En chassant Jody Wilson-Raybould et Jane Philpott du caucus, les libéraux envoient un message clair aux Canadiens: Si vous dites la vérité, il n’y a pas de place pour vous au Parti libéral du Canada. Ma déclaration: https://www.facebook.com/AndrewScheerMP/photos/a.182719685095125/2578964408803962/?type=3&theater …pic.twitter.com/Y3s9HBDSoY",18,56,9,1113214457671499776,https://twitter.com/AndrewScheer/status/1113214457671499776,256360738,2019-04-02 22:59:43+00:00,Tue Apr 02 22:59:43 +0000 2019,,,,https://www.facebook.com/AndrewScheerMP/photos/a.182719685095125/2578964408803962/?type=3&theater
theJagmeetSingh,theJagmeetSingh,And now former Minister Jane Philpott has also been ejected from the Liberal caucus for speaking truth to power – this is how PM Trudeau thinks he can make the #SNCLavalinScandal go away – this is not leadership. #cdnpolihttps://twitter.com/theJagmeetSingh/status/1113207061079367682 …,302,1014,108,1113213099274850306,https://twitter.com/theJagmeetSingh/status/1113213099274850306,253340075,2019-04-02 22:54:20+00:00,Tue Apr 02 22:54:20 +0000 2019,,#SNCLavalinScandal #cdnpolihttps,,https://twitter.com/theJagmeetSingh/status/1113207061079367682
theJagmeetSingh,theJagmeetSingh,Nous apprenons que l’ancienne ministre Jane Philpott a aussi été éjectée du caucus libéral parce qu’elle a osé critiquer Justin Trudeau et son entourage. Justin Trudeau pense faire oublier le scandale d’ingérence de son bureau de cette façon. Quel manque de leadership.https://twitter.com/theJagmeetSingh/status/1113207045283635200 …,11,46,3,1113212985990946816,https://twitter.com/theJagmeetSingh/status/1113212985990946816,253340075,2019-04-02 22:53:53+00:00,Tue Apr 02 22:53:53 +0000 2019,,,,https://twitter.com/theJagmeetSingh/status/1113207045283635200
theJagmeetSingh,Puglaas,Ms. Wilson-Raybould wanted to do politics differently – putting integrity & what's right for Canadians over what helps the Liberals. Today PM Trudeau & the Liberal gov't showed us exactly what they think about integrity. Thank you Jody for being loyal to Cdns. You deserve better.https://twitter.com/Puglaas/status/1113195427992616960 …,956,3538,390,1113207061079367682,https://twitter.com/theJagmeetSingh/status/1113207061079367682,253340075,2019-04-02 22:30:20+00:00,Tue Apr 02 22:30:20 +0000 2019,,,,https://twitter.com/Puglaas/status/1113195427992616960
theJagmeetSingh,Puglaas,"Mme Wilson-Raybould voulait faire de la politique autrement : en plaçant l’intérêt du public devant celui du Parti libéral. Aujourd’hui, Justin Trudeau nous a montré exactement ce qu’il pense de l’intégrité. Merci Jody de votre loyauté envers les Canadien.nes. Vous méritez mieux.https://twitter.com/Puglaas/status/1113195427992616960 …",24,73,2,1113207045283635200,https://twitter.com/theJagmeetSingh/status/1113207045283635200,253340075,2019-04-02 22:30:16+00:00,Tue Apr 02 22:30:16 +0000 2019,,,,https://twitter.com/Puglaas/status/1113195427992616960
AndrewScheer,,"By kicking Jody Wilson-Raybould and Jane Philpott out of caucus, the Liberals have sent Canadians a clear message: If you tell the truth, there is no room for you in the Liberal Party of Canada. My full statement: https://www.facebook.com/AndrewScheerMP/photos/a.182719685095125/2578913755475694/?type=3&theater …pic.twitter.com/F9Dzglzjqm",1164,2926,590,1113206949535977477,https://twitter.com/AndrewScheer/status/1113206949535977477,256360738,2019-04-02 22:29:53+00:00,Tue Apr 02 22:29:53 +0000 2019,,,,https://www.facebook.com/AndrewScheerMP/photos/a.182719685095125/2578913755475694/?type=3&theater
JustinTrudeau,,I’m speaking at our National Caucus meeting in Ottawa tonight. Click here to watch live: https://bit.ly/2UabG8m,131,852,1234,1113203063467200517,https://twitter.com/JustinTrudeau/status/1113203063467200517,14260960,2019-04-02 22:14:27+00:00,Tue Apr 02 22:14:27 +0000 2019,,,,https://bit.ly/2UabG8m
JustinTrudeau,,Je prends la parole à la réunion du caucus national à Ottawa ce soir. Cliquez ici pour regarder en direct : https://bit.ly/2UabG8m,28,189,61,1113203031963779072,https://twitter.com/JustinTrudeau/status/1113203031963779072,14260960,2019-04-02 22:14:19+00:00,Tue Apr 02 22:14:19 +0000 2019,,,,https://bit.ly/2UabG8m
ElizabethMay,,I am honoured to have worked with such an incredible group of activists and lawmakers to make this happen. Thank you to @SenWillyMoore & @SenSincmurr for their leadership over the years and to everyone else who made this victory possible. We did it!,41,199,10,1113192656929161216,https://twitter.com/ElizabethMay/status/1113192656929161216,16220555,2019-04-02 21:33:06+00:00,Tue Apr 02 21:33:06 +0000 2019,@SenWillyMoore @SenSincmurr,,,
ElizabethMay,,"I am thrilled Bill #S203 has passed committee with no amendments! Thank you to the Liberal and NDP committee members for resisting pressure to stall this legislation. Now back to the House of Commons for the final hours of debate, then Royal Assent! #cdnpoli #FreeWillypic.twitter.com/cJerOaAmvK",291,922,39,1113192655469645825,https://twitter.com/ElizabethMay/status/1113192655469645825,16220555,2019-04-02 21:33:05+00:00,Tue Apr 02 21:33:05 +0000 2019,,#S203 #cdnpoli #FreeWillypic,,
AndrewScheer,,"If Liberals want to have a meeting to determine what to do with a member of their team that has caused damage to the Liberal Party, their meeting tonight should be about Justin Trudeau, not Jody Wilson-Raybould. 2/2",481,1932,109,1113192140627226624,https://twitter.com/AndrewScheer/status/1113192140627226624,256360738,2019-04-02 21:31:03+00:00,Tue Apr 02 21:31:03 +0000 2019,,,,
AndrewScheer,,"Liberal MPs are upset about the wrong thing. They are upset about how the truth came out, not what the truth is. The truth is that Justin Trudeau attempted to politically interfere in a criminal proceeding. 1/2",741,2495,141,1113192102664507394,https://twitter.com/AndrewScheer/status/1113192102664507394,256360738,2019-04-02 21:30:54+00:00,Tue Apr 02 21:30:54 +0000 2019,,,,
AndrewScheer,,"Si les libéraux veulent une réunion pour déterminer quoi faire avec un membre de leur équipe qui a causé des dommages au Parti libéral, leur réunion ce soir devrait porter sur Justin Trudeau, pas sur Jody Wilson-Raybould. 2/2",9,29,3,1113192057282203649,https://twitter.com/AndrewScheer/status/1113192057282203649,256360738,2019-04-02 21:30:43+00:00,Tue Apr 02 21:30:43 +0000 2019,,,,
AndrewScheer,,"Les députés libéraux sont mécontents pour la mauvaise raison. Ils n’aiment pas comment la vérité a été révélée, pas ce qu’elle est. La vérité est que Justin Trudeau a tenté de faire de l’ingérence politique dans une poursuite criminelle. 1/2",10,29,4,1113192021051752448,https://twitter.com/AndrewScheer/status/1113192021051752448,256360738,2019-04-02 21:30:34+00:00,Tue Apr 02 21:30:34 +0000 2019,,,,
AndrewScheer,,"Earlier today, the Liberal-dominated Justice Committee voted down our Conservative motion to hear from more witnesses on Justin Trudeau’s attempted interference in a criminal prosecution. Canadians are demanding answers, but instead Trudeau’s corruption cover-up continues.pic.twitter.com/qcNEXSyudn",220,433,85,1113175173480558592,https://twitter.com/AndrewScheer/status/1113175173480558592,256360738,2019-04-02 20:23:37+00:00,Tue Apr 02 20:23:37 +0000 2019,,,,
AndrewScheer,,"Plus tôt aujourd’hui, les libéraux du Comité de la justice ont voté contre notre motion pour entendre plus de témoins sur la tentative d’ingérence de Justin Trudeau dans une poursuite criminelle. Les Canadiens exigent des réponses, mais le camouflage de Trudeau continue.pic.twitter.com/JJseQKAB31",13,28,8,1113175165263917058,https://twitter.com/AndrewScheer/status/1113175165263917058,256360738,2019-04-02 20:23:35+00:00,Tue Apr 02 20:23:35 +0000 2019,,,,
AndrewScheer,,"Today, on the twelfth annual #WorldAutismAwarenessDay we come together in recognition of Canadians living with Autism and their families. It’s important the federal government ensures those with Autism and their families have the support they need.",32,164,44,1113150933985312770,https://twitter.com/AndrewScheer/status/1113150933985312770,256360738,2019-04-02 18:47:18+00:00,Tue Apr 02 18:47:18 +0000 2019,,#WorldAutismAwarenessDay,,
AndrewScheer,,"Aujourd’hui, en cette douzième #JournéeMondialeDeSensibilisationÀL’autisme, nous reconnaissons les Canadiens qui vivent avec l’autisme et leurs familles. Il est important que le gouvernement fédéral assure que ces gens et leurs familles aient le soutien dont ils ont besoin.",0,10,0,1113150876997349382,https://twitter.com/AndrewScheer/status/1113150876997349382,256360738,2019-04-02 18:47:05+00:00,Tue Apr 02 18:47:05 +0000 2019,,#JournéeMondialeDeSensibilisationÀL,,
AndrewScheer,,"Justin Trudeau is avoiding accountability in #QP today. But new evidence confirms Justin Trudeau has been misleading Canadians. Despite the evidence, Trudeau continues his cover-up. WATCH LIVE:https://www.pscp.tv/AndrewScheer/1mnxeONOYYqGX …",142,383,50,1113143880713682950,https://twitter.com/AndrewScheer/status/1113143880713682950,256360738,2019-04-02 18:19:17+00:00,Tue Apr 02 18:19:17 +0000 2019,,#QP,,https://www.pscp.tv/AndrewScheer/1mnxeONOYYqGX
AndrewScheer,,"Justin Trudeau évite la responsabilisation à la #PdQ aujourd’hui. De nouvelles preuves confirment que Justin Trudeau vous ment. Malgré les preuves, Trudeau continue son camouflage. EN DIRECT: https://www.pscp.tv/AndrewScheer/1mnxeONOYYqGX …",24,66,17,1113143865807179777,https://twitter.com/AndrewScheer/status/1113143865807179777,256360738,2019-04-02 18:19:13+00:00,Tue Apr 02 18:19:13 +0000 2019,,#PdQ,,https://www.pscp.tv/AndrewScheer/1mnxeONOYYqGX
JustinTrudeau,,"The #YouthSummit2019 will gather 300 young leaders who’ve served their communities for the better, to talk about what matters most to them. Want a chance to join us in Ottawa? Enter the Video Challenge and tell us why you’re #InspiredtoServe: https://bit.ly/2UiVml5",76,382,172,1113138736232062982,https://twitter.com/JustinTrudeau/status/1113138736232062982,14260960,2019-04-02 17:58:50+00:00,Tue Apr 02 17:58:50 +0000 2019,,#YouthSummit2019 #InspiredtoServe,,https://bit.ly/2UiVml5
JustinTrudeau,,Calling all young Canadians! Your leadership & ideas are critical as we work to make life better for everyone. That’s why we’re bringing hundreds of you together for the first-ever Canada Youth Summit: https://bit.ly/2UuL2Go #YouthSummit2019pic.twitter.com/TmnYpr5RNp,164,751,334,1113138734520823808,https://twitter.com/JustinTrudeau/status/1113138734520823808,14260960,2019-04-02 17:58:50+00:00,Tue Apr 02 17:58:50 +0000 2019,,#YouthSummit2019pic,,https://bit.ly/2UuL2Go
JustinTrudeau,,Le #SommetJeunesse2019 réunira 300 jeunes qui ont servi leur communauté afin de discuter de ce qui est important pour eux. Vous voulez nous rejoindre à Ottawa? Inscrivez-vous au Défi vidéo et dites-nous pourquoi vous êtes #InspiréÀServir : https://bit.ly/2TTbeq2,23,131,17,1113138550877442050,https://twitter.com/JustinTrudeau/status/1113138550877442050,14260960,2019-04-02 17:58:06+00:00,Tue Apr 02 17:58:06 +0000 2019,,#SommetJeunesse2019 #InspiréÀServir,,https://bit.ly/2TTbeq2
JustinTrudeau,,Appel à tous les jeunes Canadiens! Votre leadership et vos idées sont nécessaires pour améliorer la vie de tout le monde. C’est pourquoi on réunit des centaines d’entre vous pour le tout premier Sommet jeunesse du Canada : https://bit.ly/2I9Px2H #SommetJeunesse2019pic.twitter.com/jdy4YvTCsg,38,213,22,1113138548889325580,https://twitter.com/JustinTrudeau/status/1113138548889325580,14260960,2019-04-02 17:58:05+00:00,Tue Apr 02 17:58:05 +0000 2019,,#SommetJeunesse2019pic,,https://bit.ly/2I9Px2H
MaximeBernier,,"C2C Journal: “The New Hatemongers” Covington, Fort McMurray, Smollett, etc.: For social justice warriors attacking Western culture, the ends always justify the means. Hence the rise of “hate crime hoaxes,” exaggerated or invented incidents of racism.https://www.c2cjournal.ca/2019/03/the-new-hatemongers/ …",288,605,62,1113135279244750849,https://twitter.com/MaximeBernier/status/1113135279244750849,2791988124,2019-04-02 17:45:06+00:00,Tue Apr 02 17:45:06 +0000 2019,,,,https://www.c2cjournal.ca/2019/03/the-new-hatemongers/
JustinTrudeau,,"This is why we need #ClimateAction NOW, & a price on pollution is a key part of that. Our kids and grandkids are counting on us.https://www.thestar.com/politics/federal/2019/04/02/canada-warming-faster-than-the-rest-of-the-world-says-environment-canada.html?fbclid=IwAR2SiV7lvD_FRV5iuepq0Wgz0eGZJtlzqer8dvaVWoVb6qQa1bq8-9rHDmI …",748,2711,1344,1113103907788656642,https://twitter.com/JustinTrudeau/status/1113103907788656642,14260960,2019-04-02 15:40:26+00:00,Tue Apr 02 15:40:26 +0000 2019,,#ClimateAction,,https://www.thestar.com/politics/federal/2019/04/02/canada-warming-faster-than-the-rest-of-the-world-says-environment-canada.html?fbclid=IwAR2SiV7lvD_FRV5iuepq0Wgz0eGZJtlzqer8dvaVWoVb6qQa1bq8-9rHDmI
JustinTrudeau,,"Voilà pourquoi nous avons besoin d’ #actionclimat MAINTENANT, et mettre un prix sur la pollution est un élément clé de la solution. Nos enfants et petits-enfants comptent sur nous.https://ici.radio-canada.ca/nouvelle/1161815/rechauffement-climatique-climat-rapport-fuites …",52,236,60,1113103850267906048,https://twitter.com/JustinTrudeau/status/1113103850267906048,14260960,2019-04-02 15:40:13+00:00,Tue Apr 02 15:40:13 +0000 2019,,#actionclimat,,https://ici.radio-canada.ca/nouvelle/1161815/rechauffement-climatique-climat-rapport-fuites
theJagmeetSingh,,"Our plan for universal medication coverage for every single Canadian will save you money & ensure that everyone has access to the medicine they need. A patchwork, U.S. style system won't cut it. See our #Pharmacare for all plan here: https://www.ndp.ca/pharmacare #cdnpolipic.twitter.com/NWTfVA5tcw",117,325,25,1113090137645355008,https://twitter.com/theJagmeetSingh/status/1113090137645355008,253340075,2019-04-02 14:45:43+00:00,Tue Apr 02 14:45:43 +0000 2019,,#Pharmacare #cdnpolipic,,https://www.ndp.ca/pharmacare
theJagmeetSingh,,"Notre programme d’assurance-médicaments universelle va nous faire économiser de l’argent & garantir l’accès aux médicaments qu’il nous faut. Un système disparate inspiré des États-Unis, ça ne fonctionne pas.Notre plan pour l’assurance-médicaments est ici: https://www.npd.ca/assurance-medicaments …pic.twitter.com/P66qbUS0Pg",13,29,1,1113090130343026693,https://twitter.com/theJagmeetSingh/status/1113090130343026693,253340075,2019-04-02 14:45:41+00:00,Tue Apr 02 14:45:41 +0000 2019,,,,https://www.npd.ca/assurance-medicaments
AndrewScheer,,"Yesterday, in St. George, NB, @BlaineHiggs and I talked about the impact Justin Trudeau’s Carbon Tax will have on Canadians working hard to get by and get ahead. I will put more money in your pocket by cutting the GST from home heating and scrapping the carbon tax.pic.twitter.com/YF1FHSi0ho",54,183,56,1113080127171198977,https://twitter.com/AndrewScheer/status/1113080127171198977,256360738,2019-04-02 14:05:57+00:00,Tue Apr 02 14:05:57 +0000 2019,@BlaineHiggs,,,
AndrewScheer,,Hier à St. George (N.-B.) @BlaineHiggs et moi avons parlé de l’impact de la taxe sur le carbone de Justin Trudeau sur les Canadiens qui tentent d’améliorer leur quotidien. Je laisserai plus d’argent dans vos poches en éliminant la taxe sur le carbone et la TPS sur le chauffage.pic.twitter.com/GuL1zgCiLG,1,10,5,1113080120321945600,https://twitter.com/AndrewScheer/status/1113080120321945600,256360738,2019-04-02 14:05:55+00:00,Tue Apr 02 14:05:55 +0000 2019,@BlaineHiggs,,,
JustinTrudeau,,What we don’t want: Pollution & climate change What we do want: Clean air Strong communities A healthy planet for our kids A strong economy More $for Canadians Pricing pollution will get us there. Learn about how it'll work: https://bit.ly/2pxEMNb,918,6272,1274,1113074779462995973,https://twitter.com/JustinTrudeau/status/1113074779462995973,14260960,2019-04-02 13:44:42+00:00,Tue Apr 02 13:44:42 +0000 2019,,,,https://bit.ly/2pxEMNb
JustinTrudeau,,"On ne veut pas: Pollution et changement climatique On veut: Air propre Communautés fortes Planète en santé pour nos enfants Économie forte Plus de $pour les Canadiens Grâce au prix sur la pollution, on y arrivera. Voici les détails: https://bit.ly/2JZk1qS",52,332,36,1113074726405095424,https://twitter.com/JustinTrudeau/status/1113074726405095424,14260960,2019-04-02 13:44:29+00:00,Tue Apr 02 13:44:29 +0000 2019,,,,https://bit.ly/2JZk1qS
AndrewScheer,jamesbezan,"Gas prices have gone up thanks to Justin Trudeau’s Carbon Tax. This will make just about everything Canadians buy more expensive, from groceries to home heating. I will get rid of Trudeau’s Carbon Tax and help Canadians get ahead.https://twitter.com/jamesbezan/status/1112716526069731329 …",247,708,171,1113072014309363713,https://twitter.com/AndrewScheer/status/1113072014309363713,256360738,2019-04-02 13:33:42+00:00,Tue Apr 02 13:33:42 +0000 2019,,,,https://twitter.com/jamesbezan/status/1112716526069731329
AndrewScheer,jamesbezan,"Le prix de l’essence augmente à cause de la taxe sur le carbone de Justin Trudeau. Elle rendra tout ce que les Canadiens achètent plus cher, de l’épicerie au chauffage résidentiel. Je vais abolir la taxe sur le carbone de Trudeau et aider les Canadiens à améliorer leur quotidien.https://twitter.com/jamesbezan/status/1112716526069731329 …",5,20,6,1113072008147992576,https://twitter.com/AndrewScheer/status/1113072008147992576,256360738,2019-04-02 13:33:41+00:00,Tue Apr 02 13:33:41 +0000 2019,,,,https://twitter.com/jamesbezan/status/1112716526069731329
AndrewScheer,,I am pleased to join Canada's Sikh Community and Canadians across the country in celebrating Sikh Heritage Month. My statement: https://media.conservative.ca/en/statements/sikh-heritage-month …pic.twitter.com/F6RdQ31gWJ,8,39,10,1113066093214658560,https://twitter.com/AndrewScheer/status/1113066093214658560,256360738,2019-04-02 13:10:11+00:00,Tue Apr 02 13:10:11 +0000 2019,,,,https://media.conservative.ca/en/statements/sikh-heritage-month
AndrewScheer,,C’est un plaisir de me joindre à la communauté sikhe du Canada et aux Canadiens partout au pays pour célébrer le Mois du patrimoine sikh. Ma déclaration: https://media.conservative.ca/fr/statements/sikh-heritage-month …pic.twitter.com/fgkbfSGenx,0,6,2,1113066070720614400,https://twitter.com/AndrewScheer/status/1113066070720614400,256360738,2019-04-02 13:10:05+00:00,Tue Apr 02 13:10:05 +0000 2019,,,,https://media.conservative.ca/fr/statements/sikh-heritage-month
yfblanchet,,"Le mauvais feuilleton Wildon-Raybould-SNC-Lavalin ne sert plus du tout le bien commun. Ce tiraillage de ruelle permet surtout au Libéraux, Conservateurs et NPD, de ne pas parler laïcité et droit à l’autodétermination, en sacrifiant 3500 emplois au Québec.https://www.lapresse.ca/actualites/politique/politique-canadienne/201904/01/01-5220481-affaire-snc-lavalin-la-grogne-monte-envers-wilson-raybould.php …",14,24,1,1113015429423927296,https://twitter.com/yfblanchet/status/1113015429423927296,38262290,2019-04-02 09:48:51+00:00,Tue Apr 02 09:48:51 +0000 2019,,,,https://www.lapresse.ca/actualites/politique/politique-canadienne/201904/01/01-5220481-affaire-snc-lavalin-la-grogne-monte-envers-wilson-raybould.php
ElizabethMay,Garossino,"Liberals kept Harper's climate target. Even though Canada pushed for 1.5 degrees C in Paris, our target shoots right past it; and, no, we are not yet on track to reach weak Harper target. #GPChttps://twitter.com/Garossino/status/1112837942710493184 …",50,108,6,1112889552232804354,https://twitter.com/ElizabethMay/status/1112889552232804354,16220555,2019-04-02 01:28:40+00:00,Tue Apr 02 01:28:40 +0000 2019,,#GPChttps,,https://twitter.com/Garossino/status/1112837942710493184
yfblanchet,,"Le Canada, état pétrolier sans scrupules qui essaie d’acheter la respectabilité plutôt que d’engager la transition pour une nouvelle richesse, se réchauffe 2 fois plus vite que la planète qu’il intoxique. Si ce n’était pas dramatique, ce serait ironique.https://www.lapresse.ca/actualites/environnement/201904/01/01-5220442-climat-le-canada-se-rechauffe-deux-fois-plus-vite-que-le-reste-du-monde.php …",34,37,2,1112884461916639232,https://twitter.com/yfblanchet/status/1112884461916639232,38262290,2019-04-02 01:08:26+00:00,Tue Apr 02 01:08:26 +0000 2019,,,,https://www.lapresse.ca/actualites/environnement/201904/01/01-5220442-climat-le-canada-se-rechauffe-deux-fois-plus-vite-que-le-reste-du-monde.php
JustinTrudeau,SeamusORegan,"Today is an important day for Newfoundland and Labrador, and Canada. Together under our Atlantic Accord agreement, we’ll work to help grow the economy, develop natural resources responsibly, and create good middle class jobs for Newfoundlanders and Labradorians.https://twitter.com/SeamusORegan/status/1112848011770593285 …",138,786,205,1112874981283725312,https://twitter.com/JustinTrudeau/status/1112874981283725312,14260960,2019-04-02 00:30:46+00:00,Tue Apr 02 00:30:46 +0000 2019,,,,https://twitter.com/SeamusORegan/status/1112848011770593285
JustinTrudeau,SeamusORegan,"C’est un jour important pour Terre-Neuve-et-Labrador et le Canada. Dans le cadre de l'Accord atlantique, nous travaillerons à faire croître l'économie, à mettre en valeur nos ressources naturelles de façon responsable et à créer de bons emplois pour la classe moyenne de T.-N.-L.https://twitter.com/SeamusORegan/status/1112848011770593285 …",20,188,22,1112874853164634112,https://twitter.com/JustinTrudeau/status/1112874853164634112,14260960,2019-04-02 00:30:15+00:00,Tue Apr 02 00:30:15 +0000 2019,,,,https://twitter.com/SeamusORegan/status/1112848011770593285
