username,to,text,retweets,favorites,replies,id,permalink,author_id,date,formatted_date,mentions,hashtags,geo,urls
MaximeBernier,,Come meet me at a PPC rally next week in Kingston! Venez me rencontrer la semaine prochaine lors d’un rassemblement du PPC à Kingston!https://www.peoplespartyofcanada.ca/maxime_bernier_in_kingston …,95,203,13,1120464307131699200,https://twitter.com/MaximeBernier/status/1120464307131699200,2791988124,2019-04-22 23:08:02+00:00,Mon Apr 22 23:08:02 +0000 2019,,,,https://www.peoplespartyofcanada.ca/maxime_bernier_in_kingston
yfblanchet,SolutionsJFX,"Les projets actuels sont entièrement destinés à l’exportation, pas à nos besoins, activement entretenus au détriment des alternatives.",1,5,1,1120449033468825603,https://twitter.com/yfblanchet/status/1120449033468825603,38262290,2019-04-22 22:07:21+00:00,Mon Apr 22 22:07:21 +0000 2019,,,,
yfblanchet,IsabelleValle1,Vous m’aviez déjà exprimé être une « indépendantiste non-nationaliste » et vous militez activement contre le Bloc sur les réseaux sociaux. C’est vilain de prendre les gens pour des nonos,0,7,1,1120439450302058496,https://twitter.com/yfblanchet/status/1120439450302058496,38262290,2019-04-22 21:29:16+00:00,Mon Apr 22 21:29:16 +0000 2019,,,,
yfblanchet,pacem_sivis,"Mauvaise foi inspirée par ceux qui, surtout, ne veulent pas changer un système qui les enrichit. Le train et les nouveaux oléoducs ne sont pas destinés à notre consommation mais bien à l'exportation. Il faudra que vos mentors renouvellent le stock d'arguments.https://twitter.com/pacem_sivis/status/1120427103504273409 …",21,35,1,1120433905553817601,https://twitter.com/yfblanchet/status/1120433905553817601,38262290,2019-04-22 21:07:14+00:00,Mon Apr 22 21:07:14 +0000 2019,,,,https://twitter.com/pacem_sivis/status/1120427103504273409
yfblanchet,,J'ai eu le privilège de présider le @JourdelaTerreQc de 2003 à 2006. Un véhicule positif pour l'environnement et une approche de progrès et d'espoir. Un besoin plus que jamais. Le Québec peut remplacer le pétrole par l'économie durable. @BlocQuebecoishttp://www.blocquebecois.org/2019/04/jour-de-la-terre-nous-devons-nous-tenir-sur-un-pied-dalerte-environnementale-yves-francois-blanchet/ …,18,42,2,1120385816671531009,https://twitter.com/yfblanchet/status/1120385816671531009,38262290,2019-04-22 17:56:09+00:00,Mon Apr 22 17:56:09 +0000 2019,@JourdelaTerreQc @BlocQuebecoishttp,,,http://www.blocquebecois.org/2019/04/jour-de-la-terre-nous-devons-nous-tenir-sur-un-pied-dalerte-environnementale-yves-francois-blanchet/
JustinTrudeau,,Canada brings home the gold! Congratulations to the @RugbyCanada team – we’ll be cheering for you at @CanadaSevens next month. #RugbyCA @WorldRugby7shttps://www.thestar.com/sports/2019/04/21/canadian-women-win-rugby-sevens-title-on-road-to-olympics.html …,276,1615,125,1120383416199974913,https://twitter.com/JustinTrudeau/status/1120383416199974913,14260960,2019-04-22 17:46:36+00:00,Mon Apr 22 17:46:36 +0000 2019,@RugbyCanada @CanadaSevens @WorldRugby7shttps,#RugbyCA,,https://www.thestar.com/sports/2019/04/21/canadian-women-win-rugby-sevens-title-on-road-to-olympics.html
JustinTrudeau,,Le Canada remporte la médaille d’or! Félicitations à l’équipe @RugbyCanada; nous serons derrière vous au tournoi @CanadaSevens le mois prochain. #RugbyCA @WorldRugby7shttps://ici.radio-canada.ca/sports/1165523/rugby-7-feminin-canada-angleterre-series-mondiales-kitakyushu-ghislaine-landry?depuisRecherche=true …,38,223,18,1120383248553664513,https://twitter.com/JustinTrudeau/status/1120383248553664513,14260960,2019-04-22 17:45:56+00:00,Mon Apr 22 17:45:56 +0000 2019,@RugbyCanada @CanadaSevens @WorldRugby7shttps,#RugbyCA,,https://ici.radio-canada.ca/sports/1165523/rugby-7-feminin-canada-angleterre-series-mondiales-kitakyushu-ghislaine-landry?depuisRecherche=true
JustinTrudeau,,Congratulations to @ElizabethMay & John Kidder on your wedding day. Sophie and I wish you many years of happiness together!,196,2156,102,1120376131918626816,https://twitter.com/JustinTrudeau/status/1120376131918626816,14260960,2019-04-22 17:17:40+00:00,Mon Apr 22 17:17:40 +0000 2019,@ElizabethMay,,,
JustinTrudeau,,"Toutes nos félicitations pour votre mariage, @ElizabethMay et John Kidder. Sophie et moi vous souhaitons de nombreuses années de bonheur!",33,255,19,1120376051132194817,https://twitter.com/JustinTrudeau/status/1120376051132194817,14260960,2019-04-22 17:17:20+00:00,Mon Apr 22 17:17:20 +0000 2019,@ElizabethMay,,,
theJagmeetSingh,,Climate change is the single greatest threat we face & it’s time we start acting like it. We must make bold decisions to dramatically reduce emissions because there is no planet B – this is our home & a sustainable future is worth fighting for. #EarthDayhttps://www.ndp.ca/news/ndp-statement-earth-day-3 …,278,793,79,1120372624792723457,https://twitter.com/theJagmeetSingh/status/1120372624792723457,253340075,2019-04-22 17:03:43+00:00,Mon Apr 22 17:03:43 +0000 2019,,#EarthDayhttps,,https://www.ndp.ca/news/ndp-statement-earth-day-3
theJagmeetSingh,,"Il est temps de reconnaître que les changements climatiques sont la plus grande menace pour nous. Nous devons agir pour réduire drastiquement nos émissions, parce qu’il n’y a pas de planète B. Luttons ensemble pour un avenir durable. #JourdelaTerrehttps://www.npd.ca/nouvelles/declaration-du-npd-pour-le-jour-de-la-terre-0 …",12,43,0,1120372618476048385,https://twitter.com/theJagmeetSingh/status/1120372618476048385,253340075,2019-04-22 17:03:42+00:00,Mon Apr 22 17:03:42 +0000 2019,,#JourdelaTerrehttps,,https://www.npd.ca/nouvelles/declaration-du-npd-pour-le-jour-de-la-terre-0
MaximeBernier,,"Ottawa vire fou. Pour attirer la génération Harry Potter, le gouv cherche des Gryffindors, Serdaigles, Poufsouffles et Serpentards pour des postes de sorcellerie. Une «carrière magique» dans le Poudlard pour salaire de base de 57k$/an. Pas une blague. https://emploisfp-psjobs.cfp-psc.gc.ca/psrs-srfp/applicant/page1800?poster=1279695&toggleLanguage=fr …",55,107,20,1120364115233574912,https://twitter.com/MaximeBernier/status/1120364115233574912,2791988124,2019-04-22 16:29:55+00:00,Mon Apr 22 16:29:55 +0000 2019,,,,https://emploisfp-psjobs.cfp-psc.gc.ca/psrs-srfp/applicant/page1800?poster=1279695&toggleLanguage=fr
MaximeBernier,,"Ottawa is going nuts. To attract the Harry Potter generation, gov is looking for Gryffindors, Ravenclaws, Hufflepuffs and Slytherins to join the Hogwarts in a wizardry position. A starting salary of $57k for a “magical career.” This is not a joke. https://emploisfp-psjobs.cfp-psc.gc.ca/psrs-srfp/applicant/page1800?poster=1279695 …",637,1252,292,1120362003774701572,https://twitter.com/MaximeBernier/status/1120362003774701572,2791988124,2019-04-22 16:21:31+00:00,Mon Apr 22 16:21:31 +0000 2019,,,,https://emploisfp-psjobs.cfp-psc.gc.ca/psrs-srfp/applicant/page1800?poster=1279695
yfblanchet,,pic.twitter.com/j5IO6Q4u36,13,22,0,1120354191623491584,https://twitter.com/yfblanchet/status/1120354191623491584,38262290,2019-04-22 15:50:29+00:00,Mon Apr 22 15:50:29 +0000 2019,,,,
ElizabethMay,,Thanks to my friend Sue Earle for making my wedding dress! #EarthDay2019 #saltspring #GPChttps://beta.ctvnews.ca/national/canada/2019/4/22/1_4388863.html …,32,397,33,1120352601407508481,https://twitter.com/ElizabethMay/status/1120352601407508481,16220555,2019-04-22 15:44:09+00:00,Mon Apr 22 15:44:09 +0000 2019,,#EarthDay2019 #saltspring #GPChttps,,https://beta.ctvnews.ca/national/canada/2019/4/22/1_4388863.html
AndrewScheer,,I want to wish @ElizabethMay and John Kidder all the best on their wedding day. Congratulations to you both.,28,387,17,1120348797392044034,https://twitter.com/AndrewScheer/status/1120348797392044034,256360738,2019-04-22 15:29:03+00:00,Mon Apr 22 15:29:03 +0000 2019,@ElizabethMay,,,
AndrewScheer,,Je tiens à souhaiter à @ElizabethMay et John Kidder le plus grand bonheur à l'occasion de leur mariage. Félicitations à tous les deux.,3,18,1,1120348660347412480,https://twitter.com/AndrewScheer/status/1120348660347412480,256360738,2019-04-22 15:28:30+00:00,Mon Apr 22 15:28:30 +0000 2019,@ElizabethMay,,,
ElizabethMay,SusanDelacourt,Thanks so much! One of my last chances to tweet before John takes away my BlackBerry for the duration of our honeymoon! #mybigfatgreenwedding #GPAhttps://twitter.com/SusanDelacourt/status/1120292358464200704 …,105,1107,74,1120348597130711041,https://twitter.com/ElizabethMay/status/1120348597130711041,16220555,2019-04-22 15:28:15+00:00,Mon Apr 22 15:28:15 +0000 2019,,#mybigfatgreenwedding #GPAhttps,,https://twitter.com/SusanDelacourt/status/1120292358464200704
ElizabethMay,hannahbethbell,Thank you. So many mixed emotions after our tragic Friday. Much love to all grieving the loss of Josh. And - of course- the best wedding present will be a Green government in PEI!https://twitter.com/hannahbethbell/status/1120292661242552321 …,26,204,3,1120348139557249025,https://twitter.com/ElizabethMay/status/1120348139557249025,16220555,2019-04-22 15:26:26+00:00,Mon Apr 22 15:26:26 +0000 2019,,,,https://twitter.com/hannahbethbell/status/1120292661242552321
yfblanchet,,"Dans mon souvenir, dans le respect de la liberté d'expression, la soi-disant blague a indigné au moins ces deux-tiers des Québécois qui appuient la laïcité de l'État. Imaginez une blague semblable par un ancien candidat nationaliste, même progressiste...!?https://ici.radio-canada.ca/nouvelle/1164665/politique-eve-torres-notre-dame-montreal-facebook-quebec-solidaire?fbclid=IwAR3352qUlKF9aYhkUEPoT52EExsUxVbZ0L2ugv9pLVNmy--VdBac67i9ehY …",48,81,16,1120339838874673154,https://twitter.com/yfblanchet/status/1120339838874673154,38262290,2019-04-22 14:53:27+00:00,Mon Apr 22 14:53:27 +0000 2019,,,,https://ici.radio-canada.ca/nouvelle/1164665/politique-eve-torres-notre-dame-montreal-facebook-quebec-solidaire?fbclid=IwAR3352qUlKF9aYhkUEPoT52EExsUxVbZ0L2ugv9pLVNmy--VdBac67i9ehY
AndrewScheer,NanaimoBulletin,Canadians right now are struggling to get ahead and concerned about safety in their communities. Last weekend in Nanaimo-Ladysmith @JohnHirst2019 and I talked about how a Conservative gov't will focus on creating a safer Canada and the opportunities Canadians need to get ahead.https://twitter.com/NanaimoBulletin/status/1117554512313454592 …,94,318,102,1120333787114737669,https://twitter.com/AndrewScheer/status/1120333787114737669,256360738,2019-04-22 14:29:24+00:00,Mon Apr 22 14:29:24 +0000 2019,@JohnHirst2019,,,https://twitter.com/NanaimoBulletin/status/1117554512313454592
AndrewScheer,NanaimoBulletin,"Les Canadiens luttent et s’inquiètent de la sécurité de leurs communautés. Cette fin de semaine dans Nanaimo-Ladysmith, @JohnHirst2019 et moi avons dit comment un gouvernement conservateur rendra le Canada plus sécuritaire et créera les possibilités dont les Canadiens ont besoin.https://twitter.com/NanaimoBulletin/status/1117554512313454592 …",3,24,5,1120333659779866625,https://twitter.com/AndrewScheer/status/1120333659779866625,256360738,2019-04-22 14:28:53+00:00,Mon Apr 22 14:28:53 +0000 2019,@JohnHirst2019,,,https://twitter.com/NanaimoBulletin/status/1117554512313454592
MaximeBernier,,It’s time to get rid of the old parties and bring real change in Ottawa! Show your support for @JenniferMClarke in the May 6 Nanaimo-Ladysmith by-election. Volunteer and donate to her campaign: https://www.jennifermclarke.ca You can make a difference! #PPC2019pic.twitter.com/FaJb43UxNa,128,312,11,1120324740504260614,https://twitter.com/MaximeBernier/status/1120324740504260614,2791988124,2019-04-22 13:53:27+00:00,Mon Apr 22 13:53:27 +0000 2019,@JenniferMClarke,#PPC2019pic,,https://www.jennifermclarke.ca
JustinTrudeau,,We’re taking action to fight climate change & protect our environment by: Putting a price on pollution Phasing out coal Reducing plastics in our oceans Investing in cleaner transit Conserving green spaces Making zero-emission cars more affordable #EarthDay,567,3301,576,1120318083686653954,https://twitter.com/JustinTrudeau/status/1120318083686653954,14260960,2019-04-22 13:27:00+00:00,Mon Apr 22 13:27:00 +0000 2019,,#EarthDay,,
JustinTrudeau,,We only have one planet. Our kids are counting on us to keep it clean and healthy. #EarthDaypic.twitter.com/j7CEIuJbos,1245,7240,692,1120318080079601665,https://twitter.com/JustinTrudeau/status/1120318080079601665,14260960,2019-04-22 13:26:59+00:00,Mon Apr 22 13:26:59 +0000 2019,,#EarthDaypic,,
JustinTrudeau,,Nos mesures pour améliorer l’environnement : Mettre un prix sur la pollution Éliminer le charbon Réduire les plastiques dans l’océan Investir dans les transports en commun plus propres Conserver les espaces verts Rendre les véhicules zéro émission plus abordables,65,361,26,1120317891868491776,https://twitter.com/JustinTrudeau/status/1120317891868491776,14260960,2019-04-22 13:26:14+00:00,Mon Apr 22 13:26:14 +0000 2019,,,,
JustinTrudeau,,Nous n’avons qu’une seule planète. Nos enfants comptent sur nous pour la garder propre et en santé. #JourDeLaTerrepic.twitter.com/YNzhyBN2oa,84,545,32,1120317889574264834,https://twitter.com/JustinTrudeau/status/1120317889574264834,14260960,2019-04-22 13:26:14+00:00,Mon Apr 22 13:26:14 +0000 2019,,#JourDeLaTerrepic,,
yfblanchet,,"La lucidité sera de prévenir en effet en outillant la sécurité civile et en incitant les gens s’installer autre part, mais surtout en admettant le rôle du réchauff. planétaire et de la combustion du gaz et du pétrole. Or on veut en augmenter le commerce...http://plus.lapresse.ca/screens/dad72a20-c4c0-445d-8a8e-e9e001158359__7C___0.html?utm_medium=Twitter&utm_campaign=Internal+Share&utm_content=Screen …",9,13,0,1120316392782344194,https://twitter.com/yfblanchet/status/1120316392782344194,38262290,2019-04-22 13:20:17+00:00,Mon Apr 22 13:20:17 +0000 2019,,,,http://plus.lapresse.ca/screens/dad72a20-c4c0-445d-8a8e-e9e001158359__7C___0.html?utm_medium=Twitter&utm_campaign=Internal+Share&utm_content=Screen
MaximeBernier,Bernier_Nation,Ils sont complètement silencieux. Aucune analyse poussée des déclarations officielles. Et ils ne vont pas passer des semaines à dénoncer la «christianophobie» et nous mettre en garde contre l’islamisme. Ça n’aide juste pas leur cause idéologique. Hypocrites dégueulasses.https://twitter.com/Bernier_Nation/status/1120004898765115393 …,65,170,15,1120312864080896000,https://twitter.com/MaximeBernier/status/1120312864080896000,2791988124,2019-04-22 13:06:15+00:00,Mon Apr 22 13:06:15 +0000 2019,,,,https://twitter.com/Bernier_Nation/status/1120004898765115393
JustinTrudeau,,Please read my full statement on the results of the Ukrainian presidential election:https://pm.gc.ca/eng/news/2019/04/21/statement-prime-minister-results-ukrainian-presidential-election …,74,229,34,1120311145611526144,https://twitter.com/JustinTrudeau/status/1120311145611526144,14260960,2019-04-22 12:59:26+00:00,Mon Apr 22 12:59:26 +0000 2019,,,,https://pm.gc.ca/eng/news/2019/04/21/statement-prime-minister-results-ukrainian-presidential-election
JustinTrudeau,,Lisez ma déclaration sur les résultats de l’élection présidentielle en Ukraine :https://pm.gc.ca/fra/nouvelles/2019/04/21/declaration-du-premier-ministre-les-resultats-de-lelection-presidentielle …,12,84,3,1120310910990659589,https://twitter.com/JustinTrudeau/status/1120310910990659589,14260960,2019-04-22 12:58:30+00:00,Mon Apr 22 12:58:30 +0000 2019,,,,https://pm.gc.ca/fra/nouvelles/2019/04/21/declaration-du-premier-ministre-les-resultats-de-lelection-presidentielle
MaximeBernier,Bernier_Nation,They’ve all been completely silent. No fancy analysis of wording in statements. And they won’t spend the coming weeks hysterically denouncing “Christianophobia” and warning about the Islamist threat. This massacre just doesn’t fit their narrative. Disgusting hypocrites.https://twitter.com/Bernier_Nation/status/1120004898765115393 …,1505,3817,128,1120310767042084864,https://twitter.com/MaximeBernier/status/1120310767042084864,2791988124,2019-04-22 12:57:55+00:00,Mon Apr 22 12:57:55 +0000 2019,,,,https://twitter.com/Bernier_Nation/status/1120004898765115393
ElizabethMay,,Attacks on churches in Sri Lanka on Easter Sunday are horrific. Violent terrorism targeting innocents must be condemned in strongest terms. #GPC #SriLankaAttacks,32,110,12,1120161096789159937,https://twitter.com/ElizabethMay/status/1120161096789159937,16220555,2019-04-22 03:03:11+00:00,Mon Apr 22 03:03:11 +0000 2019,,#GPC #SriLankaAttacks,,
AndrewScheer,,Happy 93rd birthday to Her Majesty Queen Elizabeth II. Long may she reign!,289,2143,157,1120143060342583301,https://twitter.com/AndrewScheer/status/1120143060342583301,256360738,2019-04-22 01:51:31+00:00,Mon Apr 22 01:51:31 +0000 2019,,,,
AndrewScheer,,Joyeux 93e anniversaire à Sa Majesté la Reine Elizabeth II. Qu’elle puisse régner encore longtemps!,6,52,7,1120143034400813056,https://twitter.com/AndrewScheer/status/1120143034400813056,256360738,2019-04-22 01:51:25+00:00,Mon Apr 22 01:51:25 +0000 2019,,,,
JustinTrudeau,,Thank you to the Canadians who are observers in the presidential elections in Ukraine - your commitment and hard work are important in supporting Ukrainian democracy.,185,1691,96,1120119444733333504,https://twitter.com/JustinTrudeau/status/1120119444733333504,14260960,2019-04-22 00:17:41+00:00,Mon Apr 22 00:17:41 +0000 2019,,,,
JustinTrudeau,,"Congratulations to Volodymyr Zelenskiy on the results of the Ukrainian presidential election. I’m looking forward to working with you to continue strengthening the ties between Canada & Ukraine, and creating more opportunities for people in both our countries.",391,2691,232,1120119443177312256,https://twitter.com/JustinTrudeau/status/1120119443177312256,14260960,2019-04-22 00:17:40+00:00,Mon Apr 22 00:17:40 +0000 2019,,,,
JustinTrudeau,,Merci aux Canadiens qui agissent à titre d’observateurs dans le cadre de l’élection présidentielle en Ukraine; votre dévouement et votre excellent travail sont importants pour la démocratie en Ukraine.,42,382,5,1120118898685304832,https://twitter.com/JustinTrudeau/status/1120118898685304832,14260960,2019-04-22 00:15:30+00:00,Mon Apr 22 00:15:30 +0000 2019,,,,
JustinTrudeau,,Félicitations à Volodymyr Zelenskiy pour le résultat de l’élection présidentielle en Ukraine. J’ai hâte de travailler avec vous pour continuer de renforcer les liens entre le Canada et l’Ukraine et de créer des opportunités pour les peuples de nos pays.,65,544,22,1120118896479043587,https://twitter.com/JustinTrudeau/status/1120118896479043587,14260960,2019-04-22 00:15:30+00:00,Mon Apr 22 00:15:30 +0000 2019,,,,
